video_title,video_id,comment_id,comment_date,updated_date,commenter_url,commenter_name,like_count,top_level_comment_num,top_level_comment,comment_reply
"""Third Presidential Debate""",smkyorC5qwc,z133e3dhnwj2zhe5004celtx1zqzdhuiiok0k.1478297722043222,2016-11-04T22:15:22.000Z,2016-11-04T22:15:22.000Z,http://www.youtube.com/channel/UCsRtJk2jiD3PR4ZOXQhgNqg,stormy,0, - , - ,"The trump is just a fraud and a big liar runing his big mouth to say 
anything but the truth. All republicans are just the same supremacist 
bullshit. They are just a bunch of bigots and racist fearmongering."
"""Third Presidential Debate""",smkyorC5qwc,z133e3dhnwj2zhe5004celtx1zqzdhuiiok0k.1478293213286399,2016-11-04T21:00:13.000Z,2016-11-04T21:09:18.000Z,http://www.youtube.com/channel/UC7pDTHvCVeVeWv0Sp2L0ZcA,Karen V,0, - , - ,"HAHAHA...Really? Let me know what you think of Hillary after you look at 
this link. Do some research stormy, Hillary is the one that got a pedophile 
acquitted then publicly laughed about it. 

http://www.snopes.com/clinton-byrd-photo-klan/"
"""Third Presidential Debate""",smkyorC5qwc,z12nyt1ycljuyvrpa04cefg4mvi3yxd5lrs0k,2016-11-27T05:09:51.000Z,2016-11-27T05:09:51.000Z,http://www.youtube.com/channel/UCNqGaosyFrObQQveIwe2DdA,Jon S,0,272,"Notice how she looks down when talking about ""Haiti""..and how much she 
contributed she's so full of lies can't even looks straight on the cameras 
or in the audience or host's eyes..Pathetic!﻿", - 
"""Third Presidential Debate""",smkyorC5qwc,z12qsvrihnjxerth504cftjr4u3pfvwaibs,2016-12-03T23:33:43.000Z,2016-12-03T23:33:43.000Z,http://www.youtube.com/channel/UC5q5a4JYPhFK3sn6UMvXG_w,Antwi Lawrence,0,273,good﻿, - 
"""Third Presidential Debate""",smkyorC5qwc,z12wt1rjbmelwl5yk04cetwzknyctpp4qsk0k,2016-12-01T02:26:16.000Z,2016-12-01T02:26:16.000Z,http://www.youtube.com/channel/UCPJeKsKzOrepZhl2BNBpgbQ,emmalinagreena,0,274,TRUMP#2016﻿, - 
"""Third Presidential Debate""",smkyorC5qwc,z130fziq5terhvypg04cdjd4bkewib3xpms0k,2016-11-08T22:06:18.000Z,2016-11-08T22:06:18.000Z,http://www.youtube.com/channel/UCT7gTF-ac43hB_y6bRmY7og,Zynderquil,2,275,"Am I the only one who is annoyed by the fact that Trump's mic is uneven 
when Hillary's is perfect placed in the center?﻿", - 
"""Third Presidential Debate""",smkyorC5qwc,z130fziq5terhvypg04cdjd4bkewib3xpms0k.1478670786812897,2016-11-09T05:53:06.000Z,2016-11-09T05:53:06.000Z,http://www.youtube.com/channel/UCezDAYkpirhloybgKJnDO2w,M Mary,0, - , - ,Do you have OCD?
"""Third Presidential Debate""",smkyorC5qwc,z13ixdmzsyyttz1xw04chr3izqf0iv2phns0k,2016-10-27T02:51:36.000Z,2016-10-27T02:51:36.000Z,http://www.youtube.com/channel/UCz3F9eK6AR_laDiSfm2ZsHw,Bhe Tan,2,276,"congratulations madam,your a winner....﻿", - 
"""Third Presidential Debate""",smkyorC5qwc,z13ixdmzsyyttz1xw04chr3izqf0iv2phns0k.1477539790675970,2016-10-27T03:43:10.000Z,2016-10-27T03:43:10.000Z,http://www.youtube.com/channel/UCrCAs9q7UhO3VIroUHiMwmA,TheBookWorm1718,20, - , - ,You misspelled whiner.
"""Third Presidential Debate""",smkyorC5qwc,z13hgpli4uuqyxiqq04cht0gjvrkgthx1ys0k,2016-10-27T05:06:09.000Z,2016-10-27T05:06:09.000Z,http://www.youtube.com/channel/UCnuC797HxDG7VGEx0uv_Huw,Dharma96,1,277,Hillary Clinton makes more sense than Trump.﻿, - 
"""Third Presidential Debate""",smkyorC5qwc,z13hgpli4uuqyxiqq04cht0gjvrkgthx1ys0k.1477640523976545,2016-10-28T07:42:03.000Z,2016-10-28T07:42:03.000Z,http://www.youtube.com/channel/UCjLLZWBiY4QoWoMYnGGrHwg,Brennan Hargraves,3, - , - ,because she's a politician . (lies)
"""Third Presidential Debate""",smkyorC5qwc,z13fszcbpmrjc31za04cjl4i0oq2tb4o0pw0k,2016-11-04T23:50:58.000Z,2016-11-04T23:50:58.000Z,http://www.youtube.com/channel/UCXGBNcfRyIfiPKLRYJ6KYRQ,TheSpike1,8,278,"Please take the time to read this, like to show that you still care




If you have any emotions as a human left, don't vote for trump. I am 
Hispanic and my parents came from Mexico because they had to look for a 
job. They were separated from their grand parents and parents for many 
years, and now their grandparents can't even come and visit us, not even my 
uncle! My parents will end up being deported leaving me, my sister and my 
pet helpless with no food, water, or money. I may very likely be spending 
my time living in my school. That's not all, over 5,000,000 kids will be 
left alone with no one to help them. Even if we do get help, we will still 
be separated from our loving parents. And over 300 people have said that 
they will commit suicide if trump wins. Not to mention the other deaths 
caused by homeless children and innocent immigrants who have lost 
everything they have worked for. My mom has worked for Allstate for 13 
years and has recently opened up her own agency with Allstate after 4 years 
of school, traveling, and work. My dad has helped many Americans with work 
and projects as well not criticize anyone even if they are racist, 
American, or African American. My mom tries to save lives and supports many 
organizations and has donated thousands of dollars to programs trying to 
save lives.Also think about it, Abraham Lincoln tried his best to keep this 
country together but got killed for his efforts.Martin Luther King Jr. not 
only helped fight for equal rights for African Americans, but Mexicans, 
Hispanics, Muslims, women, and other immigrants who were struggling getting 
a better life.Do you really want a president who is a racist jerk who only 
cares about his own personal gain? I do agree that there are some bad 
people that do some bad crimes, but you don't see trump putting all the 
American criminals and serial killers in jail! Choose what is right. The 
fate of America and millions of lives rests in your hands. You can be a 
hero or a villain. You hold the power. Choose what's right.



#DumpTrump #HillaryForPresident﻿", - 
"""Third Presidential Debate""",smkyorC5qwc,z13fszcbpmrjc31za04cjl4i0oq2tb4o0pw0k.1478389385600962,2016-11-05T23:43:05.000Z,2016-11-05T23:43:05.000Z,http://www.youtube.com/channel/UCXGBNcfRyIfiPKLRYJ6KYRQ,TheSpike1,2, - , - ,"Steve Richardson not all of their parents did crimes, my parents have 
helped people and now they are losing everything, even if they come legally 
they will still be deported. Plus imagine if you were those kids, how would 
you feel?"
"""Third Presidential Debate""",smkyorC5qwc,z12zffbzhyicip0fc22vwxjgnnumdp30w,2016-11-09T02:19:12.000Z,2016-11-09T02:19:12.000Z,http://www.youtube.com/channel/UCETJ_rI_rxtQ8IY33IuKzMg,Pro gamer Leo,1,279,I hate trump he is rude just hear what he says﻿, - 
"""Third Presidential Debate""",smkyorC5qwc,z12zffbzhyicip0fc22vwxjgnnumdp30w.1478663269108574,2016-11-09T03:47:49.000Z,2016-11-09T03:47:49.000Z,http://www.youtube.com/channel/UCpppxkIDg3KX6o1zU5pMHJw,Dan Hurd,1, - , - ,hate him? for being rude? a bit drastic I'd say
"""Third Presidential Debate""",smkyorC5qwc,z13wszhiwquahhiw204cjlthazfjz504fj0,2016-11-30T15:24:13.000Z,2016-11-30T15:24:13.000Z,http://www.youtube.com/channel/UCbzqfo6Azdh-IKN98PwPAwA,News CBC,0,280,great﻿, - 
"""Third Presidential Debate""",smkyorC5qwc,z12gyn0xwyu4z5hm422ctb0ocs2ihzvxo04,2016-10-26T15:48:02.000Z,2016-10-26T15:48:02.000Z,http://www.youtube.com/channel/UCFq-5r8-f2X2p-nJQTVGedg,desertroot.,3,281,"Donald and his people are wrong about everything, cause they are lieng 
about everything. They are just hypocrites, racist, bigots and idiots.﻿", - 
"""Third Presidential Debate""",smkyorC5qwc,z12gyn0xwyu4z5hm422ctb0ocs2ihzvxo04.1477504952659119,2016-10-26T18:02:32.000Z,2016-10-26T18:02:32.000Z,http://www.youtube.com/channel/UCrCAs9q7UhO3VIroUHiMwmA,TheBookWorm1718,0, - , - ,"Oh, Hillary never lies? Okay, explain Bosnia, you DO know her Bosnia story, 
don't you? Everybody does."
"""Third Presidential Debate""",smkyorC5qwc,z12mdnvq2neftrdzq04cffwrstfdujjr2bg,2016-11-05T20:30:57.000Z,2016-11-05T20:30:57.000Z,http://www.youtube.com/channel/UCAllF_z3jSzFuJ0NUGKGT3w,move over,0,282,"That sexual predator trump is just a russian agent who has corrupted even 
the FBI.﻿", - 
"""Third Presidential Debate""",smkyorC5qwc,z12mdnvq2neftrdzq04cffwrstfdujjr2bg.1478378646835682,2016-11-05T20:44:06.000Z,2016-11-05T20:44:06.000Z,http://www.youtube.com/channel/UCPRW8bAjTrSDBvlN68yONoA,KnucklesUp,1, - , - ,wtf? lol
"""Third Presidential Debate""",smkyorC5qwc,z124v3iilznjspjwj04cffkzdtflj5nzb34,2016-12-01T20:58:32.000Z,2016-12-01T20:58:32.000Z,http://www.youtube.com/channel/UCQBO_izPW2WO4N7MgDIBR4A,MrAkaalis,0,283,"Trump literally treated Hillary in this debate as both a bitch... and a 
punching bag...﻿", - 
"""Third Presidential Debate""",smkyorC5qwc,z12cflji1mzgtfbgy04cj52bwzmlgnyw4lw0k,2016-12-02T03:12:42.000Z,2016-12-02T03:12:42.000Z,http://www.youtube.com/channel/UCrVrgDEQYzY1jRoV8TnZUTw,norm8859,0,284,LOVE IT! HATE that lying bitch.﻿, - 
"""Third Presidential Debate""",smkyorC5qwc,z13ijtn5jkymu2l0ktjcypcjjqb1gmec,2016-10-30T06:34:34.000Z,2016-10-30T06:34:34.000Z,http://www.youtube.com/channel/UCY7TMg72Is9Kswah79ZfbrQ,THEGRUNGEMENACE,1,285,TRUMP IS A RAPIST! - AND HE'S NO GOOD FOR THE ECONOMY!﻿, - 
"""Third Presidential Debate""",smkyorC5qwc,z13ijtn5jkymu2l0ktjcypcjjqb1gmec.1478204836100713,2016-11-03T20:27:16.000Z,2016-11-03T20:27:16.000Z,http://www.youtube.com/channel/UCY7TMg72Is9Kswah79ZfbrQ,THEGRUNGEMENACE,1, - , - ,+NC Quadraxis   Truth.  
"""Third Presidential Debate""",smkyorC5qwc,z13ijtn5jkymu2l0ktjcypcjjqb1gmec.1477868366398647,2016-10-30T22:59:26.000Z,2016-10-30T22:59:26.000Z,http://www.youtube.com/channel/UCY7TMg72Is9Kswah79ZfbrQ,THEGRUNGEMENACE,1, - , - ,"TRUMP IS A RAPIST AND HE'S HAD MANY FAILED BUSINESS VENTURES AND HE KNOWS 
NOTHING ABOUT POLITICS.  You're so STUPID!"
"""Third Presidential Debate""",smkyorC5qwc,z120j5xrovrywfipb04cjn4j1veje3gitds,2016-12-01T00:57:40.000Z,2016-12-01T00:57:40.000Z,http://www.youtube.com/channel/UCTfy4KnwF6XsDb8uvHNScnw,Xenox,0,286,"Hillary said and leaked classified information that there ""4 minutes to 
launch Nukes"" IDIOT!﻿", - 
"""Third Presidential Debate""",smkyorC5qwc,z13gvvuorsaofx403232cfhztpb4ubto004,2016-11-06T04:49:28.000Z,2016-11-06T04:49:28.000Z,http://www.youtube.com/channel/UC5lzR3_fZWJNB2pgKq6fEAw,The one,1,287,"Trump is an idiot with no wisdom. He even brags about being a sexual 
predator.﻿", - 
"""Third Presidential Debate""",smkyorC5qwc,z13gvvuorsaofx403232cfhztpb4ubto004.1478410822883368,2016-11-06T05:40:22.000Z,2016-11-06T05:40:22.000Z,http://www.youtube.com/channel/UCrCAs9q7UhO3VIroUHiMwmA,TheBookWorm1718,0, - , - ,"So it's okay to do it for 40 years like Bill just as long as you say 'I did 
NOT'? And it's okay to defend rapists for 40 years like Hillary has, and 
attack the victims? Oh but she said every rape victim SHOULD be believed, 
what happened to that?"
"""Third Presidential Debate""",smkyorC5qwc,z13hh5xhlkfnydqwe04cfznxmpqdyxy4wfs,2016-10-31T16:45:16.000Z,2016-10-31T16:46:46.000Z,http://www.youtube.com/channel/UCkxEU8-H7jwbeA4tcHcq6Pg,coming up,1,288,"That trump and his supporters are just idiots supporting charlatans, a 
women abusers, and a sexual preadators.﻿", - 
"""Third Presidential Debate""",smkyorC5qwc,z13hh5xhlkfnydqwe04cfznxmpqdyxy4wfs.1477935946941526,2016-10-31T17:45:46.000Z,2016-10-31T17:45:46.000Z,http://www.youtube.com/channel/UCrCAs9q7UhO3VIroUHiMwmA,TheBookWorm1718,2, - , - ,"As usual deaf, dumb and dumber to Bill Clinton's 40+ year history of rape 
accusations and remember Hillary said rape victims should ALWAYS be 
believed, so we SHOULD believe he's been raping women and getting away with 
it ever since his college days, which in fact ENDED his college days when 
he got thrown out after a rape accusation."
"""Third Presidential Debate""",smkyorC5qwc,z12gv15z0ye4i1k0y22oyfxqkxmcsfpwb04,2016-11-11T05:18:10.000Z,2016-11-11T05:18:10.000Z,http://www.youtube.com/channel/UCj2S0-na4s_HVbPENDEbTIw,Jackie,0,289,"It's kind of hilarious how almost exactly 20 minutes in Trump starts to 
lose the grownup act and reverts back to acting like a jittery 5 year old. 
He can't even sit still for half an hour. It's awesome that he's going to 
be sitting in a room for hours negotiating with world leaders, making deals 
and defending our country. Thanks America.﻿", - 
"""Third Presidential Debate""",smkyorC5qwc,z12gv15z0ye4i1k0y22oyfxqkxmcsfpwb04.1478983062425086,2016-11-12T20:37:42.000Z,2016-11-12T20:37:42.000Z,http://www.youtube.com/channel/UCIxtASXr4w_Lsimq4ciXDMA,mjnbowlgod,0, - , - ,"First you say ""negotiating"" , lets take a look at some of these 
""negotiations"". we are 20 trillion in debt, and getting killed in trade by 
China, Mexico , Japan to name a few. We were about to go to war with Russia 
, with open borders and terrorists running rampart. The list goes on. Im 
glad you were comfortable with all that but most of America is not. So 
Thanks America"
"""Third Presidential Debate""",smkyorC5qwc,z12wexx41k2ozj4ua23miz4jpqvsffyml,2016-10-26T19:30:49.000Z,2016-10-26T19:30:49.000Z,http://www.youtube.com/channel/UC8sGKXEt22XaEvBFX2ybwEg,D hiya,0,290,"sort out your nation institutionalizing racism, and stop allowing African 
AMERICANS to be gunned down in ghettos or in high streets by cops!﻿", - 
"""Third Presidential Debate""",smkyorC5qwc,z12wexx41k2ozj4ua23miz4jpqvsffyml.1477518011713039,2016-10-26T21:40:11.000Z,2016-10-26T21:40:11.000Z,http://www.youtube.com/channel/UCVJROdHuIE7DtoDRYJBKeWA,rixille,0, - , - ,"It was never institutionalized. Racism and racially-motivated crimes have 
existed since the beginning of civilization. The difference is; the media 
has picked the pre-existing matter and make it much bigger, in order to 
gain socio-political leverage. It worked, because now we have racism more 
than it ever happened before; because now I see Black Supremacists on the 
rise, bullying white communities and insulting whites as a race.. So 
ultimately, the problem has deteriorated all parties involved, rather than 
uplifting any given one. 

That is the whole idea, division through adversity. The tools of society."
"""Third Presidential Debate""",smkyorC5qwc,z13tvdfyml2pdp1q304cjxpbor2awf1aksk0k,2016-11-02T23:22:13.000Z,2016-11-02T23:22:13.000Z,http://www.youtube.com/channel/UCgE7sILhGPhOGcCyXK_RvQg,Rose Macaskie,0,291,"when i was little my mother showed me how many countries in the world were 
painte d pink in our atlas, the colour of countries that were part of the 
British empire where represented as pink and an awfull lot of countries 
were pink. I am sixty two years old, so that was more or less fifty five 
years ago, since then it has definately been North America who kept peace 
in the world, that is NOrht America has been great since the Kennedy's, a 
bit before, till now, still is the main power in the world, that is when 
America has been greatn much as for many americans other parts of their 
history seems to tbe the great ones. Greatness brings with it actions 
people question, such as Guantalamo,however who can doubt it, America is 
still great, jgreatly good or greatly less good but great. It is the 
country who holds the balance of power of the world, so it is just stupid 
people who talk of when it has been great , it is still great now as great 
as ancient Rome.﻿", - 
"""Third Presidential Debate""",smkyorC5qwc,z13tvdfyml2pdp1q304cjxpbor2awf1aksk0k.1478129413725802,2016-11-02T23:30:13.000Z,2016-11-02T23:30:13.000Z,http://www.youtube.com/channel/UCmMthUzumpZfyCL7tAYVCEA,nightwishnemo,1, - , - ,"America is a country of war criminals and murderers and you are highly 
brainwashed."
"""Third Presidential Debate""",smkyorC5qwc,z13fh5fgunnawf5cq235t50jqqjidbqmz,2016-10-31T16:08:38.000Z,2016-10-31T16:08:38.000Z,http://www.youtube.com/channel/UCt6Ywx8W7tdW4pw4sSMU8cg,Tyson Nuschan,0,292,"Greetings Youtube. My name is Yaav Benjamin Polus and I hail from Fort 
Worth, Texas. My occupation is producing squash. Simply put, I am a squash 
baron. I am the biggest producer of sqaush in the U.S and I have business 
deals with Mexico, Canada, Russia, France, England, and other various 
foreign countries. Due to my job and my wealth, I am a target for other 
rival squash barons around Texas and even from other states. I would like 
to propose an offer to the gun-toting folks on Youtube. The offer includes 
protecting my crops and defending my mansion from critters, thieves, and 
other types of beings that would wish to commit harm on my crops, which 
would also effect my business. I pay $75 per hour and I've established my 
own barracks on my land, and also food and beverages are provided. I do not 
provide guns though; you will have to have have your own firearm and that 
is why I'm asking you guys. Consider this offer because it is a very good 
one. Thank you and have a nice day.﻿", - 
"""Third Presidential Debate""",smkyorC5qwc,z13fh5fgunnawf5cq235t50jqqjidbqmz.1477931875465656,2016-10-31T16:37:55.000Z,2016-10-31T16:37:55.000Z,http://www.youtube.com/channel/UC4XXtMwhJwURboEm6Syx8XA,s Trick2Derp,6, - , - ,"Yaav B. Polus If this isnt sarcasm. then sir with all respect this is the 
wrong place to post. sorry."
"""Third Presidential Debate""",smkyorC5qwc,z134fzmxhtmucliet22hs5dyopmlvnsoz04,2016-11-09T10:50:23.000Z,2016-11-09T10:50:23.000Z,http://www.youtube.com/channel/UCxLdvSBxMYEv_ztcR4QDtog,Dark Angel,0,293,"We elected Donald Trump as president.........I can't believe it! We have 
officially screwed ourselves!﻿", - 
"""Third Presidential Debate""",smkyorC5qwc,z132eb2oemv1sfy1w22ewvcphujvc3iz304,2016-11-10T13:18:22.000Z,2016-11-10T13:18:22.000Z,http://www.youtube.com/channel/UCGBEnjaJ_ebeB-eB1OpyBsA,JamJamil,0,294,"Donald trump = Hitler 2.0 



If donald wins the world doesn't makes sence anymore﻿", - 
"""Third Presidential Debate""",smkyorC5qwc,z132eb2oemv1sfy1w22ewvcphujvc3iz304.1478803529595952,2016-11-10T18:45:29.000Z,2016-11-10T18:45:29.000Z,http://www.youtube.com/channel/UC50pC5PoXScbZHrjk879TTQ,SuperDboy4,3, - , - ,"You know he won right?
go trump"
"""Third Presidential Debate""",smkyorC5qwc,z13si345dwqrzdsik04chnlazmzkvbewoe4,2016-11-05T13:48:26.000Z,2016-11-05T13:48:26.000Z,http://www.youtube.com/channel/UCAJ5OI0YChR89lNY3Wd1ATg,nathan anye,0,295,"trump is a terrorist. all Africans hate him. Even Paul Biya and Robert 
Mugabe are much more intelligent than Clinton and trump put together﻿", - 
"""Third Presidential Debate""",smkyorC5qwc,z13si345dwqrzdsik04chnlazmzkvbewoe4.1478373660654626,2016-11-05T19:21:00.000Z,2016-11-05T19:21:00.000Z,http://www.youtube.com/channel/UCxxmZAtBS_90lmUBbjGHypQ,shirri evelyn,0, - , - ,Ya bro. even ughh is better than..
"""Third Presidential Debate""",smkyorC5qwc,z120sndznymtzf4t023nwlyiiv3qitde1,2016-10-27T06:36:32.000Z,2016-10-27T06:36:32.000Z,http://www.youtube.com/channel/UCuRfcDE4lLPtSZq144k8-zw,Runningbear Sf,0,296,*SUBSCRIBE to my channel Runningbear Sf*﻿, - 
"""Third Presidential Debate""",smkyorC5qwc,z120sndznymtzf4t023nwlyiiv3qitde1.1480818670866063,2016-12-04T02:31:10.000Z,2016-12-04T02:31:10.000Z,http://www.youtube.com/channel/UCESVjymmTAAn_AkDDEyTCJQ,Statue Teeth,0, - , - ,Runningbear Sf plz dont advertise on my videos
"""Third Presidential Debate""",smkyorC5qwc,z12mcpfi2ojnslke023udt4ritzzvdvwp04,2016-11-04T17:26:25.000Z,2016-11-04T17:26:25.000Z,http://www.youtube.com/channel/UCUGmX92nqsVZzMqbHrIJncA,michaell pena,0,297,Guys! You could vote for the independent parties! Just FYI﻿, - 
"""Third Presidential Debate""",smkyorC5qwc,z12mcpfi2ojnslke023udt4ritzzvdvwp04.1478293477057071,2016-11-04T21:04:37.000Z,2016-11-04T21:04:37.000Z,http://www.youtube.com/channel/UC5jg_D7HZ-9wTLYJPRQ5jFw,tikea p,0, - , - ,michaell pena I might just vote for an independent party.
"""Third Presidential Debate""",smkyorC5qwc,z13hu5xzgkzdjt1de23welap3pqnzxybr04,2016-11-09T00:28:02.000Z,2016-11-09T00:28:02.000Z,http://www.youtube.com/channel/UCcsK9-wnh1Mrd2muXF-dIBQ,Teun 118,0,298,TRUMP start worldwar3﻿, - 
"""Third Presidential Debate""",smkyorC5qwc,z13hu5xzgkzdjt1de23welap3pqnzxybr04.1478668617938949,2016-11-09T05:16:57.000Z,2016-11-09T05:16:57.000Z,http://www.youtube.com/channel/UCc0TTRDpb5gMfyt0TDf8dQw,StealthyWolfLuna,0, - , - ,"Teun 118 Hillary had classified information on an unsecured private server, 
which is against the law. Her doing this directly led to the murder of 
Americans in Benghazi. She and her staff tried to cover this up by 
destroying evidence and lying to FBI and congress and the American people."
"""Third Presidential Debate""",smkyorC5qwc,z13cifaq4vikshg1o22xdt5a2lrxyxwrp04,2016-11-12T02:27:54.000Z,2016-11-12T02:27:54.000Z,http://www.youtube.com/channel/UCAAZtwaRKsJ5Y6nIML1FMjA,Tom Fletcher,9,299,"""WRONG""- DONALD J TRUMP﻿", - 
"""Third Presidential Debate""",smkyorC5qwc,z12fzvjyrmfhi3lb104ci1rwuznish1pgqc0k,2016-11-10T01:49:23.000Z,2016-11-10T01:49:23.000Z,http://www.youtube.com/channel/UCWCbms_u3CaE8OlLIFOdbjQ,slapshot68,7,300,"The wall is coming, the bad hombres are going bye bye.﻿", - 
"""Third Presidential Debate""",smkyorC5qwc,z12wdjazstj1xxxks23awvfiikikgjt2t,2016-11-12T11:54:12.000Z,2016-11-12T11:54:12.000Z,http://www.youtube.com/channel/UCDbucfxPa0TyNYOrx7T_Bkw,Gus Rudder,4,301,hillary FOR PRISON!!!﻿, - 
"""Third Presidential Debate""",smkyorC5qwc,z13gi3nr5uzntfuak04cihhzyovis1zzivg0k,2016-11-13T02:41:36.000Z,2016-11-13T02:41:36.000Z,http://www.youtube.com/channel/UC_j04R_7VHJxebr59sSnxiQ,Andrew Hagstrom,3,302,I guess we now know who won all the debates. And it WASN'T Hillary!﻿, - 
"""Third Presidential Debate""",smkyorC5qwc,z12qznlgjyujvzc5104cibqhvnnejrf5l3g,2016-11-13T00:24:40.000Z,2016-11-13T00:24:40.000Z,http://www.youtube.com/channel/UCIxtASXr4w_Lsimq4ciXDMA,mjnbowlgod,5,303,"Trump tells it like it is without the political bs . Hillary is just 
sitting there laughing , soullessly going thru lines her corrupt DMC has 
fed her . She is merely a puppet that's owned and paid , has done nothing , 
using her women card to win this election clearly didn't work out .﻿", - 
"""Third Presidential Debate""",smkyorC5qwc,z12my3gpltqoxd5p004cixr44svzit0gptc0k,2016-11-12T20:35:12.000Z,2016-11-12T20:35:12.000Z,http://www.youtube.com/channel/UCpVQEdtATh_SnG7JVrCnltQ,hanif hadi,1,304,THE PURGE HAS JUST BEGINS﻿, - 
"""Third Presidential Debate""",smkyorC5qwc,z13fcxoi0lydylgbo04cgh5wspvivx5glr00k,2016-11-10T18:44:08.000Z,2016-11-10T18:44:08.000Z,http://www.youtube.com/channel/UCewuTlt7avCMYUnE3Wsulcw,Kristen Jett,1,305,"11 million ILLEGALS in this country and this bitch and sympathizers are 
blaise about it...
that wall will be built and the ILLEGALS will be deported!﻿", - 
"""Third Presidential Debate""",smkyorC5qwc,z12mh5gp5o2ajpqtq23wxhgzxumuxvr2q,2016-11-15T04:37:29.000Z,2016-11-15T04:37:29.000Z,http://www.youtube.com/channel/UCPeGu4gx6UB8CNNbps3tboQ,RegainingLife,1,306,"It feels great knowing Trump has won. When he won it was one of the 
greatest moments in US history.﻿", - 
"""Third Presidential Debate""",smkyorC5qwc,z13ufvhhvni4uj23s23ki13w0setff0im04,2016-11-11T18:59:54.000Z,2016-11-11T18:59:54.000Z,http://www.youtube.com/channel/UCuXb9szTir2xrxgAeLQsHxw,Tony S,3,307,"Sometimes, I can't tell the difference from SNL and reality.﻿", - 
"""Third Presidential Debate""",smkyorC5qwc,z13nd1xrouf0ynz0x23mhbhgkvqby1olu,2016-11-15T03:50:29.000Z,2016-11-15T03:50:29.000Z,http://www.youtube.com/channel/UCJYQjdRdM28lLihPxqiIgSQ,Michael Gorbaty,1,308,"27:55 Gotta love the hypocrisy in the liberal democrats. Using Russia as 
the reason to vote against Trump even though Clinton accepts millions from 
Arab countries that FUND RADICAL ISLAM. ........﻿", - 
"""Third Presidential Debate""",smkyorC5qwc,z12ydbvbtym0ihfpi04cijmwtxrawzu4lok0k,2016-11-11T07:42:53.000Z,2016-11-11T07:42:53.000Z,http://www.youtube.com/channel/UC2W1DrA1cCduzGSiAmYeY_A,Terry Everitt,2,309,damn I'm glad she didn't win...﻿, - 
"""Third Presidential Debate""",smkyorC5qwc,z13zux1qkzuxvr30u23vsnhhhoamjjk2o,2016-11-12T23:06:27.000Z,2016-11-12T23:06:27.000Z,http://www.youtube.com/channel/UC3bJpuw1NagyDPyRxfhJJyQ,NewMafiaOrder,1,310,1:07:56 she has an earpiece it's so obvious glad she lost﻿, - 
"""Third Presidential Debate""",smkyorC5qwc,z13rczdwhsqvdr2dm22zirrisvmezjdjk04,2016-11-15T06:08:41.000Z,2016-11-15T06:08:41.000Z,http://www.youtube.com/channel/UCjBPSTxPwiBRELk_s1cdWEg,Peter Perfect,1,311,"Drumpf has a face like a baboon's ass and a hair piece that looks like a 
dead hamster on top of his head! It's just absurd this buffoon is elected 
as president not that Hitlery is any better! Lol﻿", - 
"""Third Presidential Debate""",smkyorC5qwc,z13nzrrp3nzzshxcg23wed1ybwi4jpdgi04,2016-11-11T23:31:34.000Z,2016-11-11T23:31:34.000Z,http://www.youtube.com/channel/UCgP21WH4evUMFCGJ7aJMeGQ,Nour hammad,1,312,"Justice to all the Arab peoples vote in American elections because the 
American president will control 21 weakling Jaen Arabic
painful truth﻿", - 
"""Third Presidential Debate""",smkyorC5qwc,z12men1xnqb3zz5p204ch32hlwmavn2ryw40k,2016-11-13T23:16:27.000Z,2016-11-13T23:18:22.000Z,http://www.youtube.com/channel/UCNJZUweTdNB0R-UGm1RqRpA,Truth Speaker,1,313,"She's worried about Toddlers getting to guns..BUT supports Abortion even in 
third term abortions? what a bunch of junk!﻿", - 
"""Third Presidential Debate""",smkyorC5qwc,z12cezlg3orwzv0uk23jvzghwou2ftknp,2016-11-13T11:16:40.000Z,2016-11-13T11:16:40.000Z,http://www.youtube.com/channel/UCtIhTPlC4R5_E4JsWYcXnoA,Wojak Feels,1,314,"""You encourage espionage against our people"" hmm..... so following laws was 
in her agenda? When did she chime in where Obama on video said there will 
not be any consequences for illegals that illegally vote for this election?﻿", - 
"""Third Presidential Debate""",smkyorC5qwc,z123slqzdsmofxkih04cdtdanum2i1mzits0k,2016-11-14T17:43:00.000Z,2016-11-14T17:43:00.000Z,http://www.youtube.com/channel/UCUBdYVQBsKQu7g-BYvQVFvQ,SadBoys 2016,1,315,thank god a criminal didn't win﻿, - 
