video_title,video_id,comment_id,comment_date,updated_date,commenter_url,commenter_name,like_count,top_level_comment_num,top_level_comment,comment_reply
"""First Presidential Debate""",855Am6ovK7s,z12bj3zocpyuclyqp04chpdwypqpebjqm3k,2016-10-20T08:54:31.000Z,2016-10-20T08:54:31.000Z,http://www.youtube.com/channel/UCrg9AJ_27RomrtTpxnfSQmA,sampochw,0,99,"Of course women don't deserve equal pay unless they do as good a job as 
men. Equal pay for equal work.﻿", - 
"""First Presidential Debate""",855Am6ovK7s,z12bj3zocpyuclyqp04chpdwypqpebjqm3k.1476973017422051,2016-10-20T14:16:57.000Z,2016-10-20T14:16:57.000Z,http://www.youtube.com/channel/UCdXuDIBTvCwZ8mLE755um6g,Neamh McVeigh,0, - , - ,sampochw of course women do as good a job as men that's for sure
"""First Presidential Debate""",855Am6ovK7s,z134gfnxgzi5xzzpi04cfx5jftb0izoyv2c,2016-10-16T13:40:07.000Z,2016-10-16T13:40:07.000Z,http://www.youtube.com/channel/UCCiI-ie5oDuo0u0AD0mZSIg,Typical gamer,0,100,lol from Dubai﻿, - 
"""First Presidential Debate""",855Am6ovK7s,z134gfnxgzi5xzzpi04cfx5jftb0izoyv2c.1476718665742857,2016-10-17T15:37:45.000Z,2016-10-17T15:37:45.000Z,http://www.youtube.com/channel/UCM53xkMC8723bJjVbTaXWjg,Good Man,0, - , - ,Dubai only oil. 
"""First Presidential Debate""",855Am6ovK7s,z134gfnxgzi5xzzpi04cfx5jftb0izoyv2c.1476718556896246,2016-10-17T15:35:56.000Z,2016-10-17T15:35:56.000Z,http://www.youtube.com/channel/UCCiI-ie5oDuo0u0AD0mZSIg,Typical gamer,0, - , - ,"Good Man now if I recall correctly I never said it was great it looks 
nothing like on TV so no need to be aggressive"
"""First Presidential Debate""",855Am6ovK7s,z134gfnxgzi5xzzpi04cfx5jftb0izoyv2c.1476699834102108,2016-10-17T10:23:54.000Z,2016-10-17T10:23:54.000Z,http://www.youtube.com/channel/UCM53xkMC8723bJjVbTaXWjg,Good Man,0, - , - ,that answers how shitty Dubai is. Just a place for oil no brains.
"""First Presidential Debate""",855Am6ovK7s,z134gfnxgzi5xzzpi04cfx5jftb0izoyv2c.1476671639413734,2016-10-17T02:33:59.000Z,2016-10-17T02:33:59.000Z,http://www.youtube.com/channel/UCCiI-ie5oDuo0u0AD0mZSIg,Typical gamer,0, - , - ,Good Man actually I finished school and I am going to Britain in a few weeks
"""First Presidential Debate""",855Am6ovK7s,z134gfnxgzi5xzzpi04cfx5jftb0izoyv2c.1476669686846026,2016-10-17T02:01:26.000Z,2016-10-17T02:01:26.000Z,http://www.youtube.com/channel/UCM53xkMC8723bJjVbTaXWjg,Good Man,0, - , - ,"Typical gamer Actually you need to go to good schools not just buildings 
made of oil."
"""First Presidential Debate""",855Am6ovK7s,z12ztfdgpyrnftwav04cjnprgyr2c534eug0k,2016-10-12T01:12:55.000Z,2016-10-12T01:12:55.000Z,http://www.youtube.com/channel/UCJwkkcM-3Z1yukC-VsTggOw,Christian Mendez,509,101,"Q: Mrs. Hillary what is 2+2?
Hillary: four.
Trump: WRONG!!!﻿", - 
"""First Presidential Debate""",855Am6ovK7s,z12ztfdgpyrnftwav04cjnprgyr2c534eug0k.1480290801445277,2016-11-27T23:53:21.000Z,2016-11-27T23:53:21.000Z,http://www.youtube.com/channel/UCAxLSf1yfRfyYbFpEiAhWHQ,DiscoDerp and Raditz,0, - , - ,Christian Mendez 5
"""First Presidential Debate""",855Am6ovK7s,z12ztfdgpyrnftwav04cjnprgyr2c534eug0k.1480078235241116,2016-11-25T12:50:35.000Z,2016-11-25T12:50:35.000Z,http://www.youtube.com/channel/UCnypJa_PPaWQ_7WaKsTSZ5g,HommeDeFeu,0, - , - ,"Hillary: ""I will win the election""
Trump: ""Wrong!!!!""
LOL"
"""First Presidential Debate""",855Am6ovK7s,z12ztfdgpyrnftwav04cjnprgyr2c534eug0k.1478375765731477,2016-11-05T19:56:05.000Z,2016-11-05T19:56:05.000Z,http://www.youtube.com/channel/UCuRA8vkzkxUgmgwpi-PljMg,Pranav Singh,0, - , - ,Antroicz
"""First Presidential Debate""",855Am6ovK7s,z12ztfdgpyrnftwav04cjnprgyr2c534eug0k.1478125632454893,2016-11-02T22:27:12.000Z,2016-11-02T22:27:12.000Z,http://www.youtube.com/channel/UCO7aYsRajrMg-EixK1Od21Q,Antroicz,2, - , - ,Law and Order
"""First Presidential Debate""",855Am6ovK7s,z13rxhvwmyvtcvuym04ce5kjlk3evdwqt0k,2016-10-24T18:38:59.000Z,2016-10-24T18:38:59.000Z,http://www.youtube.com/channel/UCenE7Ux_kOC7sfAxcNj4j1g,Brianna Laine,21,102,"I really wish they'd turn the other canidates microphone off while it's 
ones turn to speak.﻿", - 
"""First Presidential Debate""",855Am6ovK7s,z13rxhvwmyvtcvuym04ce5kjlk3evdwqt0k.1479058415232100,2016-11-13T17:33:35.000Z,2016-11-13T17:33:35.000Z,http://www.youtube.com/channel/UC-o85dDW9NqdrMgjae1DPPA,Angad Singh,0, - , - ,+Brianna Laine ikr
"""First Presidential Debate""",855Am6ovK7s,z13rxhvwmyvtcvuym04ce5kjlk3evdwqt0k.1477420776850282,2016-10-25T18:39:36.000Z,2016-10-25T18:39:36.000Z,http://www.youtube.com/channel/UCYxVVTID0aH-mTexalgDAAw,Lord Darkon,17, - , - ,You mean Trumps micro?
"""First Presidential Debate""",855Am6ovK7s,z12xsbkzimjqh1e0t22ruhwj3xeazpkae04,2016-10-17T11:33:23.000Z,2016-10-17T11:33:23.000Z,http://www.youtube.com/channel/UCOMLSkwduOnjzYbLTU-ciuQ,Batman,54,103,A racist or a robot... that's a tough choice!﻿, - 
"""First Presidential Debate""",855Am6ovK7s,z12xsbkzimjqh1e0t22ruhwj3xeazpkae04.1480579840411748,2016-12-01T08:10:40.000Z,2016-12-01T08:10:40.000Z,http://www.youtube.com/channel/UCOMLSkwduOnjzYbLTU-ciuQ,Batman,0, - , - ,"+Brandon Munson Of course, he's not racist today."
"""First Presidential Debate""",855Am6ovK7s,z12xsbkzimjqh1e0t22ruhwj3xeazpkae04.1480552084353265,2016-12-01T00:28:04.000Z,2016-12-01T00:28:04.000Z,http://www.youtube.com/channel/UCVwOFCfC8o75AVjSMpfZO-A,Gisela Bramonte,0, - , - ,Brandon Munson hahaha yeah ok
"""First Presidential Debate""",855Am6ovK7s,z12xsbkzimjqh1e0t22ruhwj3xeazpkae04.1479496595919515,2016-11-18T19:16:35.000Z,2016-11-18T19:16:35.000Z,http://www.youtube.com/channel/UCEyXIyItg53_m9DKUD7K_eg,Brandon Munson,4, - , - ,He's not racist
"""First Presidential Debate""",855Am6ovK7s,z12xsbkzimjqh1e0t22ruhwj3xeazpkae04.1478209884321135,2016-11-03T21:51:24.000Z,2016-11-03T21:51:24.000Z,http://www.youtube.com/channel/UCK-9usysgluhjzWqeO17hfA,benjaminrei13,2, - , - ,"Batman wanting to send illegals back to their country, how racist"
"""First Presidential Debate""",855Am6ovK7s,z13esryx0ufujx1qf04cdt25wzbitrbiu0o,2016-10-23T20:42:08.000Z,2016-10-23T20:42:08.000Z,http://www.youtube.com/channel/UCysLdEJVtNU7FyYKtiWXcJg,Emme Seeley,26,104,I love how Donald Trump is wearing blue and Hillary Clinton is wearing red﻿, - 
"""First Presidential Debate""",855Am6ovK7s,z13esryx0ufujx1qf04cdt25wzbitrbiu0o.1477599386595636,2016-10-27T20:16:26.000Z,2016-10-27T20:16:26.000Z,http://www.youtube.com/channel/UCzbDA6zqjLD7P9COXwKppWg,Enamie,0, - , - ,It ... it was a joke pal
"""First Presidential Debate""",855Am6ovK7s,z13esryx0ufujx1qf04cdt25wzbitrbiu0o.1477545264274673,2016-10-27T05:14:24.000Z,2016-10-27T05:14:24.000Z,http://www.youtube.com/channel/UClmwDjcbP14_4GEM3uBWYlw,Entroxity,5, - , - ,"no.... Red is the color for Democrats and Blue is the color for 
Republicans...."
"""First Presidential Debate""",855Am6ovK7s,z13nhhvp5vamhtkry04cefpadwveu3g55bs,2016-10-19T12:49:48.000Z,2016-10-19T12:49:48.000Z,http://www.youtube.com/channel/UCuGy7QYNa0z46rvG16NuS1g,Pam H,65,105,Trump looks like he's contemplating a murder.﻿, - 
"""First Presidential Debate""",855Am6ovK7s,z13nhhvp5vamhtkry04cefpadwveu3g55bs.1478650881587761,2016-11-09T00:21:21.000Z,2016-11-09T00:21:21.000Z,http://www.youtube.com/channel/UCp3nXPVFRofR5T6WX9BMBrA,The One,11, - , - ,Meanwhile Hillary has already put that contemplating into action.
"""First Presidential Debate""",855Am6ovK7s,z13nhhvp5vamhtkry04cefpadwveu3g55bs.1477494746149066,2016-10-26T15:12:26.000Z,2016-10-26T15:12:26.000Z,http://www.youtube.com/channel/UCFjJx1yJ-ey5KQrNzYZjNHQ,Alexia K,8, - , - ,He's not going to because that's dropping to Her level
"""First Presidential Debate""",855Am6ovK7s,z13nhhvp5vamhtkry04cefpadwveu3g55bs.1477082913161337,2016-10-21T20:48:33.000Z,2016-10-21T20:48:33.000Z,http://www.youtube.com/channel/UCMPdOjDctpYHuJf9lQhazQQ,- Sunrise -Sunset,7, - , - ,"he murdered killary in these debates ..she looks like a victim who had a 
good pounding that's for sure ...smile nervously through it all 
killary...there ya go"
"""First Presidential Debate""",855Am6ovK7s,z13zwvtgklmgt5roy04cdv5jeubhitfqis40k,2016-10-24T15:09:54.000Z,2016-10-24T15:09:54.000Z,http://www.youtube.com/channel/UCblbZpSU1kc5aR8ZLhqHIvg,Yul Bahbo,7,106,Idiocracy was a documentary.﻿, - 
"""First Presidential Debate""",855Am6ovK7s,z13zwvtgklmgt5roy04cdv5jeubhitfqis40k.1478649670617083,2016-11-09T00:01:10.000Z,2016-11-09T00:01:10.000Z,http://www.youtube.com/channel/UCsmnSpfuiwnjJy71iNxJDoQ,Kegan Brown,0, - , - ,hao Tran no boi
"""First Presidential Debate""",855Am6ovK7s,z13zwvtgklmgt5roy04cdv5jeubhitfqis40k.1477778298954692,2016-10-29T21:58:18.000Z,2016-10-29T21:58:18.000Z,http://www.youtube.com/channel/UCYrxHRyp4KzA7OpaizlegVA,jeena djo,5, - , - ,Dude both are two faces of the same coin.......
"""First Presidential Debate""",855Am6ovK7s,z13zwvtgklmgt5roy04cdv5jeubhitfqis40k.1477347177396814,2016-10-24T22:12:57.000Z,2016-10-24T22:12:57.000Z,http://www.youtube.com/channel/UCemh95PFCB9G7aJO7FvZtFw,hao Tran,1, - , - ,"Yul Bahbo :
Vote Donald Trump for President USA**💯👍
Vote Hillary Clinton for The Hell 💀♿💀♿"
"""First Presidential Debate""",855Am6ovK7s,z124fjy5wryryb3su22lvlmxhxnsitrqx04,2016-10-11T23:22:45.000Z,2016-10-11T23:22:45.000Z,http://www.youtube.com/channel/UCV8TdGJZn3xZgZUP8AHlH7w,Danica Mae,148,107,"I waited 18 years to vote and when I do, these are my choices? 😑﻿", - 
"""First Presidential Debate""",855Am6ovK7s,z124fjy5wryryb3su22lvlmxhxnsitrqx04.1480298194115881,2016-11-28T01:56:34.000Z,2016-11-28T01:56:34.000Z,http://www.youtube.com/channel/UCcmv_s8ciitcgB4PXFNI0xQ,Childhood Obesity & Soda,0, - , - ,America has universities and colleges. They're the same.
"""First Presidential Debate""",855Am6ovK7s,z124fjy5wryryb3su22lvlmxhxnsitrqx04.1478487561466167,2016-11-07T02:59:21.000Z,2016-11-07T02:59:21.000Z,http://www.youtube.com/channel/UCpObtGH8WK1d_m0BnBqEfcQ,Maclean Samis,1, - , - ,Move to Canada.
"""First Presidential Debate""",855Am6ovK7s,z124fjy5wryryb3su22lvlmxhxnsitrqx04.1478034871335063,2016-11-01T21:14:31.000Z,2016-11-01T21:14:31.000Z,http://www.youtube.com/channel/UCif7XM-D_CJtJDhfeqtKI-A,Malkin8 Gaming,1, - , - ,"We have colleges, and they have universities. Further education in the UK 
and America is the same"
"""First Presidential Debate""",855Am6ovK7s,z124fjy5wryryb3su22lvlmxhxnsitrqx04.1477897456065313,2016-10-31T07:04:16.000Z,2016-10-31T07:05:52.000Z,http://www.youtube.com/channel/UCH5qnb_B7Rcf-0KuS4UbgKA,Crizzo DuCiel,0, - , - ,"MrAndyman0512 I'm 19 years old and I'm British, I'm going to university 
what u call college or something"
"""First Presidential Debate""",855Am6ovK7s,z13swhfwyomqjhhns22tfdnjxuigh5agq04,2016-10-14T19:20:04.000Z,2016-10-14T19:20:04.000Z,http://www.youtube.com/channel/UCVrXkGN4DKeR4wIKtaDu58g,Dave Reynolds,10,108,"Hillary Clinton sexually abused female minors supplied to her by the 
pentagon through their monarch MKultra mind control programme. google      
' Hilary Clinton MKultra'        Hillary PEDOPHILE﻿", - 
"""First Presidential Debate""",855Am6ovK7s,z13swhfwyomqjhhns22tfdnjxuigh5agq04.1477939534280840,2016-10-31T18:45:34.000Z,2016-10-31T18:45:34.000Z,http://www.youtube.com/channel/UCVrXkGN4DKeR4wIKtaDu58g,Dave Reynolds,0, - , - ,google it
"""First Presidential Debate""",855Am6ovK7s,z13swhfwyomqjhhns22tfdnjxuigh5agq04.1477658685440399,2016-10-28T12:44:45.000Z,2016-10-28T12:44:45.000Z,http://www.youtube.com/channel/UCBz3OXPPK5CXA_joOclBEPw,Songbird,1, - , - ,Dave Reynolds ... wtf
"""First Presidential Debate""",855Am6ovK7s,z13swhfwyomqjhhns22tfdnjxuigh5agq04.1476638000214124,2016-10-16T17:13:20.000Z,2016-10-16T17:13:20.000Z,http://www.youtube.com/channel/UCTmPNROjVFrmU0U9IPQBIAw,Defne Kansu,0, - , - ,Why do you think she can't handle?
"""First Presidential Debate""",855Am6ovK7s,z12nuft4qk2rerub504citbhizjhwthhly00k,2016-10-17T00:34:09.000Z,2016-10-17T00:34:09.000Z,http://www.youtube.com/channel/UCnbNj9cECcv43WWo1NXoX-A,Electrischeme,57,109,"Damn, you americans surely are very interesting.﻿", - 
"""First Presidential Debate""",855Am6ovK7s,z12nuft4qk2rerub504citbhizjhwthhly00k.1480159385548673,2016-11-26T11:23:05.000Z,2016-11-26T11:23:05.000Z,http://www.youtube.com/channel/UCDwg_xDrs3l3aqWFpzITRLg,Jazzy J,0, - , - ,Agreed!
"""First Presidential Debate""",855Am6ovK7s,z12nuft4qk2rerub504citbhizjhwthhly00k.1478545452897414,2016-11-07T19:04:12.000Z,2016-11-07T19:04:12.000Z,http://www.youtube.com/channel/UCnbNj9cECcv43WWo1NXoX-A,Electrischeme,0, - , - ,wut
"""First Presidential Debate""",855Am6ovK7s,z12nuft4qk2rerub504citbhizjhwthhly00k.1478115202146547,2016-11-02T19:33:22.000Z,2016-11-02T19:33:22.000Z,http://www.youtube.com/channel/UCnbNj9cECcv43WWo1NXoX-A,Electrischeme,0, - , - ,"I don't give 'em that importance since now that they have a presidential 
situation, they think it's a world change, which is totally bullshit once 
it's just a US change - America is continent by the way, not a country, 
they love to call it ""America""."
"""First Presidential Debate""",855Am6ovK7s,z12nuft4qk2rerub504citbhizjhwthhly00k.1478072702458909,2016-11-02T07:45:02.000Z,2016-11-02T07:45:02.000Z,http://www.youtube.com/channel/UCKkuPQOi3UdZADnhFG0vfaA,Jeffrey Kiu Shiu Liong,0, - , - ,"these are the best two candidates they have lol, I don't understand why 
they don't pick Bernie Sander instead lol"
"""First Presidential Debate""",855Am6ovK7s,z135fbxjsnrgtvido22qcliz4rzvhrsap04,2016-10-18T08:39:46.000Z,2016-10-18T08:39:46.000Z,http://www.youtube.com/channel/UCW3TB763G0pH_CEuHe6J9jw,Ting Zhao,9,110,"Honestly I hope US will just improve as a nation in the future. Just saying 
as a bystander and a foreigner.﻿", - 
"""First Presidential Debate""",855Am6ovK7s,z135fbxjsnrgtvido22qcliz4rzvhrsap04.1476817575722784,2016-10-18T19:06:15.000Z,2016-10-18T19:06:15.000Z,http://www.youtube.com/channel/UCtqx5_ZZvXkr5L66YThvYaA,Gemma Speht,1, - , - ,"I'm genuinely scared for the western world, I'm British and in my country 
too, when it comes to peace and helping the human race and the planet we 
are going backwards"
"""First Presidential Debate""",855Am6ovK7s,z12qxvwy2zjjy1mpw04cdngqar3jfz35o4s,2016-10-22T17:26:10.000Z,2016-10-22T17:26:10.000Z,http://www.youtube.com/channel/UCCtrz_kuHTTOE95fYTBIvOA,Maria Gilles,10,111,"Why am I watching this? Oh, I remember I am forced to for school. Oh, 
Joy!!!!﻿", - 
"""First Presidential Debate""",855Am6ovK7s,z12qxvwy2zjjy1mpw04cdngqar3jfz35o4s.1478181920602886,2016-11-03T14:05:20.000Z,2016-11-03T14:05:20.000Z,http://www.youtube.com/channel/UCvYUbK4mTQMrGfyhRBLdplw,Rachel Jacobs,0, - , - ,"Maria Gilles Watch SNL skits after these. They're hilarious and make 
watching these worth it."
"""First Presidential Debate""",855Am6ovK7s,z12qxvwy2zjjy1mpw04cdngqar3jfz35o4s.1477204377219215,2016-10-23T06:32:57.000Z,2016-10-23T06:32:57.000Z,http://www.youtube.com/channel/UCU-qyhjqhjBqT1Qz2VufeqQ,mitchell dagod,0, - , - ,Maria Gilles sad
"""First Presidential Debate""",855Am6ovK7s,z12qxvwy2zjjy1mpw04cdngqar3jfz35o4s.1477168216003442,2016-10-22T20:30:16.000Z,2016-10-22T20:30:16.000Z,http://www.youtube.com/channel/UCJBf8IWs66cJfsxReQco4Jw,celest s,1, - , - ,Maria Gilles I'm watching it by choice. and I'm not even American lol
"""First Presidential Debate""",855Am6ovK7s,z12xgvoaevjdhbegy04cjtbqxra1st4jrd4,2016-10-22T16:03:19.000Z,2016-10-22T16:03:19.000Z,http://www.youtube.com/channel/UCfYPAxzNccmPzOapVS5eTUw,Ashley Jiang,24,112,"the year is 2016 and the presidential debate has turned into a fight 
between 2 five-year olds﻿", - 
"""First Presidential Debate""",855Am6ovK7s,z12xgvoaevjdhbegy04cjtbqxra1st4jrd4.1477347168137351,2016-10-24T22:12:48.000Z,2016-10-24T22:12:48.000Z,http://www.youtube.com/channel/UCemh95PFCB9G7aJO7FvZtFw,hao Tran,1, - , - ,"Ashley Jiang :
Vote Donald Trump for President USA**💯👍
Vote Hillary Clinton for The Hell 💀♿💀♿"
"""First Presidential Debate""",855Am6ovK7s,z12xgvoaevjdhbegy04cjtbqxra1st4jrd4.1477195917275272,2016-10-23T04:11:57.000Z,2016-10-23T04:11:57.000Z,http://www.youtube.com/channel/UCPLU1gzAGu3tGY7aD2cMqPA,Elohim Gaming,1, - , - ,Ashley Jiang I was thinking the same thing 😂
"""First Presidential Debate""",855Am6ovK7s,z134zpoogmyqu5a5w04ccfi5mwi2jf5ombc,2016-10-14T03:02:40.000Z,2016-10-14T03:02:40.000Z,http://www.youtube.com/channel/UCN899AqHszInutwPIPXmSvA,God MrJ,20,113,this dude is clearly racist lol man i feel bad﻿, - 
"""First Presidential Debate""",855Am6ovK7s,z134zpoogmyqu5a5w04ccfi5mwi2jf5ombc.1477619767453034,2016-10-28T01:56:07.000Z,2016-10-28T01:56:07.000Z,http://www.youtube.com/channel/UCa1IaaOsuYV6gHBkzbGgygg,DrewGee 502,1, - , - ,This woman is clearly a liar and criminal lol I feel bad
"""First Presidential Debate""",855Am6ovK7s,z134zpoogmyqu5a5w04ccfi5mwi2jf5ombc.1476631456463594,2016-10-16T15:24:16.000Z,2016-10-16T15:24:16.000Z,http://www.youtube.com/channel/UCZHiA88XmOurQmHQjJQKg6w,Dustin Balthis,6, - , - ,It's not racist to secure our borders
"""First Presidential Debate""",855Am6ovK7s,z12bcrgy1xjvjjehu04cenj4ppnxdvi4lgw,2016-10-15T14:38:22.000Z,2016-10-15T14:38:22.000Z,http://www.youtube.com/channel/UCHklXVDY9uN10y01OW-fk7Q,Viktoria k,27,114,"There really just should be a button to silence their microfones. This is 
just uuuugh, let each other speak for god's sake!!!!!!!!! How is this even 
called a proper debate???!!﻿", - 
"""First Presidential Debate""",855Am6ovK7s,z12bcrgy1xjvjjehu04cenj4ppnxdvi4lgw.1476960209662710,2016-10-20T10:43:29.000Z,2016-10-20T10:43:29.000Z,http://www.youtube.com/channel/UC-1KmdBNMlMYwdj9BNOBpuw,The Codenamenoob,0, - , - ,"anonimous 1 haha no hate though mostly joking around. I think them arguing 
like that is entertaining though xD. They have me cracking up. But then 
they get serious and both have some fair fights. I find this election to be 
super comical honestly, and I'm taking it as a joke more that anything. 
Trump said it was a joke and it sure seems that way haha"
"""First Presidential Debate""",855Am6ovK7s,z12bcrgy1xjvjjehu04cenj4ppnxdvi4lgw.1476954698835528,2016-10-20T09:11:38.000Z,2016-10-20T09:11:38.000Z,http://www.youtube.com/channel/UCHklXVDY9uN10y01OW-fk7Q,Viktoria k,0, - , - ,"The Codenamenoob you're right. :) got extremely frustrated. about the 
microfone/microphone, thx for the correction. confused it with Dutch"
"""First Presidential Debate""",855Am6ovK7s,z12bcrgy1xjvjjehu04cenj4ppnxdvi4lgw.1476954513659539,2016-10-20T09:08:33.000Z,2016-10-20T09:08:33.000Z,http://www.youtube.com/channel/UC-1KmdBNMlMYwdj9BNOBpuw,The Codenamenoob,0, - , - ,"That's what a debate is haha. Also when you can spell microphones* get back 
to me bruh"
"""First Presidential Debate""",855Am6ovK7s,z12gc3nbvxvdjdkjb04cflshrwb4ghvpm44,2016-10-17T15:10:37.000Z,2016-10-17T15:10:37.000Z,http://www.youtube.com/channel/UCRA0NyLxXc6TttvB3X2_LuQ,Chloe marsh,9,115,"i dont care who wins because i live in Britain, im British :)﻿", - 
"""First Presidential Debate""",855Am6ovK7s,z12gc3nbvxvdjdkjb04cflshrwb4ghvpm44.1480159636464407,2016-11-26T11:27:16.000Z,2016-11-26T11:27:16.000Z,http://www.youtube.com/channel/UCDwg_xDrs3l3aqWFpzITRLg,Jazzy J,0, - , - ,"Because in Britain, specifically in England we live under America's shadow. 
I know Americans don't ever even attempt to understand this, but this is 
all part of their ignorance. YOUR films, YOUR tv shows, YOUR music is 
ALWAYS in OUR charts and on our tv screens, your actors are now doing a lot 
of the very British tv adverts like for 'BT' or 'EE'. 

And because we live in America's shadow we are also extremely interested in 
watching anything related to American politics because we are bombarded 
with it in British media. 

Next time, try and find out the answer before asking a question like that, 
I'm not arguing with you I am STATING FACTS."
"""First Presidential Debate""",855Am6ovK7s,z12gc3nbvxvdjdkjb04cflshrwb4ghvpm44.1478627708900002,2016-11-08T17:55:08.000Z,2016-11-08T17:55:08.000Z,http://www.youtube.com/channel/UCgU6lfz2Gh2pBTsLp3pNl8g,talia astellas,1, - , - ,Sophia Garthe people outside of the usa are allowed to watch you know 😂
"""First Presidential Debate""",855Am6ovK7s,z12gc3nbvxvdjdkjb04cflshrwb4ghvpm44.1478562716467407,2016-11-07T23:51:56.000Z,2016-11-07T23:51:56.000Z,http://www.youtube.com/channel/UCSlCViJxGpmliZiL6hCbSJA,Sophia Garthe,3, - , - ,Ok so why are you watching this?
"""First Presidential Debate""",855Am6ovK7s,z12kyx4wnneldxzho04cebyzrzfahv5ylgo,2016-10-28T08:08:53.000Z,2016-10-28T08:08:53.000Z,http://www.youtube.com/channel/UCfylIl83ch5WtZSIlIGUwJQ,ILIA K,13,116,Donald Trump makes more sense for me..﻿, - 
"""First Presidential Debate""",855Am6ovK7s,z12kyx4wnneldxzho04cebyzrzfahv5ylgo.1477651104016419,2016-10-28T10:38:24.000Z,2016-10-28T10:38:24.000Z,http://www.youtube.com/channel/UCYa_d9NuPxPF9DPu63nrwSg,long live MAG,3, - , - ,"ILIA K trump reminds me of the family guy episode when lois runs for mayor. 
fuuuu...."
"""First Presidential Debate""",855Am6ovK7s,z122sxrrdrvkel10t22lwdeqkoi2fhbga04,2016-10-20T00:41:35.000Z,2016-10-20T00:41:35.000Z,http://www.youtube.com/channel/UCCYAsZdT8gVVc60FB-K1nug,Joshi Charlton,22,117,why does he talk over her all the time it's really annoying me😂😂﻿, - 
"""First Presidential Debate""",855Am6ovK7s,z122sxrrdrvkel10t22lwdeqkoi2fhbga04.1478050722560665,2016-11-02T01:38:42.000Z,2016-11-02T01:38:42.000Z,http://www.youtube.com/channel/UCMWVh_NROvAch2ICzAZUtkQ,prettid051,0, - , - ,Joshi Charlton me too
"""First Presidential Debate""",855Am6ovK7s,z122sxrrdrvkel10t22lwdeqkoi2fhbga04.1476974330552178,2016-10-20T14:38:50.000Z,2016-10-20T14:38:50.000Z,http://www.youtube.com/channel/UCI6KvQCJsElyC2STy0kIZnQ,juice12398,9, - , - ,"He talks over the moderator too. Guess his parents never educated him about 
""don't interrupt"""
"""First Presidential Debate""",855Am6ovK7s,z13au124cknpxvp3t225eroxyr22fhzbi04,2016-11-02T21:09:05.000Z,2016-11-02T21:09:05.000Z,http://www.youtube.com/channel/UCR-y7opZ41HkJbm-AlSP92g,Purple Pandas,13,118,"statistics say that 27% of the time she lies. that is 1/4 times
trump lies 70% of the time. that is 7/10 times he lies. that is a lot at 
east that is what the statistics say on NBC﻿", - 
"""First Presidential Debate""",855Am6ovK7s,z13au124cknpxvp3t225eroxyr22fhzbi04.1478361956296861,2016-11-05T16:05:56.000Z,2016-11-05T16:05:56.000Z,http://www.youtube.com/channel/UC5tmeYu3Aq0wdVnpiTcsfag,a duhh,3, - , - ,Lol that's what NBC said tho
"""First Presidential Debate""",855Am6ovK7s,z13au124cknpxvp3t225eroxyr22fhzbi04.1478237919454193,2016-11-04T05:38:39.000Z,2016-11-04T05:38:39.000Z,http://www.youtube.com/channel/UCNPWXVzkzocaElbFPtTQk8w,The Great Western Trendkill,1, - , - ,ahahahaha
"""First Presidential Debate""",855Am6ovK7s,z12futphbqfkyjkkh22sw3tx2zemgbefq,2016-10-21T07:39:08.000Z,2016-10-21T07:39:08.000Z,http://www.youtube.com/channel/UCHaWHMMwO141DwfdrgE7PaA,Jack Jackharold,32,119,"It's really sad to see that 90% of america's population don't know anything 
about their policy or policy in general, please let the foreigners vote, we 
know better about your country more than you do lmao.﻿", - 
"""First Presidential Debate""",855Am6ovK7s,z12futphbqfkyjkkh22sw3tx2zemgbefq.1477492120993080,2016-10-26T14:28:40.000Z,2016-10-26T14:28:40.000Z,http://www.youtube.com/channel/UCGHaBHBZnmqKIoCmSOInnqw,Shweta Kaul,3, - , - ,"holy feces, this is so true. 

ignorance breeds ignorance, i think you start to take for granted the 
country you live in unless you actively participate in getting know what 
your country encompasses and does on the domestic as well as the 
international front."
"""First Presidential Debate""",855Am6ovK7s,z13ytz1acwiedrifg23lgddwylu4w5tei,2016-10-12T20:09:45.000Z,2016-10-12T20:09:45.000Z,http://www.youtube.com/channel/UCnxKjOFpjcx4lcretIN9obA,393Dan,40,120,I wonder if even democrates believe what she's saying﻿, - 
"""First Presidential Debate""",855Am6ovK7s,z13ytz1acwiedrifg23lgddwylu4w5tei.1477544006978049,2016-10-27T04:53:26.000Z,2016-10-27T04:53:26.000Z,http://www.youtube.com/channel/UCShi2fBi-0vB4SJnv6nJ4-Q,Audery La Beɾge,8, - , - ,I wonder if ANYONE believes anything each of them are saying.
"""First Presidential Debate""",855Am6ovK7s,z13ytz1acwiedrifg23lgddwylu4w5tei.1476304550318151,2016-10-12T20:35:50.000Z,2016-10-12T20:35:50.000Z,http://www.youtube.com/channel/UCijEBu8RsWOhKguSDFXxJgw,Max E,8, - , - ,393Dan #ImWithHer 🇺🇸💯
"""First Presidential Debate""",855Am6ovK7s,z121htaoswzlgxkrb04cgv3pzwfucjc5d50,2016-11-07T22:49:14.000Z,2016-11-07T22:49:14.000Z,http://www.youtube.com/channel/UC3BqsjQqlibxeL4nlax8jlw,Rosario Reyes,4,121,Shut up y vote for hillary Clinton﻿, - 
"""First Presidential Debate""",855Am6ovK7s,z121htaoswzlgxkrb04cgv3pzwfucjc5d50.1478576602547893,2016-11-08T03:43:22.000Z,2016-11-08T03:43:22.000Z,http://www.youtube.com/channel/UC7aDj2hZT7Wb3H5KT2iptig,tyraa burch,1, - , - ,Rosario Reyes why vote for donald trump ? lol
"""First Presidential Debate""",855Am6ovK7s,z13hdxuivsjhhhuwi04cefshawezszaavog0k,2016-10-15T00:43:20.000Z,2016-10-15T00:43:20.000Z,http://www.youtube.com/channel/UCLioyNZwSMA3S6ehgn5xWZg,Upkaar Singh Dhami,20,122,"remove the sentence "" I'm very proud of it. "" and Trump's speeches will be 
halved﻿", - 
"""First Presidential Debate""",855Am6ovK7s,z13hdxuivsjhhhuwi04cefshawezszaavog0k.1478645868544260,2016-11-08T22:57:48.000Z,2016-11-08T22:57:48.000Z,http://www.youtube.com/channel/UCqNEhmdk6hq_PYu0qbPAizA,The Keys,0, - , - ,"Florah Mavika cool I like Tanzania
But I do not have an opinion on who should be President"
"""First Presidential Debate""",855Am6ovK7s,z13hdxuivsjhhhuwi04cefshawezszaavog0k.1477858083143808,2016-10-30T20:08:03.000Z,2016-10-30T20:08:03.000Z,http://www.youtube.com/channel/UCG9WmYVO4y4xtMh0O3CsjRg,Florah Mavika,3, - , - ,"The best President in America is Donald Trump. He is going to creat 
wonderful employement and good economic in America. Have a good journey 
Trump. I'm Tanzanian"
