video_title,video_id,comment_id,comment_date,updated_date,commenter_url,commenter_name,like_count,top_level_comment_num,top_level_comment,comment_reply
"""First Presidential Debate""",855Am6ovK7s,z13zejbh3nyhdh5hf04cff4ixkrcjhua3g4,2016-10-20T09:53:18.000Z,2016-10-20T09:53:18.000Z,http://www.youtube.com/channel/UCs7ClnF3vt6QPAbf_Mkcvdg,Mick Beth,0,750,"An inspection by The Independent of more than 25 different items of Ivanka 
Trump’s range at the Macy’s flagship store in New York city, found not a 
single one was produced in the US. A sales assistant confirmed that no 
items in the collection were made at home.
Trump shirts are made in Bangladesh.
Trump neckties are made in China.
Trump suits are made in Mexico.
Trump cuff-links are made in China.
Trump Vodka is made in the Netherlands.
Trump crystal bar-ware is made in Slovenia.
Some Trump products also are made in the United States, including the 
candidate’s iconic ""Make America Great Again"" baseball cap, which is 
manufactured in California. and his Cologne (That Stinks)﻿", - 
"""First Presidential Debate""",855Am6ovK7s,z12yi5rwbnfne1l5b04ch5gbgyn1e5joufg,2016-10-20T01:03:15.000Z,2016-10-20T01:03:15.000Z,http://www.youtube.com/channel/UCKeBBgG9-UALW4stjRkRsGQ,Paradoxx,2,751,Hillary is the puppet of wall street.﻿, - 
"""First Presidential Debate""",855Am6ovK7s,z12pwxo4ipnodzn4t04cip1ghzb1chiaqts0k,2016-10-20T16:08:18.000Z,2016-10-20T16:08:18.000Z,http://www.youtube.com/channel/UCP6U-oyp66lOlrknmYw4oag,nnikolaj,0,752,hillary clinton is a liar!﻿, - 
"""First Presidential Debate""",855Am6ovK7s,z12ytl0xuwbqxxbu023ofdt40lmxsrbkr,2016-10-20T11:16:59.000Z,2016-10-20T11:16:59.000Z,http://www.youtube.com/channel/UC-EpHayHxR6-VyOk2mHZlpw,Infowars Australia,0,753,"Please, please USA. The world needs USA to remain and Hillary will close 
your border protection and make your country a Socialist hell hole.﻿", - 
"""First Presidential Debate""",855Am6ovK7s,z13jep1welu3dvnj504cifyyusetizozgbs,2016-10-20T16:37:11.000Z,2016-10-20T16:37:11.000Z,http://www.youtube.com/channel/UCBzR1DaXq_r4gYNsuHhfp-Q,Na'ama DeVivo,0,754,"All the money in the world cannot make you a good leader or person. I'm 
amazed how stupid and out of control Trump looks and sound like, extremely 
unattractive attitude. He might say some things that I know or suspected to 
be, but he won't be able to convince me that he cares about me as an 
individual. I may admire his sense of business and making money but that's 
by far not the most important thing America needs. He's missing the most 
important part; a leader needs to connect to his highest character, being 
compassionate and humble. Trump doesn't know what those are at this point, 
he needs to mature a lot before given such power of leading a nation.﻿", - 
"""First Presidential Debate""",855Am6ovK7s,z12tu12p0xbguvbmy225tl5y0q2xjlmuq,2016-10-20T21:12:09.000Z,2016-10-20T21:12:09.000Z,http://www.youtube.com/channel/UCBG67a8IXdp-EzkntuMsXrg,howie6r,0,755,"Watching this All-American freak show from Nova Scotia. All I can do is 
shake my head.﻿", - 
"""First Presidential Debate""",855Am6ovK7s,z13qunv4hr32ip3f3231xf5xukymehbfi,2016-10-20T01:19:47.000Z,2016-10-20T01:19:47.000Z,http://www.youtube.com/channel/UCpOuBZH7kJQw4ww0jQNL1oQ,monster monster,0,756,Clinton is a baby killer I'm 11 I stay in debates all the time﻿, - 
"""First Presidential Debate""",855Am6ovK7s,z13bs5fpok30d50xd04cchmrjrujsxm5xfk,2016-10-20T17:12:44.000Z,2016-10-20T17:12:44.000Z,http://www.youtube.com/channel/UCNo-PE0Q8C1WcYQOTa1PAWA,HeavyMetalGurke,0,757,"who cares about jobs and money? we need a good ol war to wipe all humans so 
the earth can have piece allready﻿", - 
"""First Presidential Debate""",855Am6ovK7s,z12rcdxphrvodtjy204cfharcpvsipkjetc0k,2016-10-20T13:03:31.000Z,2016-10-20T13:03:31.000Z,http://www.youtube.com/channel/UCSB4XTHmO1JCu6BZp2EY3Hg,Victorythruattrition,1,758,Partial birth abortion is a special kind of evil.﻿, - 
"""First Presidential Debate""",855Am6ovK7s,z13sxha4fymkz53l4230uhtp2rnsg1blm,2016-10-20T16:32:40.000Z,2016-10-20T16:32:40.000Z,http://www.youtube.com/channel/UCGhmxioMG7ZNJmCGn0QEE8g,freeDUMB's a LIE,0,759,"The thing that bothers me in just seeing this debate is that hitlary is not 
responsible. She spends the whole debate trying to belittle Trump for what 
he has and hasn't done and said and when something about her is brought up 
like her deleted e-mails she lies about her intention saying it was a 
mistake and just expects us just to accept that, but she can sure try to 
make fun of Trump for his mistakes.﻿", - 
"""First Presidential Debate""",855Am6ovK7s,z12gzx3xcyqtt1iqo04cfp3zcvidexfxadw,2016-11-03T04:31:00.000Z,2016-11-03T04:31:00.000Z,http://www.youtube.com/channel/UCcIlNJRZIlq_NDVX4cyJAbw,Lar M,1,760,"HILARY CLINTON HAS ALL THE QUESTIONS ON HAND BEFORE THIS DEBATE STARTED. 
DISGUSTING.﻿", - 
"""First Presidential Debate""",855Am6ovK7s,z12fhpdibsnov1zmm23az5dg4qagvhcds,2016-11-06T16:53:36.000Z,2016-11-06T16:53:36.000Z,http://www.youtube.com/channel/UCQPD71VKi4LMI3QcWDdWrHQ,BingoNews,0,761,"Tump is the best choice, I think so!﻿", - 
"""First Presidential Debate""",855Am6ovK7s,z124v11rvymjzbkcx22hjjw5gprhiv2rb04,2016-11-08T23:13:43.000Z,2016-11-08T23:13:43.000Z,http://www.youtube.com/channel/UC_venJuJKSbbSvNiTFpVt7Q,Prince Danielle Buenavista,0,762,donald trump hates mexican﻿, - 
"""First Presidential Debate""",855Am6ovK7s,z12uxprrpubpvhb2l224xduqlqrog3y4e04,2016-11-08T19:02:23.000Z,2016-11-08T19:02:23.000Z,http://www.youtube.com/channel/UCRNTnYEyUaAgz2ODHQ4kIfg,Jean Jesus,0,763,Trump is gonna make are world a bader place that's why he's a bitch﻿, - 
"""First Presidential Debate""",855Am6ovK7s,z12jvb4pwuekfbump225uzg5kvmrhpe4l04,2016-10-16T15:31:35.000Z,2016-10-16T15:36:30.000Z,http://www.youtube.com/channel/UCcAunYzDjBH0vGu-e_cY0ow,Jessica Cruz,7,764,"""I want you to be very happy its very important to me""
*lips disappear*﻿", - 
"""First Presidential Debate""",855Am6ovK7s,z12bjp0wcsnjyhw3y23egjswdzbovb2gw04,2016-10-19T02:05:49.000Z,2016-10-19T02:05:49.000Z,http://www.youtube.com/channel/UC5Nz5Ikk8mN5909DDnbR1yg,puffalump76,1,765,lol Trumps little faces tho﻿, - 
"""First Presidential Debate""",855Am6ovK7s,z12isf3r5tzecjfc222nwlk4uqmxv1eoh04,2016-10-16T13:02:39.000Z,2016-10-16T13:02:39.000Z,http://www.youtube.com/channel/UCM53xkMC8723bJjVbTaXWjg,Good Man,11,766,Good bye America.﻿, - 
"""First Presidential Debate""",855Am6ovK7s,z12ktd24yqubydefs22nv3bywraeuv1zj04,2016-10-17T07:17:55.000Z,2016-10-17T07:17:55.000Z,http://www.youtube.com/channel/UCfq2in5AjhhMgjs5vfjBwhQ,Alyssia Ma,8,767,"It's hard to win an argument with a genius, but it's impossible to win with 
an idiot #prayformurica﻿", - 
"""First Presidential Debate""",855Am6ovK7s,z125etiiinueh5y4z04cg5zwqsvmwf2xnpg0k,2016-10-19T11:22:33.000Z,2016-10-19T11:22:33.000Z,http://www.youtube.com/channel/UCfQMreb5CdBywqk-fGn-FqA,That Girl,2,768,Cringe. Just major cringe. Good luck America.﻿, - 
"""First Presidential Debate""",855Am6ovK7s,z13ggb3iitn2uf0eb22yyndp5lfjgvhde,2016-10-19T12:42:35.000Z,2016-10-19T12:42:35.000Z,http://www.youtube.com/channel/UCJvCYCkxPphmPYlrxDA0C2w,Carol Danvers,1,769,"I hate Trump BUT I do agree with his take on absurdly high taxes that are 
ALREADY driving the businesses out of our country.If you want to bring back 
jobs lower all taxes and lower the spending, the democrats don't understand 
the huge government cannot be sustained and lowering spending is the way to 
go,not just shitting on everyone who's above the middle class.I'm a 
classical liberal and I'll always despise Trump and Hilary both BUT Trumps 
right about the jobs and taxes, lower taxes stimulate the economy, get over 
yourselves democrats.﻿", - 
"""First Presidential Debate""",855Am6ovK7s,z132wd5q3szvfr2we04cgde4cym1uvdaqxc0k,2016-10-18T01:14:04.000Z,2016-10-18T01:14:04.000Z,http://www.youtube.com/channel/UCY7M3ZhGX3IPAqEzrqms1Bg,Mike smith,1,770,"**ATTENTION** This video was linked to a website that is frequented by 
Bernie Sanders supporters. One of their signature posts is to pose as a 
foreigner and badmouth the United States. You can spot them a mile away.﻿", - 
"""First Presidential Debate""",855Am6ovK7s,z13pun0wyurtspvbf04cgliacpvnx1izml00k,2016-10-19T07:32:55.000Z,2016-10-19T07:32:55.000Z,http://www.youtube.com/channel/UCv_Ec2SBKPYUj-tul-zu8vA,george kenney,0,771,"Hillary Clinton tells nothing but Dirty for thats all comes out of her 
Dirty Lying mouth,﻿", - 
"""First Presidential Debate""",855Am6ovK7s,z13odldpps2cibxix04cjri4fomijnwrwoo0k,2016-11-12T12:57:59.000Z,2016-11-12T12:57:59.000Z,http://www.youtube.com/channel/UCxz6XgmFSqp0XIuvpmYyXjQ,Hassan Alobaydi,0,772,I think Trump will plan to something outside the law against Muslims﻿, - 
"""First Presidential Debate""",855Am6ovK7s,z134hno4hpilw31xj04cdprjctj2ezqpznk0k,2016-10-19T11:25:01.000Z,2016-10-19T11:25:01.000Z,http://www.youtube.com/channel/UCRn6TfFGmTb4R3sDjt6HxRw,Lexi Alvarado,1,773,vote for Hillary Clinton﻿, - 
"""First Presidential Debate""",855Am6ovK7s,z12tffo5vl3mw1bto23sivxzlzuoc15qo04,2016-10-17T15:12:20.000Z,2016-10-17T15:12:20.000Z,http://www.youtube.com/channel/UCq_BXxgMl1QiGKZ6OgJuuLA,Việt Trần,1,774,"who has a link for this video with english sub, plz give me﻿", - 
"""First Presidential Debate""",855Am6ovK7s,z13agrt5lrejfnejj04cgdipykarxfdqsrc0k,2016-10-17T19:30:13.000Z,2016-10-17T19:30:13.000Z,http://www.youtube.com/channel/UCo2PsVcdUspyAmc8fSSIOPA,John Baharoff Sr.,0,775,"To make things simple and easy to understand, Trump is compatible with 
Reagan.﻿", - 
"""First Presidential Debate""",855Am6ovK7s,z130u1bixoidj5cdb23zcbyxspjww5rup,2016-10-16T23:19:32.000Z,2016-10-16T23:19:32.000Z,http://www.youtube.com/channel/UCgPNwKdxg1ZVruKoPmfyFNg,imto fly,1,776,wr all should wat in till they pick﻿, - 
"""First Presidential Debate""",855Am6ovK7s,z12atzvruqifvznna224zniosp3ijxjgs04,2016-10-17T14:22:15.000Z,2016-10-17T14:22:15.000Z,http://www.youtube.com/channel/UC6XwCWY1GAyJNybiGciIeSA,Twiztidguy,1,777,"I feel as though he was interrupted by the moderator every god damn time he 
talked. Tell me I'm not the only one!!!???﻿", - 
"""First Presidential Debate""",855Am6ovK7s,z13sz5wjyq34wtric04cdh3zknbgwbajh20,2016-10-17T00:38:54.000Z,2016-10-17T00:38:54.000Z,http://www.youtube.com/channel/UCwEBeeYVyAk7F61PJlFjdaQ,deondre Pilk,0,778,This was a TREMENDOUS debate! lol﻿, - 
"""First Presidential Debate""",855Am6ovK7s,z12iixh5jwrshjadh22tyfvjpk3nuzztk,2016-11-11T13:23:13.000Z,2016-11-11T13:23:13.000Z,http://www.youtube.com/channel/UCROgUHZ3EdPfSRFn60G1flA,banananut bread,3,779,"I'm surprised. Trump has some great points, especially about being 
policeman of the world, I've never thought that should be our 
responsibility to right other people's wrongs. If he tones down the 
hotheadedness I think he'll be a good president.﻿", - 
"""First Presidential Debate""",855Am6ovK7s,z12ldnvjoza3g1fsq22mf1gq4xasi5vnj,2016-10-18T09:08:12.000Z,2016-10-18T09:08:12.000Z,http://www.youtube.com/channel/UCqZrhUq6F3r7sNyYr2knAqQ,Tanav Bajaj,1,780,Its two broken nuts fighting﻿, - 
"""First Presidential Debate""",855Am6ovK7s,z13zjpzbgpihdlpns222udhp4yy4fjhcj,2016-10-17T06:44:43.000Z,2016-10-17T06:44:43.000Z,http://www.youtube.com/channel/UC6nJIlOltO5gjG5XH1089Zw,Lori Lipson,1,781,"Hillary's answer to the email question was so vague lol she's so sketchy. 
She has something to hide more than Donald Trump.﻿", - 
"""First Presidential Debate""",855Am6ovK7s,z13yjvkq5xa5hxho404cj3vzjobkztiwnp00k,2016-10-18T05:08:49.000Z,2016-10-18T05:08:49.000Z,http://www.youtube.com/channel/UCAm1mDDHqj1oOt2hYHwI6Wg,#1 astronomy fan,1,782,"I'm from china, donald trump is so rude!﻿", - 
"""First Presidential Debate""",855Am6ovK7s,z12gdfrrcv3sglsch22jehmrfp34v3zie04,2016-10-18T19:53:45.000Z,2016-10-18T19:53:45.000Z,http://www.youtube.com/channel/UC_eHwf69w36hfriRx_cxlAw,Jordan Williams,1,783,im 2 and im worried about my future﻿, - 
"""First Presidential Debate""",855Am6ovK7s,z120hd1wcxvrgtlxe04chxs4tqfjt5grvpc0k,2016-10-18T13:22:35.000Z,2016-10-18T13:22:35.000Z,http://www.youtube.com/channel/UCiZ5_a56giX8oi393Lj7g_g,the reaper,1,784,trumped up trickled down﻿, - 
"""First Presidential Debate""",855Am6ovK7s,z13hcf3ifkqych1h304chteoaxftd1up5tg0k,2016-10-19T06:47:39.000Z,2016-10-19T06:47:39.000Z,http://www.youtube.com/channel/UCeu2R2SZR0SsnD3vFJF093A,YourDunzo Dunzo,1,785,like here if u want hilary to win﻿, - 
"""First Presidential Debate""",855Am6ovK7s,z13xjbyrirmvxlr3l235ztlatry3hvmw204,2016-10-17T03:22:41.000Z,2016-10-17T03:22:41.000Z,http://www.youtube.com/channel/UCB-JbbU9raGl6-4GWOusAig,Sonya Boardman,1,786,"Trump don't know what the hell he'd talking about cause not all Mexican's 
are bad. Also you cant blame someone's race and he better stop with the 
Mexican bullshit because people are sick of it.﻿", - 
"""First Presidential Debate""",855Am6ovK7s,z124ylmpyqedfzf2p23cjh5znnfsy11kj,2016-10-16T14:30:17.000Z,2016-10-16T14:30:17.000Z,http://www.youtube.com/channel/UCnuiCeRT5d3xpAge7KdUlkA,Marie Aupecle,1,787,Hitlary for JAIL!﻿, - 
"""First Presidential Debate""",855Am6ovK7s,z13njtb5nnizw50lh222vdo5fzveivlwo04,2016-10-17T23:26:18.000Z,2016-10-17T23:26:18.000Z,http://www.youtube.com/channel/UCfpljvqm7Jrux5fyFAQQwrQ,zhongze wang,2,788,Why the teacher give us HW on this things? Feels so bad.﻿, - 
"""First Presidential Debate""",855Am6ovK7s,z130zbzjpknrdrprk04ciztrsnfhhzzij3o,2016-10-17T16:18:20.000Z,2016-10-17T16:18:20.000Z,http://www.youtube.com/channel/UCzcY5WC7jqezAwItXsgIAwg,F zee,1,789,"""So I made a mistake. That happens. It proves I'm human, which you know, 
for some people, is a revelation."" - Hillary on Bosnia sniper fiction. 

""I made a mistake plain and simple."" - Hillary on Iraq war.

‘I Took Responsibility’ For Benghazi Attacks, but Security ‘Wasn’t My Ball 
to Carry’ - Hillary on Benghazi attack.

“I’ve said I [blew it],” she told Pelley, adding, “I made a mistake. I 
should’ve had two accounts, one for personal and one for office."" - Hillary 
on email scandal. 

Over and over Hillary makes mistakes. Bernie was right Hillary lacks the 
judgement to be President﻿", - 
"""First Presidential Debate""",855Am6ovK7s,z13wgtyifqnushnfk234w3obzsfyvxt4504,2016-10-18T00:19:58.000Z,2016-10-18T00:19:58.000Z,http://www.youtube.com/channel/UCi6eEJU0GfOCXKCzM4KuOog,Michael Herrick,0,790,"Peaple you are correct about them. I know something that would shock the 
world. The Antichrist gave them a extra power to there own power that would 
floor you. I have Proof and i cannot explain how but i can say allot about 
it. The Power gave to the Queen by the Antichrist is Youth and other things 
with it. The Antichrist has shocking power inside him to keep peaple alive 
wile torchoring peaple for years and to give Youth to anyone. The 
Antichrist can remove Deadly illeness out of anyone and give it to anyone. 
Antichrist is very evil and i think you all know why? Who is the devil? 
Hint? What power in the Devil is possable in the years of the Antichrist. 
They can do anything and i am not kidding around they can walk through 
walls stand around were you cannot see them. Home privacy is invaded in 
mean manners you are being watched in the bathroom at home in your bedroom 
at home. Your being laughed at! The Royals are not so nice and not anymore. 
There is allot more to this power. The Queen goes out in public looking 
normal and in secret privacy not even peaple that work for her knows. There 
could be a few workers that have agreed the secret or elce. She looks young 
with her Husband. She is way different looking than her young adult years. 
We are talking bigger Breast and a body women dream about. The other Royals 
have taken some of these powers to secretly look better to advance there 
looks. They were given energy to stay awake at all hours of the night also. 
The Antichrist can here peaple in the worlds thinking. There know what you 
think at all times the Queen also took that on With her Husband. They think 
evil thoughts about the peaple in the world along with this Antichrist. The 
Antichrist has been here for years and be honest with yourselfs and ask 
yourself when was this mark given to you years ago. Do anyone of you 
remember a strange males voice in your homes asking you if you were a 
christian?! That was the Antichrist. He would keep asking until you gave a 
awnser and it made you scared maby, confused maby. When you said no that 
you were not a Christian, Guess what? You got marked by Satan from the 
Antichrist. It happend! They did this to the world quick and sneaky for 
most peaple in the world. The high power leaders communicate with him. The 
world is now a sick evil joke and some of the High power leaders is in 
pretend mode with humans with some stuff they do. There lives are easy in 
ways and they live off powers to have more fun it's like better than a 
fairytail for them. our leaders are pulling your chain now! They will 
always make things look normal in front of your faces and your hearing. 
They gave Vanity and great bodies to certain peaple and we are talking 
major Vanity here. Satan is evil in Vanity issues and it happend through 
the Antichrist! There was a deal made with these select high power peaple 
from the Antichrist and he gave them this Vanity and energy and knowledge 
more than anyone could understand. They are up wile the world sleeps! They 
trully don't care about you. It is not just the peaple torchoring that they 
hate it is everyone in the world. They care for there family but there not 
so concerned about you. The Antichrist Hates all Human peaple in this 
world! It's like he became Satan himself when Satan gave him Power to give 
the Mark in the first place.﻿", - 
"""First Presidential Debate""",855Am6ovK7s,z12nhxqb4vagtv5ys04cd1vguyr3zfjzlvw0k,2016-10-18T18:49:49.000Z,2016-10-18T18:49:49.000Z,http://www.youtube.com/channel/UCS08OYfrKWFFRES98drhgGQ,counter,0,791,"The republicans and The trump are dividing people with their bigotry, 
racism, and fearmongering bullshit. Stay away from that party those 
lunatics. They are just not right for anybody.﻿", - 
"""First Presidential Debate""",855Am6ovK7s,z13cv3l5vqyvxrpym04ccp0o5quethayb1w,2016-10-18T06:03:56.000Z,2016-10-18T06:04:47.000Z,http://www.youtube.com/channel/UCzTgHqAHYVM6yA0Rx2ii_YQ,Amir Hamzah,0,792,People who fights for power won't fight for the people.﻿, - 
"""First Presidential Debate""",855Am6ovK7s,z12ihtfwvme0ttyhy04cjbzjoyzzxxejszs0k,2016-10-16T23:24:46.000Z,2016-10-16T23:24:46.000Z,http://www.youtube.com/channel/UCM8MplVplaKS_dwGwLXil4g,Lian Khan Muan Zomi,0,793,Nafta shits on America﻿, - 
"""First Presidential Debate""",855Am6ovK7s,z12sxzaghufwgji0e23ly5jyipawcb21m,2016-10-17T14:45:01.000Z,2016-10-17T14:45:01.000Z,http://www.youtube.com/channel/UCAVmZMGGFHi7hHNI62O3PWg,ongeri elijah,0,794,"Sometimes Dr. Martin Luther King had nightmares (He just didn't put it out 
there after the dream was a nightmare).... America you are on your own!﻿", - 
"""First Presidential Debate""",855Am6ovK7s,z13lwljacyz0y5iha04cfrr5unzkh5iw5ks0k,2016-10-19T00:17:34.000Z,2016-10-19T00:17:34.000Z,http://www.youtube.com/channel/UC1cbXM7wfW4vE_VHyWGZn_w,Such is Life,0,795,"Gotta go see the channel ""Bad Lip Reading"" ONLY THEN does the debate make 
perfect sense﻿", - 
"""First Presidential Debate""",855Am6ovK7s,z12rwhugovjsshaac04ce11bxoulxrjhhpc0k,2016-10-18T03:16:16.000Z,2016-10-18T03:16:16.000Z,http://www.youtube.com/channel/UCu3zaIq7gTSWPoWAWNJJQCw,Kevin Sleys,0,796,"I am reading through the comments and the part that scares me is how 
un-politically inclined and uninformed the american public is about what is 
important and essential to making our system of life function in this 
country. No one here even knows what nafta or the trans pacific partnership 
is or how much it has stolen money from the average american and funneled 
it to the top. People seem to 'THINK' that Trump represents all that we 
don't like about republicans. But you people forget that he isn't a career 
politician it's just the ticket he is on. Because they are misinformed 
about what has been going on for years but he actually isn't in bed with 
nearly as many people as Clinton is. Yes words are said and the media 
doesn't miss a thing but any person worth their salt has stirred the pot. 
The 1950s was the high watermark of the american economy anyone who did 
well was able to afford their own home and have access to a quality of life 
that every human being should be entitled to. I am not saying there wasn't 
a lot of social issues though. But regardless everything has gone downhill 
since and its because there are gutless people that have sold your lives 
for a profit to foreign countries and here is a guy that is willing to 
actually bring this up he gets MY VOTE.﻿", - 
"""First Presidential Debate""",855Am6ovK7s,z12zcdlpykv4ybmqf04cczob4mrlsr3zad0,2016-10-18T19:06:59.000Z,2016-10-18T19:07:30.000Z,http://www.youtube.com/channel/UCtqx5_ZZvXkr5L66YThvYaA,Gemma Speht,0,797,"Didn't they both do illegal things? So shouldn't they both be arrested?! 
What, are they too white, rich and powerful to be put in jail for breaking 
the law?!﻿", - 
"""First Presidential Debate""",855Am6ovK7s,z13czziy4xnvwx0be04civbouse2wxw4w3k,2016-10-18T07:12:54.000Z,2016-10-18T07:12:54.000Z,http://www.youtube.com/channel/UCeuv_nO1KkD_uNlnx0b0PGg,Slick Rock,0,798,It's sad. Can't we do better than these two?﻿, - 
"""First Presidential Debate""",855Am6ovK7s,z12ni5lwzsifvb1nw23veryjvsvrhnb5104,2016-10-18T00:01:12.000Z,2016-10-18T00:01:12.000Z,http://www.youtube.com/channel/UC-tZBCn6_4T0dlisCEYHeSA,Noodleo,0,799,"20:05 have you noticed Trump's lips start after the actual crack in his 
mouth﻿", - 
"""First Presidential Debate""",855Am6ovK7s,z12byf1rhp2uhpewk04ccb44wwivyr1i5pg0k,2016-10-18T15:54:01.000Z,2016-10-18T15:54:01.000Z,http://www.youtube.com/channel/UCb2eEFvR7eFG1zDAdclXdZg,Johnny Tasha,0,800,wwe﻿, - 
"""First Presidential Debate""",855Am6ovK7s,z13btdlhvvi5x1n2k23ogxppct3msvznx,2016-10-17T18:28:05.000Z,2016-10-17T18:28:05.000Z,http://www.youtube.com/channel/UCOJVH-N2W24jf8-OxVf5X9A,TheJeScast,0,801,"if these 2 would've been a married couple, then this would make sense.﻿", - 
"""First Presidential Debate""",855Am6ovK7s,z12xwfswlpybx5t5b04chlobburitlsjml00k,2016-10-18T02:56:59.000Z,2016-10-18T02:56:59.000Z,http://www.youtube.com/channel/UCRX6R8eVoZe5uJgWQlRBgIA,Drum Bo,0,802,"To all you pretentious foreigners trolling the comment section- shut your 
greasy pie holes. 







﻿", - 
"""First Presidential Debate""",855Am6ovK7s,z12hjtjhqz33wdhku22xud0rnuzvvrmxm04,2016-10-18T12:32:59.000Z,2016-10-18T12:32:59.000Z,http://www.youtube.com/channel/UCMRkHOfvDcSstn3gFnVt2cg,Alpha1 Omega2,0,803,"the moderator was very bias in his moderating. right off the start he asks 
trump what he would do to help bring jobs back. trump explains by reducing 
taxes for starters then the moderator wants to interrupt trump and ask him 
again about how he would bring jobs back as if he never heard trump make 
his statement of reducing taxes for the businessmen to encourage them to 
stay in the USA﻿", - 
"""First Presidential Debate""",855Am6ovK7s,z12bg35xjmbcw3piy04cfzezalyuejdxeg4,2016-10-17T04:39:29.000Z,2016-10-17T04:39:29.000Z,http://www.youtube.com/channel/UC_JISdot1dQEiOGNA5q4cQw,bobbob440,0,804,"The B52 is basically replaced by the multirole fighter bomber family of F# 
jet planes. The F35 lightning keeps the USA as kings of the sky.﻿", - 
"""First Presidential Debate""",855Am6ovK7s,z130wdup3x21chbvf23stdvpjqadvxagm04,2016-10-18T18:31:49.000Z,2016-10-18T18:31:49.000Z,http://www.youtube.com/channel/UC-NuhA1ZZh4DO4lLU95cBQA,Adrena Lee,0,805,"I wouldn't vote for either one. Did anyone notice how many times Trump 
sniffs. I think he trying to hide his coke addiction﻿", - 
"""First Presidential Debate""",855Am6ovK7s,z12wufrr2rfoyb2to22duha52xrjsxo2e,2016-10-18T09:15:47.000Z,2016-10-18T09:15:47.000Z,http://www.youtube.com/channel/UCE0_n1MiFzOJjdhNpSDhDug,DutchDude002,0,806,"you guys should run a psyche test for every candidate xD
idiots﻿", - 
"""First Presidential Debate""",855Am6ovK7s,z12czf54fsn3i1hhh04ch5gpjxyaf3lh33o,2016-10-19T12:50:30.000Z,2016-10-19T12:50:30.000Z,http://www.youtube.com/channel/UCNO6PQkIDgThmM2JXlaXKlw,Alen S,0,807,"the last part with the stamina...buuuurn xD you might wanna see a doctor 
for that burn mr trump﻿", - 
"""First Presidential Debate""",855Am6ovK7s,z13jgnwxblmggbbmb23edptqixuhdb5vf,2016-10-19T05:43:16.000Z,2016-10-19T05:43:16.000Z,http://www.youtube.com/channel/UC29BkJiNHiRQvx4r8nB2L4g,TheManisha10,0,808,"These both are acting like grown kids grow up be like a adult if you both 
cant do it step aside let someone do it for you. This never ends﻿", - 
"""First Presidential Debate""",855Am6ovK7s,z13jxt5quwupuhy1m22msl0ikxvgz5rvu,2016-10-17T17:28:40.000Z,2016-10-17T17:28:40.000Z,http://www.youtube.com/channel/UCeP0lvsOVRFKs3jd2LNxmQw,Raga Elite,0,809,"HILARY RIGGED IT. SHE MADE SURE THE DEBATE WAS ON HER GRANDAUTERS BIRTHDAY 
SO THAT SHE WOULD WIN THE PITY POINTS﻿", - 
"""First Presidential Debate""",855Am6ovK7s,z13hdx4yjpu2crwxa04cf5tysoucczd4kbo,2016-10-18T04:02:12.000Z,2016-10-18T04:02:12.000Z,http://www.youtube.com/channel/UCdGySZnospKnwyyG5lt9_0g,gwensf,0,810,"I dislike both candidates but I agree with Trump about the Fed and interest 
rates. They are creating bubbles in any asset that requires borrowing. They 
are engaging in financial repression since it is the only way to handle the 
situation we are in (gov't in huge debt) without a massive economic shock.﻿", - 
