video_title,video_id,comment_id,comment_date,updated_date,commenter_url,commenter_name,like_count,top_level_comment_num,top_level_comment,comment_reply
"""Third Presidential Debate""",smkyorC5qwc,z12yylva4o3rjxfuf23wj5nazz2wfx22l,2016-11-03T22:26:14.000Z,2016-11-03T22:26:14.000Z,http://www.youtube.com/channel/UC7xILLpab3Cd__o3STenYgQ,Tyra Kaeppler,0,748,"Okay: who's gonna win next week? 

I think Hillary will.

Annnnnd go.﻿", - 
"""Third Presidential Debate""",smkyorC5qwc,z12otryg4rzvdjbyf04cf3xz5y2ovpyjaak,2016-11-03T05:35:10.000Z,2016-11-03T05:35:10.000Z,http://www.youtube.com/channel/UC27EUE0aCp5Aue5rmoiIgBg,PreawJAN PreawJAN,0,749,53: 03 denying???? mannnnnnn did you guys see her? She like a lying machine﻿, - 
"""Third Presidential Debate""",smkyorC5qwc,z13ntrbpypb3hvwdo23nfpnotzaau30wi04,2016-11-02T23:40:21.000Z,2016-11-02T23:40:21.000Z,http://www.youtube.com/channel/UCHatLJUhpFPLIh5tHL1onQg,Tzvifoster23,0,750,"i would never ever vote for hilary who would want a presedent that is under 
investigason by the fbi﻿", - 
"""Third Presidential Debate""",smkyorC5qwc,z13agpowbpznsfyfu22dzxqpvorjutd1i,2016-11-03T04:37:31.000Z,2016-11-03T04:37:31.000Z,http://www.youtube.com/channel/UCzz0q4e7BWOGOuC69GEV1jA,MrAmigoman,1,751,PUERTO RICO BETTER THAN AMERICA!﻿, - 
"""Third Presidential Debate""",smkyorC5qwc,z125vl5omn3zvjg5t04ch1xj5ofsgz3w0uo0k,2016-11-07T07:08:05.000Z,2016-11-07T07:08:05.000Z,http://www.youtube.com/channel/UCp70sp_zBhAzBBWYsy2bAJA,A.S. Beg,0,752,"Check your inner voice first...1 day left!
How many of the American people are aware that there are other candidates 
that you can vote for?
It's sad that Gary Johnson and Jill Stein don't even have the opportunity 
to debate!﻿", - 
"""Third Presidential Debate""",smkyorC5qwc,z135zvxwuui5iln0m23ncfohsuebgrbqd04,2016-11-09T19:33:37.000Z,2016-11-09T19:33:37.000Z,http://www.youtube.com/channel/UCdQ-kNBHFcwDEPiiNlPB9Bg,steve live live,0,753,Trump cheap election﻿, - 
"""Third Presidential Debate""",smkyorC5qwc,z12ahltixp3ugdcjv04cgttbctingrkgtiw,2016-11-04T14:57:58.000Z,2016-11-04T14:57:58.000Z,http://www.youtube.com/channel/UCRgV35Ae2hDPEHVdMGQKwSQ,frowin001,1,754,Please just die . Both of you.﻿, - 
"""Third Presidential Debate""",smkyorC5qwc,z13qj33ysrygxx5an04cgnvglq3lxxioswg0k,2016-11-09T06:29:38.000Z,2016-11-09T06:29:38.000Z,http://www.youtube.com/channel/UCPdmwiwVdAQclEJUAPHRYkg,PANDA GAMING,0,755,Why vote Donald trump even Donald Duck won't﻿, - 
"""Third Presidential Debate""",smkyorC5qwc,z120u1bj4xrzxt4mz23rcjqixvmbhpjm1,2016-11-07T20:44:16.000Z,2016-11-07T20:44:16.000Z,http://www.youtube.com/channel/UCNaJxPYlynpVSqByaTSZKsw,basketballmarco,2,756,"He has every right to insult these women if the falsely accuse him of 
rape...﻿", - 
"""Third Presidential Debate""",smkyorC5qwc,z13wijsiuof4s5qvu233c5qyxwqschyo104,2016-11-04T03:03:34.000Z,2016-11-04T03:03:34.000Z,http://www.youtube.com/channel/UCpfEHh6FbxV_Gmg2P6gxEtQ,Brian  Haskins,0,757,"JUDGE GONZALO CURIEL RULES TRUMP MUST FACE TRIAL FOR RACKETEERING IN TRUMP 
UNIVERSITY SUIT

http://m.dailykos.com/story/2016/8/2/1556038/-Judge-Curiel-Rules-Trump-Must-Face-Trial-for-Racketeering-in-Trump-University-Suit
﻿", - 
"""Third Presidential Debate""",smkyorC5qwc,z13eujpgtlbcedbaf04chtprcpqtv51oshw,2016-11-07T09:56:42.000Z,2016-11-07T09:56:42.000Z,http://www.youtube.com/channel/UC4t0nQ52AAV_YUqJkKCT9pA,Polatkan Bozkurt,0,758,"Both candidates are nervous very natural. But u see anxious on Donald's 
face. He may even looks some angry it's ok. But Hillary is anxious as hell 
and she is trying to hide it. She is smiling a lot on inappropriate points 
with no reason. Trying to hide how unstable and anxious she is. When u look 
Donald he may is not best choice ever but clear and u see what he is into. 
If u can ignore some stupid unnecessarily tapes he has nothing to hide. Of 
course Hillary has nothing to hide except 33k e mails. How many of them she 
cleared herself. What several months later some of that 33 k mails show her 
relation with Russia isis or whatthef.ckever. But then she lol be under 
presidential coverage and free of all the charges. If u re running for 
president all of those mails must be checked because it's not a seventeen 
year old teenagers mailbox. May be that can give a clue why is Hilary that 
afraid anxious and smiling to showdown those.﻿", - 
"""Third Presidential Debate""",smkyorC5qwc,z123x1cjin2eshwjt04cif0hszutdr1pioc0k,2016-10-30T19:52:44.000Z,2016-10-30T19:52:44.000Z,http://www.youtube.com/channel/UCuqq16_SqCR1iH-pQDPgZQQ,Professor Boobies,15,759,Whenever Hillary smiles a piece of my soul burns in hell.﻿, - 
"""Third Presidential Debate""",smkyorC5qwc,z12twz1qpqa5jvpyp04civcbuwumwh2r0u40k,2016-10-30T22:52:16.000Z,2016-10-30T22:52:16.000Z,http://www.youtube.com/channel/UC2vf7r7-Ybhbq-akzvJnPGA,Mark Reeves,5,760,Hate to say this but clinton absolutely smashed trump﻿, - 
"""Third Presidential Debate""",smkyorC5qwc,z12cfvhpkua0eru5d04cezyqcpvdufziask0k,2016-10-30T12:29:10.000Z,2016-10-30T12:29:10.000Z,http://www.youtube.com/channel/UC56pL0fAh6d8JILICVwMmSA,Melkor Melkor,8,761,Whoever votes that bitch is 100% mentally ill.﻿, - 
"""Third Presidential Debate""",smkyorC5qwc,z122tjvi3l2xufv3023sshrxenvbc5p0z,2016-10-29T20:02:26.000Z,2016-10-29T20:02:26.000Z,http://www.youtube.com/channel/UCNeS1GibSkAqsUtuAScvCfg,Wolf Alshehri,3,762,"if I was an American I would go with Donald Trump ... never trust 
politicians﻿", - 
"""Third Presidential Debate""",smkyorC5qwc,z13vsvyxmljtudrsu23mtr3qktbli5jf1,2016-10-30T22:13:28.000Z,2016-10-30T22:13:28.000Z,http://www.youtube.com/channel/UCE5Rs6z3IFYURm2hS__7l2A,TheJwang8000,4,763,#Hillaryforpresident #Imwithher﻿, - 
"""Third Presidential Debate""",smkyorC5qwc,z13redi4knuodzukh23kwdwaaoutwvwb404,2016-10-30T23:14:40.000Z,2016-10-30T23:14:40.000Z,http://www.youtube.com/channel/UCIlP9jUbBVXzEzTW88uHjOw,LucarioOfLegends,1,764,"I am about to see how long it takes for Trump supporters spew ignorant 
b******t out of their... wherever. In defense, I am going to build a wall 
of factual information that makes them pay for what they said.


Trump is a narcissistic racist who only believes in his own finacial gain.

Fight Me.﻿", - 
"""Third Presidential Debate""",smkyorC5qwc,z12qgrn5jpies33cr23njznglqeltrdx404,2016-10-31T06:03:46.000Z,2016-10-31T06:03:46.000Z,http://www.youtube.com/channel/UCA0y14Od4q8mrZvcxv40_oQ,Cocka Doodle Doo,2,765,Trump doesn't know anything tbh﻿, - 
"""Third Presidential Debate""",smkyorC5qwc,z12chvvz4qjatv0o304cijq5jkqajfnidts0k,2016-10-30T05:57:50.000Z,2016-10-30T05:57:50.000Z,http://www.youtube.com/channel/UCTPhhywma7qYNHVeFydsL-g,Georgie Porgie,1,766,"Lock up Hillary Clinton. The Clintons are a criminal enterprise. Donald 
Trump is strong and loves his nation. It's about time the USA had a real 
president again. Obama is a clown, but he's a dangerous clown.﻿", - 
"""Third Presidential Debate""",smkyorC5qwc,z13usdw4uv25dj54z04cfloqlzb3t3czz30,2016-10-31T13:36:23.000Z,2016-10-31T13:36:23.000Z,http://www.youtube.com/channel/UCeROvt6evEDHxbX3507X3vA,Roland Horváth,1,767,What was that sound at 1:20:03?﻿, - 
"""Third Presidential Debate""",smkyorC5qwc,z12oczqr0pirxtefl22sgtwiktupexm3b,2016-10-31T12:06:01.000Z,2016-10-31T12:06:01.000Z,http://www.youtube.com/channel/UCz71gACpBR8Z4tWkpoq9vEg,Perry En,3,768,I'd rather have a clown like Trump than a terroristi like Hillary.﻿, - 
"""Third Presidential Debate""",smkyorC5qwc,z12tchab1zrqybbal04cfrsw2mv0cvl4nks0k,2016-10-31T02:00:54.000Z,2016-10-31T02:00:54.000Z,http://www.youtube.com/channel/UCdhSdOGj7gfF_GJUCq36AqA,Donna Milligan,2,769,"We need to turn this world around before it crashes we need to pray for the 
USA every day every day everybody needs to pray for the USA﻿", - 
"""Third Presidential Debate""",smkyorC5qwc,z124irfgbzresbxgq04cizibwm2zxpdgnto0k,2016-10-30T17:00:54.000Z,2016-10-30T17:00:54.000Z,http://www.youtube.com/channel/UCFC8caAfTV4FehIIn45Ddig,TheNarrator,1,770,"50 minutes in, when do the mini games start?﻿", - 
"""Third Presidential Debate""",smkyorC5qwc,z12hgliqpyvbzdqj504cj1p4aze2xbzic50,2016-10-29T14:42:07.000Z,2016-10-29T14:42:07.000Z,http://www.youtube.com/channel/UCy5mH9peLLqMyB3GVN40Ruw,[FM],0,771,"The emails are out...turns out it was not Russia. It's as if she wants 
another War.﻿", - 
"""Third Presidential Debate""",smkyorC5qwc,z135v5li0tfwcjfpy04cdpsobrvuyzvopn40k,2016-10-31T15:54:41.000Z,2016-10-31T15:54:41.000Z,http://www.youtube.com/channel/UCRVSyNTGgPBaXInf0tJvwMQ,Pan The Vegan,0,772,"didn't see the questions my ass. I see Hillary looking down at her ready to 
go script 24/7﻿", - 
"""Third Presidential Debate""",smkyorC5qwc,z131ufgosyvgy3tq004cfzzhktvlhd0rd4s,2016-10-31T04:21:01.000Z,2016-10-31T04:21:01.000Z,http://www.youtube.com/channel/UCublMW8Q7M1P0aXbpjAe9Dg,Max Pieters,1,773,"These guys are absolutely terrible options. Heck, I could probably be a 
better president than them. Which is to say I would be a terrible 
president, but I don't exactly have a high bar to get over.﻿", - 
"""Third Presidential Debate""",smkyorC5qwc,z13ltzmginbohvqew22lu5eihorvgtp2c,2016-10-30T21:00:49.000Z,2016-10-30T21:00:49.000Z,http://www.youtube.com/channel/UCzoo6XnT2cbPasn4Kc0Zb_g,Othello Edmond,1,774,Did Hillary ever give an answer about those emails.﻿, - 
"""Third Presidential Debate""",smkyorC5qwc,z135ydmicsrkj5hwx04ccxii1rfeejoakf4,2016-10-29T16:59:35.000Z,2016-10-29T16:59:35.000Z,http://www.youtube.com/channel/UChM9EWKXQmbbbGdb7INwZSQ,blasphemy18,2,775,pretty sure trump is just drawing circles﻿, - 
"""Third Presidential Debate""",smkyorC5qwc,z12mtf3xgriqhv2g304chd5jiq34eza5r0k,2016-10-30T21:25:33.000Z,2016-10-30T21:25:33.000Z,http://www.youtube.com/channel/UCNBTEcrFekt5urdiUkroPZQ,martin rohac,1,776,"1:20:00
Lol someone is whispering her the word ""dozens"" cause she canot recall what 
she wants to tell...
Thats what I call cheating on the top level... :D﻿", - 
"""Third Presidential Debate""",smkyorC5qwc,z12kzfwocpbxiv0q204chjbjumirvbhq1ws0k,2016-10-29T10:22:25.000Z,2016-10-29T10:22:25.000Z,http://www.youtube.com/channel/UC09DAl4lOJ4Q-PX-swxV1iA,Lili,0,777,"Why does it feel like the republicans think they're obligated to oppose 
everything the democrats propose....﻿", - 
"""Third Presidential Debate""",smkyorC5qwc,z13hffi5tnycvznoj04cifqxxnjuwrqafnk0k,2016-10-29T18:43:46.000Z,2016-10-29T18:43:46.000Z,http://www.youtube.com/channel/UCLr2ol6UbUKJV2WBXYt-8AA,Epistol Show,1,778,He's a nazi.﻿, - 
"""Third Presidential Debate""",smkyorC5qwc,z12ywtzboxiucxgpy04cdtqhwlqrwt2yius0k,2016-11-25T17:40:52.000Z,2016-11-25T17:40:52.000Z,http://www.youtube.com/channel/UCOOyuSM4ESr9kvq2dSvAZxw,Gerald Williams,0,779,"11/25/16 Conflict of Interest on overdrive. How does Trump expect us to 
trust him with nuclear capabilities when he denies intel briefings? What 
job did he think he was going for? He'll get his own intel I guess. He gets 
to pick and choose what's important to know.﻿", - 
"""Third Presidential Debate""",smkyorC5qwc,z13lybawvs3libt0423mth152xixfpi5u04,2016-10-29T20:07:27.000Z,2016-10-29T20:07:27.000Z,http://www.youtube.com/channel/UCBZOjcFMrq4IcC5Kcm7vo5g,IncorporatedOps,0,780,"I used to think the 2012 election was bad. If only I knew what was 
coming....﻿", - 
"""Third Presidential Debate""",smkyorC5qwc,z12zwprilzjfcnud022hgpxqwk3cwbknq,2016-10-30T04:17:38.000Z,2016-10-30T04:26:42.000Z,http://www.youtube.com/channel/UCfH0CFk6K3Qvn95V6mJbfZg,Ivan G,0,781,Successful Entrepreneur VS Corrupt Liar Politician﻿, - 
"""Third Presidential Debate""",smkyorC5qwc,z13qsjxwqva5gzh3a22wx3fjasagityqt04,2016-10-30T04:45:46.000Z,2016-10-30T04:45:46.000Z,http://www.youtube.com/channel/UCIWawxU46g5jv-y3MUaGCVQ,JakeDoesGames 1,3,782,"Trump could nail Hilary with all the illegal stuff she has done and is 
still doing﻿", - 
"""Third Presidential Debate""",smkyorC5qwc,z135ityiowrjgn0va23cwt0yhzvoztptg,2016-10-29T17:13:34.000Z,2016-10-29T17:13:34.000Z,http://www.youtube.com/channel/UC-fvOYpXboJVikorYX2SWAQ,WardedHD,0,783,"I have a Hillary I have a Trump 
..URGH
World War III﻿", - 
"""Third Presidential Debate""",smkyorC5qwc,z13felbqflufun4zc04cdl5ygwnqj50jlt00k,2016-10-31T03:40:01.000Z,2016-10-31T03:40:01.000Z,http://www.youtube.com/channel/UC_MIUPs923VXyTF42MudRkA,Cavalio Thorson,0,784,"Why something has happened to them yet, I don't know.﻿", - 
"""Third Presidential Debate""",smkyorC5qwc,z12lyj2rmkijch0wg04cirzzovrhg1oxjwo0k,2016-10-29T18:54:43.000Z,2016-10-29T18:54:43.000Z,http://www.youtube.com/channel/UC8ANGlWvbRtG0JRLPCIrZIw,Diamond Hype,1,785,If either of these become president the world is screwed﻿, - 
"""Third Presidential Debate""",smkyorC5qwc,z132wreoryb4i5xhp04cg30oks3lwjkxi20,2016-10-29T12:44:28.000Z,2016-10-29T12:44:28.000Z,http://www.youtube.com/channel/UCJVw5WnYDyqYa6G8EpfqDqA,Andrej guesswho,0,786,"To all the few still remaining ignorant & brainless fools who won't vote 
for the glorious Trump/Pence ticket I say: I will personally knock on your 
door and bitch-slap your yuuuge smelly horse asses HARD over the Trump-Wall 
back to yesterday!﻿", - 
"""Third Presidential Debate""",smkyorC5qwc,z133i52zrpf5fjjis04cilrzpo2bunjrdp40k,2016-10-30T06:36:05.000Z,2016-10-30T06:36:05.000Z,http://www.youtube.com/channel/UCXBX-HzaYUwDIiLAIIaeO6A,shaun d,0,787,"Personalities aside, Trumps policies are completely better than Hillary's. 
Don't know how anyone can even think about supporting her. Horrible 
policies and personality.﻿", - 
"""Third Presidential Debate""",smkyorC5qwc,z135wb4yfvmjwrofe23xjzujlzrgsdjgy04,2016-10-30T12:27:56.000Z,2016-10-30T12:27:56.000Z,http://www.youtube.com/channel/UChSF6fYnwviW-aFYRhO0XyA,Jada Williams,0,788,"I get that I don't know about political discussions because I'm 11 but I'm 
scared who is gonna be the president because of our eduction and if we are 
gonna be able to afford it﻿", - 
"""Third Presidential Debate""",smkyorC5qwc,z13xzt3qwkm3g5vna232tx5q2pvdxdhv4,2016-10-31T02:44:18.000Z,2016-10-31T02:44:18.000Z,http://www.youtube.com/channel/UCVP1_rWNnwHa23JR_c1SRQg,Cody Wilburn,1,789,go trump﻿, - 
"""Third Presidential Debate""",smkyorC5qwc,z12uhdmqjqb1vhcuu23fsryohkr4trt5w04,2016-10-31T06:05:36.000Z,2016-10-31T06:36:28.000Z,http://www.youtube.com/channel/UC6tP2OpItqJSQ5t1MUF4e5g,Iddih Jahrabbi,1,790,"Hilary Clinton, First Woman President of the USA!
Let Women prove themselves and show their Capacity at Leading! 
Hilary 2016 ! go mother!﻿", - 
"""Third Presidential Debate""",smkyorC5qwc,z130czlwuqige3y3322eujjohlu0f1ffz,2016-10-31T16:08:37.000Z,2016-10-31T16:08:37.000Z,http://www.youtube.com/channel/UCGYWDd5dsXRSwONHEx0RzGw,Anti Cardboard,0,791,WTF 30:00 SUBTİTLES!﻿, - 
"""Third Presidential Debate""",smkyorC5qwc,z12rtvhygzfjjfwg104cdh5qjn2pdh2iauo0k,2016-10-30T03:46:17.000Z,2016-10-30T03:46:17.000Z,http://www.youtube.com/channel/UCk9YIydJVblYm_n4HbP315A,Rosalinda Margares,1,792,Trump is in idiot ass﻿, - 
"""Third Presidential Debate""",smkyorC5qwc,z13efpgwerygjhfbe04cgdmimvy4dpgr02w,2016-10-30T19:12:44.000Z,2016-10-30T19:12:44.000Z,http://www.youtube.com/channel/UCISDX3nzZB0cUlZX4nies2w,9010manassas,0,793,anyone making less than 45k/year should not pay taxes.﻿, - 
"""Third Presidential Debate""",smkyorC5qwc,z13tdvh5yqfbubtyx04cjn544yfmwhlob0g,2016-10-31T11:51:58.000Z,2016-10-31T11:51:58.000Z,http://www.youtube.com/channel/UCvvp7JG9kceE8xUjt7oDOkQ,이지원,0,794,hilary toy =NBC NEWS﻿, - 
"""Third Presidential Debate""",smkyorC5qwc,z13yd3vjfympg5gs2225d11w4zbrublf2,2016-10-30T02:53:30.000Z,2016-10-30T02:53:30.000Z,http://www.youtube.com/channel/UC0RMzqp7M7cbBzin8NU6TtA,Animeality,0,795,"""The RUSSIAN government has engaged in ESPIONAGE against AMERICANS.""

XD﻿", - 
"""Third Presidential Debate""",smkyorC5qwc,z13pxvgyhn2qidw0p23uw3txzlidizzcb,2016-10-30T06:42:40.000Z,2016-10-30T06:46:24.000Z,http://www.youtube.com/channel/UCfhS1Wdcl1xHbxIXBc_ZwgQ,Matthew Torres-Tadeo,0,796,"Idk if I'm hearing thing but listen very very very close around the 1:20:00 
and you hear a voice whisper something, it sounds like something is 
whispers what she's suppose to say or something....creeeepy﻿", - 
"""Third Presidential Debate""",smkyorC5qwc,z12wzfjwfkbbvfncw23ufdx41qvazjtdi,2016-10-31T08:34:45.000Z,2016-10-31T08:34:45.000Z,http://www.youtube.com/channel/UCI8y0nkIcV2tTd3Ywukh_hA,Mundo Fantástico,0,797,"The beauty and the Beast..not pretty sure if she is really the Beauty but 
he....he is definetly the Beast!﻿", - 
"""Third Presidential Debate""",smkyorC5qwc,z13yxdryjkiti1xgc04cixfijsaxyrzr5xk0k,2016-10-29T14:20:26.000Z,2016-10-29T14:20:26.000Z,http://www.youtube.com/channel/UClQ-UZsYA-Z6QQ1eowmV6QQ,Cirne Songs,0,798,https://soundcloud.com/cirnesongsascap/whose-idea-was-this﻿, - 
"""Third Presidential Debate""",smkyorC5qwc,z13jcffbqtecvlt1b231vbz5bur3wvxi304,2016-10-30T10:02:05.000Z,2016-10-30T10:02:05.000Z,http://www.youtube.com/channel/UCUpD0mL24D0ApL1tZXLnwXw,az21bob666,0,799,"women already get paid the same as men the wage gap is a myth. second if 
she is paying for college, that mean that there are takeing more of my 
money.   and the people making min wage, if you raise it,  they will work 
LESS hours, because they still want to be under the min so they can still 
get free money.﻿", - 
"""Third Presidential Debate""",smkyorC5qwc,z13ycpvo4kjsxl3u4221hhgxcviwtnmqs04,2016-10-29T20:03:03.000Z,2016-10-29T20:03:03.000Z,http://www.youtube.com/channel/UCWQQtto-Ef4zn9POPlcYTOw,andy davis,0,800,"trumps boat will pick him up.Hillary calls u.s military,and they never 
leave dry land.﻿", - 
"""Third Presidential Debate""",smkyorC5qwc,z13iyxlpfracif5k123kh5nxztnbwdqul,2016-10-30T18:19:22.000Z,2016-10-30T18:19:22.000Z,http://www.youtube.com/channel/UCC0j8uuj-Rv8ZV9MYXE8wDQ,Ryan Martin,0,801,NO NOISE Trump supporter be like why did I come here﻿, - 
"""Third Presidential Debate""",smkyorC5qwc,z13scvpjuy2hfn2nt23jtj2ofvyeg3kyu04,2016-10-30T01:27:19.000Z,2016-10-30T01:27:19.000Z,http://www.youtube.com/channel/UCQ4Vs5tb56Y-tidqVCrTEMQ,Fakhouri 21,0,802,"Their debates are cancer, all what i hear is he did this, she did that bla 
bla bla...﻿", - 
"""Third Presidential Debate""",smkyorC5qwc,z13oiboqel2iixkut22bzxxwttuvwdccn,2016-10-30T10:19:46.000Z,2016-10-30T10:19:46.000Z,http://www.youtube.com/channel/UCmVbEjQdvLEq20Um0FE7htQ,mr noob peluri,0,803,donalt idiot i'm from finland no shot pls thanks﻿, - 
"""Third Presidential Debate""",smkyorC5qwc,z13yc1or2ymgsbjmj22ecpmyqr2tvbqzh04,2016-10-30T20:41:45.000Z,2016-10-30T20:41:45.000Z,http://www.youtube.com/channel/UCOMtZT331S47hw9yQxCiDmQ,Mounds Brian,0,804,"Take your tanks an missiles and soldiers out of Eastern Europe back to USA! 
I do not need atomic war over there! I never wanted NATO! I never will!﻿", - 
"""Third Presidential Debate""",smkyorC5qwc,z13rxdsxzunvvrhmn23qczwgtuulxznlp,2016-10-29T20:42:21.000Z,2016-10-29T20:42:21.000Z,http://www.youtube.com/channel/UC5C81DQXXoGrJXOxIWgkKog,boaz2063,0,805,"What about the answer to the question, does she want open borders and if 
she said she wants open borders why does the russian hacking and stealing 
the comment change the way she feels about the border?﻿", - 
"""Third Presidential Debate""",smkyorC5qwc,z12fwrkxasqkx550423zv31imkacvpnxc04,2016-10-30T16:51:56.000Z,2016-10-30T16:51:56.000Z,http://www.youtube.com/channel/UCW_7uVsfOiYs7MsGq16qtKA,BreezyToxic,0,806,He started with a 1 billion dollar loan XD.﻿, - 
"""Third Presidential Debate""",smkyorC5qwc,z134jbqrqunscbjzq04cfbz5jrzsulv5ihw,2016-10-30T23:06:17.000Z,2016-10-30T23:06:17.000Z,http://www.youtube.com/channel/UCv1U4E6lIaxeLmy44qi8VVw,DABlair,0,807,And eventually Hillary will go to prison.﻿, - 
"""Third Presidential Debate""",smkyorC5qwc,z12aefdzuqjjzppdb23zhlvwupayctbgv04,2016-10-29T16:25:13.000Z,2016-10-29T16:25:13.000Z,http://www.youtube.com/channel/UC6waUaq7iH9DxdOq5GNcWgA,Robert Carter,0,808,"Hey F U Will Ferrell ... 

how much are they paying you, moron.﻿", - 
"""Third Presidential Debate""",smkyorC5qwc,z123cpcwcsqxtjgna223shar0un2j5o1g,2016-10-29T20:21:50.000Z,2016-10-29T20:21:50.000Z,http://www.youtube.com/channel/UCALlltVt9Oq8se6O_DMCQ4Q,Paul Guy,0,809,She is gonna get us killed talking bad about other countries.﻿, - 
"""Third Presidential Debate""",smkyorC5qwc,z13xcbgbtofbszc4g04cgneq0yari5faaqc0k,2016-10-30T10:30:39.000Z,2016-10-30T10:30:39.000Z,http://www.youtube.com/channel/UCei7pgmVYPfcSJs3WOmq9aA,Лена Ленина,0,810,Always interesting news on this channel!﻿, - 
"""Third Presidential Debate""",smkyorC5qwc,z13sudoavqbewnn1v22bvbzxarepufyjv04,2016-10-30T09:03:19.000Z,2016-10-30T09:03:19.000Z,http://www.youtube.com/channel/UCXmRFy90GFgO8Nof-x-ALGQ,Chelsea fc,0,811,"Seriously Hillary is the biggest liar, how is she allowed to try for 
president, when she is in trouble with the FBI !!﻿", - 
"""Third Presidential Debate""",smkyorC5qwc,z125drqxpwzvcdg3q22nt3dojq34dhmfj,2016-10-30T04:37:23.000Z,2016-10-30T04:37:23.000Z,http://www.youtube.com/channel/UCTy5cYQmtRpl0krKv60NGvg,Tunadez7,1,812,"I still don't understand why they don't just mute the mic of the candidate 
who doesn't have the turn﻿", - 
"""Third Presidential Debate""",smkyorC5qwc,z123fbjr5vfnetzbf04cetsraoqzfl0gfwc0k,2016-10-31T16:02:21.000Z,2016-10-31T16:02:21.000Z,http://www.youtube.com/channel/UCp6Y1O1gZle_TLwlVlhJS9Q,Kevin Martinez U.S Army,0,813,Wow finally a moderator that was actually moderate.﻿, - 
"""Third Presidential Debate""",smkyorC5qwc,z13gubhhdxryzhmeo23qufuwcouzerxlh,2016-10-29T19:47:26.000Z,2016-10-29T19:47:26.000Z,http://www.youtube.com/channel/UCISU8ICDVReKFSWFZxzlIhw,Rowan Quatre,2,814,"Debate Summary: 
Hillary: I think he said something mean
Donald: I didn't say that, you voted for a bad law 
Hillary: I did not vote for that law (did vote for the law), that is false, 
I have always been against that. You said this mean thing. 
Donald: No, E-mails are bad. 
Hillary: 9/11 was bad and I helped the people. You called random woman fat. 
Donald: Your experience in government is bad 
HIllary: Stop oppressing woman, give citizenship to illegal immigrants cuz 
they vote for m- I mean give them citizenship to improve economy.... 
Donald: That won't work cuz xxx 
Hillary: That's not true, it will work because I hope it does. Pepe is a 
symbol of HATE 
Donald: Wut﻿", - 
"""Third Presidential Debate""",smkyorC5qwc,z12lfbsh2sz2sldgb04cjryjvrrmtpp5oj4,2016-10-31T12:02:04.000Z,2016-10-31T12:02:04.000Z,http://www.youtube.com/channel/UCl4gzvk6zs8yEaFKr-rpi-Q,Yoga Mahardika,0,815,"And here he is, Donald Trump doesn't knowing about The Rules of War, AGREED 
International Law.﻿", - 
"""Third Presidential Debate""",smkyorC5qwc,z12kuj3wxonjjnqxe04cjt1jtxbgzbz4a5g,2016-10-30T15:21:48.000Z,2016-10-30T15:21:48.000Z,http://www.youtube.com/channel/UCe62HfgN7CFSqaUKPjLtc1w,NEWSO,0,816,"how they go out to Nevada where Pac died and have a debate moderated by 
Chris Wallace.... They on some gangsta rap shit>﻿", - 
"""Third Presidential Debate""",smkyorC5qwc,z12adz5heoqqgjekr22dux4pdtzqvpbtx,2016-10-29T16:41:09.000Z,2016-10-29T16:41:09.000Z,http://www.youtube.com/channel/UCA4q7RL4ZNeeti9smzGE0aA,Amol Garud,0,817,"MIND YOU , THE JUDICIARY OF USA IS IN THE POCKET OF BIG BROTHER-- THE WAY 
INDIAs COLLEGIUM JUDICIARY IS.

CROOKED HILLARY WILL SOON USE THE KOSHER JUDICIARY OF USA TO FIGHT THE FBI 
DIRECTOR IS A MAFIA STYLE PERSONAL ATTACK--MARK MY WORDS

USA IS WORSE THAN A BANANA REPUBLIC TODAY, RULED BY A EVIL SHADOW GOVT  . 
HILLY BILLY YANKS HAVE A WHIFF OF WHAT IS GOING ON.

THEY ARE HELPLESS AND ANGRY -IF HILLARY WINS A RIGGED ELECTION- THIS PLANET 
CAN WITNESS A NEW AMERICAN REVOLUTION.

THE ORDINARY YANKS ARE ASHAMED OF THEIR LEADERS WHO DARE NOT UTTER THE 
DREADED WORD "" R ""

EVEN PUTIN WITH ALL HIS MIGHT , IS AFRAID TO UTTER THE WORD ""R""

capt ajit vadakayil
..﻿", - 
"""Third Presidential Debate""",smkyorC5qwc,z13pebrr5sagh5oaz04cd3j4ho3hclqozro0k,2016-10-29T22:33:11.000Z,2016-10-29T22:33:11.000Z,http://www.youtube.com/channel/UCOypxCVEbRQbP1LuMbg0w9Q,Margaret Rogers Van Coops,0,818,"Read my book: Pro-life, Pro-Choice, Pro Spirit and then you will know what 
the truth is. You can find it on amazon.﻿", - 
"""Third Presidential Debate""",smkyorC5qwc,z12aud45uljyxfmmt22oglcjezm5vlnw104,2016-10-30T05:09:43.000Z,2016-10-30T05:09:43.000Z,http://www.youtube.com/channel/UCRVYkhyVqy3qnsTpWKKkW2w,Miranda G,0,819,"Wow I was scrolling through these comments and all I see is ""VOTE FOR 
TRUMP"" And ""HILLARY SUCKS"" And ""I from a different country so I don't care"" 
I mean come on really are only true supporters watching this really﻿", - 
"""Third Presidential Debate""",smkyorC5qwc,z13cf5wa3lieufzuo221ttfbjq33epmdy,2016-10-30T19:14:59.000Z,2016-10-30T19:14:59.000Z,http://www.youtube.com/channel/UCNysa99F2iE-3rgwM-rKrxQ,pr11nse,0,820,"Donald Trump, is a blind hunter, whereas Hillary sounds like a traditional 
farmer. Either one can spell disaster ..﻿", - 
"""Third Presidential Debate""",smkyorC5qwc,z13qgjxruzjtiz2lj23pvxpgiy2nylvin04,2016-10-30T00:25:20.000Z,2016-10-30T00:25:20.000Z,http://www.youtube.com/channel/UC71ZMahUdrvoDQqMQkcB7qw,Chris And Jen Adventures,0,821,Gary Johnson Anyone?﻿, - 
"""Third Presidential Debate""",smkyorC5qwc,z13fyh5w1zm2yhmhw04celeofqmkxpkrl0c,2016-10-31T12:14:02.000Z,2016-10-31T12:14:02.000Z,http://www.youtube.com/channel/UCWLI1H8YDbjC65T9D_Rupkw,Sierra,0,822,"#TBT, Arnold Schwarzenegger would have been the best choice.﻿", - 
"""Third Presidential Debate""",smkyorC5qwc,z13yedoi5q3xjx1ta23ofdczslmdz1k5f04,2016-10-29T15:44:50.000Z,2016-10-29T15:44:50.000Z,http://www.youtube.com/channel/UCNRU7HLQKlUBv6NF16tIgpg,Rhiannon Trey,0,823,"Where does he say ""such a nasty woman""?﻿", - 
"""Third Presidential Debate""",smkyorC5qwc,z130ybyicnaoi522m22zh1sp1zyeudzu2,2016-10-29T12:05:05.000Z,2016-10-29T12:05:05.000Z,http://www.youtube.com/channel/UCnlN_ffRXhDi2R8EvU01JEg,Alex Dubova,0,824,We don't know if He does. We can only believe.﻿, - 
