video_title,video_id,comment_id,comment_date,updated_date,commenter_url,commenter_name,like_count,top_level_comment_num,top_level_comment,comment_reply
"""Third Presidential Debate""",smkyorC5qwc,z12yztmxyo2rhvyst22bcribtn3ncblx104,2016-10-26T20:32:36.000Z,2016-10-26T20:32:36.000Z,http://www.youtube.com/channel/UCz-Ch2GFDfMGgB_GPBMwAPQ,Evan's Aviation,156,1,I'm Irish and I don't care😂🇨🇮🖕🏻﻿, - 
"""Third Presidential Debate""",smkyorC5qwc,z12yztmxyo2rhvyst22bcribtn3ncblx104.1480644176042278,2016-12-02T02:02:56.000Z,2016-12-02T02:02:56.000Z,http://www.youtube.com/channel/UCQB1tTCYCFr9qPOsppaHv-A,brian earl spilner,0, - , - ,ITS ALL CONTROLLED BY THE ILLUMINATI
"""Third Presidential Debate""",smkyorC5qwc,z12yztmxyo2rhvyst22bcribtn3ncblx104.1480482152145079,2016-11-30T05:02:32.000Z,2016-11-30T05:02:32.000Z,http://www.youtube.com/channel/UCd-rL_fCT-mYuqBTa7HOJfw,Will Dawson,0, - , - ,You were better off under British rule.
"""Third Presidential Debate""",smkyorC5qwc,z12yztmxyo2rhvyst22bcribtn3ncblx104.1480413912193375,2016-11-29T10:05:12.000Z,2016-11-29T10:05:12.000Z,http://www.youtube.com/channel/UCASd4jU-V_piIuMzOYqcNDw,RRebeliTBA,0, - , - ,"ɷɷɷ Heeeeyyy Friends I Have Justt Won Branddd New iPhone 6 From visitt : - 
https://twitter.com/FighterCpmocsb8/status/803536265823956992"
"""Third Presidential Debate""",smkyorC5qwc,z12yztmxyo2rhvyst22bcribtn3ncblx104.1480219600258393,2016-11-27T04:06:40.000Z,2016-11-27T04:06:40.000Z,http://www.youtube.com/channel/UC4Ru_BSWhNfqYX15aGPoClg,Cino colonna,0, - , - ,"ɷ Heeeey Frienddsssss I Have Justttt Wonn Brandd New Samsung Galaxy s7 From 
visitt : - https://t.co/mEhpAmjS2y"
"""Third Presidential Debate""",smkyorC5qwc,z12eupohgrz2jtoqp04cdh0bwrmjdx54wz40k,2016-11-07T06:14:28.000Z,2016-11-07T06:14:28.000Z,http://www.youtube.com/channel/UC8zwIbUYA1Prib8IW3sGqCA,lorderik237,100,2,"Trump and Clinton are merely two different symptoms of the same fatal 
disease﻿", - 
"""Third Presidential Debate""",smkyorC5qwc,z12eupohgrz2jtoqp04cdh0bwrmjdx54wz40k.1478738246258442,2016-11-10T00:37:26.000Z,2016-11-10T00:37:26.000Z,http://www.youtube.com/channel/UCnIz6iGR0gfzV9i13QqHTAg,white gaming,0, - , - ,"This movie is now available toooo wаtch heeeere => 
https://twitter.com/4af24c5fd4e98c86d/status/795842350681460736 The Third 
PPPresidential Deеeebatee Hillary Clinton And Donald Trumр Full Debateeee 
NBC News"
"""Third Presidential Debate""",smkyorC5qwc,z12eupohgrz2jtoqp04cdh0bwrmjdx54wz40k.1478654603787054,2016-11-09T01:23:23.000Z,2016-11-09T01:23:23.000Z,http://www.youtube.com/channel/UCPdOxRnkwR4Ki2Oy4PZcjfA,lewis Garland,2, - , - ,Well said
"""Third Presidential Debate""",smkyorC5qwc,z12eupohgrz2jtoqp04cdh0bwrmjdx54wz40k.1478612133984581,2016-11-08T13:35:33.000Z,2016-11-08T13:35:33.000Z,http://www.youtube.com/channel/UCLX2W4GsbEJfhIZQSzBO7XQ,MrBigEnchilada,3, - , - ,"lorderik237 how? they actually have totally different ideas. they just 
don't say it and their supporters are too dumb to understand it"
"""Third Presidential Debate""",smkyorC5qwc,z12eupohgrz2jtoqp04cdh0bwrmjdx54wz40k.1478567716534517,2016-11-08T01:15:16.000Z,2016-11-08T01:15:16.000Z,http://www.youtube.com/channel/UCW5ToLlgEyFD9_P0rEc8lTw,Ricardo Calvillo,0, - , - ,well said
"""Third Presidential Debate""",smkyorC5qwc,z13ivlfa1teodhvnc22ve5ly3vioivc21,2016-10-26T22:38:33.000Z,2016-10-26T22:38:33.000Z,http://www.youtube.com/channel/UCQ5dUG2cWnhJ0jKHnZjPrEw,Shawn Bailey,124,3,Both Trump and Clinton are unworthy. KICK THEM BOTH OUT!﻿, - 
"""Third Presidential Debate""",smkyorC5qwc,z13ivlfa1teodhvnc22ve5ly3vioivc21.1479485257556081,2016-11-18T16:07:37.000Z,2016-11-18T16:07:37.000Z,http://www.youtube.com/channel/UCZ-KoPdKs3p3R83McX5l41Q,Batta Beru,0, - , - ,+judith smeets Whites only
"""Third Presidential Debate""",smkyorC5qwc,z13ivlfa1teodhvnc22ve5ly3vioivc21.1479470268815368,2016-11-18T11:57:48.000Z,2016-11-18T11:57:48.000Z,http://www.youtube.com/channel/UCkCF334wgLq1D38oiOcHmpQ,judith smeets,0, - , - ,"yeah, go to satanic dinners together"
"""Third Presidential Debate""",smkyorC5qwc,z134sbp5iqymc5lcn23kjbp5zsi2cxs2f,2016-10-26T20:07:09.000Z,2016-10-26T20:07:09.000Z,http://www.youtube.com/channel/UCmgD7YumOtQNPb_IIp7-9XA,Matt S,45,4,"Trump Supporters: I implore you when you vote, triple check your selection. 
If the machine's a ""Smartmatic"", then it's a potentially rigged machine 
owned by George Soros. Demand a Paper Ballot.

http://thetruthdivision.com/2016/10/alert-see-smartmatic-voting-booth-polls-heres-must/
﻿", - 
"""Third Presidential Debate""",smkyorC5qwc,z134sbp5iqymc5lcn23kjbp5zsi2cxs2f.1477752523358660,2016-10-29T14:48:43.000Z,2016-10-29T14:48:43.000Z,http://www.youtube.com/channel/UCKHf-mlwk_H_aIOrRuHr7gg,MultiTarded,1, - , - ,I heard about that.
"""Third Presidential Debate""",smkyorC5qwc,z123t3zpzmegsz54h04cjhoofou3ittgy4w,2016-10-30T18:49:39.000Z,2016-10-30T18:49:39.000Z,http://www.youtube.com/channel/UCiKLigYv5i7gI2jCzBEYUFw,Michael Lucius,49,5,"God it's funny to hear Hillary talk about the Supreme Court since she 
withheld tons of information from them and was completely uncooperative.﻿", - 
"""Third Presidential Debate""",smkyorC5qwc,z123t3zpzmegsz54h04cjhoofou3ittgy4w.1477863840297833,2016-10-30T21:44:00.000Z,2016-10-30T21:44:00.000Z,http://www.youtube.com/channel/UCcmv_s8ciitcgB4PXFNI0xQ,Childhood Obesity & Soda,2, - , - ,"Ikr. She has a history of doing that dating back to when she was the first 
lady."
"""Third Presidential Debate""",smkyorC5qwc,z13bsr1oqr3hybasj23lghyoqvz1e1jis04,2016-11-09T06:14:31.000Z,2016-11-09T06:14:31.000Z,http://www.youtube.com/channel/UCvZgjqZKzAacsyDB34ig9mA,AyDayDay,11,6,"Smoke some weed or take LSD and watch this. Imagine how we got here. We are 
humans watching our masters debate. It's like all a game. Taking our 
attention away from something else. Bigger.﻿", - 
"""Third Presidential Debate""",smkyorC5qwc,z13bsr1oqr3hybasj23lghyoqvz1e1jis04.1480218962975588,2016-11-27T03:56:02.000Z,2016-11-27T03:56:02.000Z,http://www.youtube.com/channel/UCvZgjqZKzAacsyDB34ig9mA,AyDayDay,0, - , - ,+kckarma007 Whatever you say
"""Third Presidential Debate""",smkyorC5qwc,z13bsr1oqr3hybasj23lghyoqvz1e1jis04.1480218229500692,2016-11-27T03:43:49.000Z,2016-11-27T03:43:49.000Z,http://www.youtube.com/channel/UCg9og5bQatXu6sipJSTEAcQ,kckarma007,0, - , - ,AyDayDay I don't do drugs. they turn you into a moron.
"""Third Presidential Debate""",smkyorC5qwc,z13bsr1oqr3hybasj23lghyoqvz1e1jis04.1479181020396033,2016-11-15T03:37:00.000Z,2016-11-15T03:37:00.000Z,http://www.youtube.com/channel/UCvZgjqZKzAacsyDB34ig9mA,AyDayDay,1, - , - ,"No but I took 3 hits of acid and it looked so scripted. Like they put on 
their makeup went in front of that strange blue background and had a 
arguement like a little game for our entertainment, simply puppets of a 
greater evil. I imagined being a civilian from the early civilization 
watching this, what would it look like to them lol"
"""Third Presidential Debate""",smkyorC5qwc,z13bsr1oqr3hybasj23lghyoqvz1e1jis04.1479176156457551,2016-11-15T02:15:56.000Z,2016-11-15T02:15:56.000Z,http://www.youtube.com/channel/UCeqELDnV85rhv9loS8nl1xw,Dominique Despres,0, - , - ,lol
"""Third Presidential Debate""",smkyorC5qwc,z13bsr1oqr3hybasj23lghyoqvz1e1jis04.1478730160767281,2016-11-09T22:22:40.000Z,2016-11-09T22:22:40.000Z,http://www.youtube.com/channel/UCuzmu_FOLCY3S1iQMKmQNDw,Elpeo Puru,1, - , - ,you smoked too much weed. this just makes me want to get up and MAGA.
"""Third Presidential Debate""",smkyorC5qwc,z12lgdsweqzzzzee522owb3whnv3y1kxi04,2016-10-28T21:16:13.000Z,2016-10-28T21:16:13.000Z,http://www.youtube.com/channel/UCxMLNZzWUvIDdPaggBtN0Yg,Eemil partanen,6,7,i vote Franklin Clinton﻿, - 
"""Third Presidential Debate""",smkyorC5qwc,z12lgdsweqzzzzee522owb3whnv3y1kxi04.1478830905870992,2016-11-11T02:21:45.000Z,2016-11-11T02:21:45.000Z,http://www.youtube.com/channel/UC-fNM3gmSp8ctocO8FKPrUQ,Goldhead,0, - , - ,Eemil partanen LOL. It's about time someone commented about his name!!
"""Third Presidential Debate""",smkyorC5qwc,z12lgdsweqzzzzee522owb3whnv3y1kxi04.1477823940727625,2016-10-30T10:39:00.000Z,2016-10-30T10:39:00.000Z,http://www.youtube.com/channel/UCIwShxLKYIZ8Zpyhovlu17Q,Carrefour Colentina,0, - , - ,Eemil partanen
"""Third Presidential Debate""",smkyorC5qwc,z12her5zzoiitd2ok04cht4iqwnpsxayvpc0k,2016-10-29T02:32:47.000Z,2016-10-29T02:32:47.000Z,http://www.youtube.com/channel/UCNnyi0XcTpvb-8p-BmI7XKQ,Vic Demise,59,8,Jesus tits- Trump has a terrible facelift.﻿, - 
"""Third Presidential Debate""",smkyorC5qwc,z12her5zzoiitd2ok04cht4iqwnpsxayvpc0k.1478492487601811,2016-11-07T04:21:27.000Z,2016-11-07T04:21:27.000Z,http://www.youtube.com/channel/UChqTeA1QJ7QRxKYc8Mck-tg,paul bonethruster,0, - , - ,"Diane Campbell my comment was a sarcastic response to the mocking of trumps 
""plastic surgery"" i doubt he's had any...any ways I know all about the 
scandals behind hillary and her getting questions ahead of time. Hillary 
for prison"
"""Third Presidential Debate""",smkyorC5qwc,z12her5zzoiitd2ok04cht4iqwnpsxayvpc0k.1478491305122946,2016-11-07T04:01:45.000Z,2016-11-07T04:01:45.000Z,http://www.youtube.com/channel/UCK7EUcwZqq6Bor2TDr9tkwQ,Diane Campbell (Pittie Chick),2, - , - ,"+paul bonethruster she's on point because she was given the questions and 
studied the answers you moron"
"""Third Presidential Debate""",smkyorC5qwc,z12her5zzoiitd2ok04cht4iqwnpsxayvpc0k.1478255852823670,2016-11-04T10:37:32.000Z,2016-11-04T10:37:32.000Z,http://www.youtube.com/channel/UC5WIBmM9tAMl5ws-JalhBDg,MAYAEULENSE M.E,4, - , - ,He looks like Jeff Dunham's puppet WALTER!
"""Third Presidential Debate""",smkyorC5qwc,z12her5zzoiitd2ok04cht4iqwnpsxayvpc0k.1478200530179302,2016-11-03T19:15:30.000Z,2016-11-03T19:15:30.000Z,http://www.youtube.com/channel/UCs6m22JUwBTr6HApx-Sishw,Kronos92,0, - , - ,"Vic Demise Jesus tits? You are a liable source for information aren't you. 
Go back to masturbating and playing computer games"
"""Third Presidential Debate""",smkyorC5qwc,z12ojrdaboj3z32hw04cjv4agovtsl4yrqs0k,2016-11-08T23:25:11.000Z,2016-11-08T23:25:11.000Z,http://www.youtube.com/channel/UC-phPOWhZt-r_IA_eSZYmSQ,THE BEST GAMER,67,9,Lol who is watching this on election day november 8﻿, - 
"""Third Presidential Debate""",smkyorC5qwc,z12ojrdaboj3z32hw04cjv4agovtsl4yrqs0k.1478729486837573,2016-11-09T22:11:26.000Z,2016-11-09T22:11:26.000Z,http://www.youtube.com/channel/UC04escvfGYXU4s5AU54jVfQ,Cameron Mosley,1, - , - ,Me but on November 9.
"""Third Presidential Debate""",smkyorC5qwc,z12ojrdaboj3z32hw04cjv4agovtsl4yrqs0k.1478685769701648,2016-11-09T10:02:49.000Z,2016-11-09T10:02:49.000Z,http://www.youtube.com/channel/UCzymUXff74xO5eMsup45hXw,cim rive de gier,0, - , - ,"meee hahaha...ha!!!! i'm not even an american but i don't know why i'm 
interested with the results of these elections. Many people worldwide are 
waiting for the results as well."
"""Third Presidential Debate""",smkyorC5qwc,z12ojrdaboj3z32hw04cjv4agovtsl4yrqs0k.1478673170352565,2016-11-09T06:32:50.000Z,2016-11-09T06:32:50.000Z,http://www.youtube.com/channel/UCZ-KoPdKs3p3R83McX5l41Q,Batta Beru,0, - , - ,I was watching but I plucked my eyeballs out two hours ago
"""Third Presidential Debate""",smkyorC5qwc,z12ojrdaboj3z32hw04cjv4agovtsl4yrqs0k.1478662122791155,2016-11-09T03:28:42.000Z,2016-11-09T03:28:42.000Z,http://www.youtube.com/channel/UC-phPOWhZt-r_IA_eSZYmSQ,THE BEST GAMER,0, - , - ,"It would be awesome if guyz can sub to my channel while your commenting or 
liking thank you it would be very appriciated"
"""Third Presidential Debate""",smkyorC5qwc,z12ojrdaboj3z32hw04cjv4agovtsl4yrqs0k.1478662008763916,2016-11-09T03:26:48.000Z,2016-11-09T03:26:48.000Z,http://www.youtube.com/channel/UCnh7BhqsFsazBr1qGMgg1Zg,Cats_101 Woods,0, - , - ,me
"""Third Presidential Debate""",smkyorC5qwc,z120eptg0nfmfbgio04cfbxi1ompc1mbeq40k,2016-11-01T16:47:55.000Z,2016-11-01T16:47:55.000Z,http://www.youtube.com/channel/UCV64x0siPESjJca47ohLnRQ,lunabird89,25,10,Independent NYC voter for trump . police officer for trump !﻿, - 
"""Third Presidential Debate""",smkyorC5qwc,z120eptg0nfmfbgio04cfbxi1ompc1mbeq40k.1480382522607545,2016-11-29T01:22:02.000Z,2016-11-29T01:22:02.000Z,http://www.youtube.com/channel/UCV64x0siPESjJca47ohLnRQ,lunabird89,0, - , - ,"yep i was that one dumb voter. and you would say the crook won the popular 
vote right about now :)"
"""Third Presidential Debate""",smkyorC5qwc,z120eptg0nfmfbgio04cfbxi1ompc1mbeq40k.1478242014498715,2016-11-04T06:46:54.000Z,2016-11-04T06:46:54.000Z,http://www.youtube.com/channel/UCwi6waazhV4YaOlPbedDqsA,J Ro In AK,1, - , - ,So YOU'RE that one dumb NY'er voting for him? FFS! #HRC has this.
"""Third Presidential Debate""",smkyorC5qwc,z120eptg0nfmfbgio04cfbxi1ompc1mbeq40k.1478108876217548,2016-11-02T17:47:56.000Z,2016-11-02T17:47:56.000Z,http://www.youtube.com/channel/UCED6oux3IXTMArzmFq-n-lg,Resul Mujic,1, - , - ,"Before you buy Better in bed, be sure to checkout the review on my blog 
first at *peacereviews(dot)com/better-in-bed-review* Thanks, Werner."
"""Third Presidential Debate""",smkyorC5qwc,z13dhruhcpr3cpvpk04ccrbouvjadzigp3k,2016-11-09T17:43:20.000Z,2016-11-09T17:43:20.000Z,http://www.youtube.com/channel/UCYtzTz3g1H_P-Pd9IgPXmgQ,Altered State of Mind,27,11,This bitch thought she had it lmao﻿, - 
"""Third Presidential Debate""",smkyorC5qwc,z13dhruhcpr3cpvpk04ccrbouvjadzigp3k.1478720583562492,2016-11-09T19:43:03.000Z,2016-11-09T19:43:03.000Z,http://www.youtube.com/channel/UCdO0x-yvXseYxsU-MDtQyfA,Scott Carmichael,1, - , - ,"She NEVER had it. She took the Jeb Bush approach of getting everyone on her 
side and pouring $100 million in immediately. She probably would have fared 
better at the general if she simply had stepped down the day before."
"""Third Presidential Debate""",smkyorC5qwc,z13uwllq3ruuh5mf323fzrvrvzawfjpvy,2016-11-02T00:14:45.000Z,2016-11-02T00:14:45.000Z,http://www.youtube.com/channel/UCAnT1RKTmpXopt0maOJApEQ,Nikita Rodov,35,12,"Obama ruined this country and Hillary will make it worse. trump may not be 
the best, but he IS better than Hillary﻿", - 
"""Third Presidential Debate""",smkyorC5qwc,z13uwllq3ruuh5mf323fzrvrvzawfjpvy.1478619608134254,2016-11-08T15:40:08.000Z,2016-11-08T15:40:08.000Z,http://www.youtube.com/channel/UCqPGRRGgz5Ng6q2EW_P717Q,ilaur 13,2, - , - ,Nikita Rodov Bush made it worst
"""Third Presidential Debate""",smkyorC5qwc,z13uwllq3ruuh5mf323fzrvrvzawfjpvy.1478527119205367,2016-11-07T13:58:39.000Z,2016-11-07T13:58:39.000Z,http://www.youtube.com/channel/UCVtyoh0v_N58-3puqCRan4g,NunyVanstta135,1, - , - ,"Sherelle Fuller Obama did not clean up Bush's mess, he made things much 
worse. Just look at the debt, it's doubled in the last 8 years. Just look 
at all the division, e.g Black Lives Matter. Look at Obamacare. Look at 
Libya and the Middle East. And most of all, just look at how politically 
correct Obama has tried to make the country, with all this liberalism. 
These things are Obama's fault. (#facts#)"
"""Third Presidential Debate""",smkyorC5qwc,z13uwllq3ruuh5mf323fzrvrvzawfjpvy.1478526133642441,2016-11-07T13:42:13.000Z,2016-11-07T13:42:13.000Z,http://www.youtube.com/channel/UCpyJ44R8w0bC3MiKoW2zgHQ,Sherelle Fuller,4, - , - ,"Bush ruined the country, Obama cleaned it up..he did alot while in office! 
#facts#"
"""Third Presidential Debate""",smkyorC5qwc,z130irxifzqjslp5a04cdtziyzz1hnmrld0,2016-10-30T12:13:53.000Z,2016-10-30T14:20:25.000Z,http://www.youtube.com/channel/UC-FukmxyCWx6t0L8VK_nHAg,tanzenistsport,7,13,"How many of the American people are aware, that there are other candidates 
(e.g. Johnson & Stein) that you can vote for?﻿", - 
"""Third Presidential Debate""",smkyorC5qwc,z130irxifzqjslp5a04cdtziyzz1hnmrld0.1479408709141247,2016-11-17T18:51:49.000Z,2016-11-17T18:51:49.000Z,http://www.youtube.com/channel/UCZ-KoPdKs3p3R83McX5l41Q,Batta Beru,1, - , - ,"+tanzenistsport some time you got to fall down before you can walk. As much 
as I love my Mercedes my mother would never ride in one. French forever was 
her motto, now Angela shows the world how to be humane and kind, course 
it's look out here comes the fear and hatred in the form of the right wing, 
but good for her and the idea of altruism at least"
"""Third Presidential Debate""",smkyorC5qwc,z130irxifzqjslp5a04cdtziyzz1hnmrld0.1479406271170750,2016-11-17T18:11:11.000Z,2016-11-17T18:11:43.000Z,http://www.youtube.com/channel/UC-FukmxyCWx6t0L8VK_nHAg,tanzenistsport,0, - , - ,"I don't think that this can be generalized. E.g. here in Germany we have 
great small parties, which are simply unknown. And some have ideas, that 
are ahead of their time. For some ideas, the public mainstream is simply 
not ready yet."
"""Third Presidential Debate""",smkyorC5qwc,z130irxifzqjslp5a04cdtziyzz1hnmrld0.1479376955868444,2016-11-17T10:02:35.000Z,2016-11-17T10:02:35.000Z,http://www.youtube.com/channel/UC0znbBeOGbJFtPDuuS_abOw,sharkfinbite,0, - , - ,"You don't necessarily want to vote for the other independent party 
candidates with out checking them out and knowing what their party's 
beliefs are first.. Usually these people don't get a lot of press or public 
awareness not just because they a smaller party but for having bad ideas. 
For example I remember hearing there was a political party out there that 
had abolishing the constitution. Basically independent parties are awful 
generic brands of the other bigger main 2 parties. Chances are they would 
ruin things as much as the others."
"""Third Presidential Debate""",smkyorC5qwc,z130irxifzqjslp5a04cdtziyzz1hnmrld0.1478573391467292,2016-11-08T02:49:51.000Z,2016-11-08T02:49:51.000Z,http://www.youtube.com/channel/UCezDAYkpirhloybgKJnDO2w,M Mary,1, - , - ,"The thing is if people didn't believe that at the beginning of the election 
then they wouldn't be wasted votes. If people thought, hey let's vote for 
Johnson let's all vote for Johnson then Johnson would've had enough votes 
to debate, maybe even win. Of course, Electoral College isn't going to pick 
a small party winner but it sends them a message especially if people trade 
votes."
"""Third Presidential Debate""",smkyorC5qwc,z13dvn54qkr0cx2v023lyxubpmy3f35cu,2016-11-07T10:33:00.000Z,2016-11-07T10:33:00.000Z,http://www.youtube.com/channel/UCwK917cn5HqV1N7DbekqWvA,Layla Malinday,48,14,"I'm sorry...but I think I'd feel just a tad more comfortable with the 
country in Hillary's hands than in his. His characteristics an demeanor and 
some of the things he says are so immature & outlandish I really can't 
believe he's gotten this far. I don't want someone like this representing & 
dictating us at all. His personality is just too unattractive for my 
comfort & trust levels. I loved Bill as our president, and I think she'd 
rekindle a lot of the ways he ran the country. This guy here, no ma'am...I 
just don't like this rude pushy fellow and I don't want him to be the our 
president, I just can't stand this guy. HILLARY 100%!﻿", - 
"""Third Presidential Debate""",smkyorC5qwc,z13dvn54qkr0cx2v023lyxubpmy3f35cu.1479374970276943,2016-11-17T09:29:30.000Z,2016-11-17T09:29:42.000Z,http://www.youtube.com/channel/UCcmv_s8ciitcgB4PXFNI0xQ,Childhood Obesity & Soda,0, - , - ,"She doesn't run Britain, the prime minister does."
"""Third Presidential Debate""",smkyorC5qwc,z13dvn54qkr0cx2v023lyxubpmy3f35cu.1478717287506383,2016-11-09T18:48:07.000Z,2016-11-09T18:48:07.000Z,http://www.youtube.com/channel/UCZ-KoPdKs3p3R83McX5l41Q,Batta Beru,0, - , - ,"+Kaleb Schulner good news? You won, bad news? You won. What are you going 
to do now, you been losing and whining about everything for so long, all 
you got left is watching your team create apocalypse 2017. Voters have been 
wrong before, check out the reign of he who shall not be named, oh and 
Nixon don't forget him, two worst presidents ever. Be careful what you wish 
for.... And now you got it."
"""Third Presidential Debate""",smkyorC5qwc,z12gv13oinfgzhr3s23uhlnaprnegzktg,2016-11-07T18:56:14.000Z,2016-11-14T03:43:01.000Z,http://www.youtube.com/channel/UCZheQsfLmhHqYJpOg794icg,Go Trump,7,15,"I will never understand how people can say some of the things being said 
throughout this election. No matter who you choose to vote for, it is not 
right to say any of the candidates should commit suicide or be murdered. It 
is also very silly to assume that World War III is going to breakout due to 
the results of this election, or that this country is headed towards the 
apocalypse. With that being said though, Donald Trump is the best candidate 
we could vote for, because otherwise, our country will be worse off. His 
only real competition is Hillary Clinton, who has proven herself to be a 
crooked and corrupt politician; any third-party candidate currently running 
for president stands no chance of actually winning. 


Donald Trump is nowhere near as bad as people think he is. Despite popular 
belief, he is not going to lead our country into an era of racism, sexism, 
xenophobia, or hate. Sure, he has said some pretty offensive things, but 
that just shows that he is an actual person who does not try to be 
politically correct in order to just win the vote. We have all said things 
that we regret or did not mean, and that makes us human. Politicians like 
Hillary Clinton have said things almost as bad as what Trump has said, but 
only in private. For example, as much as people like to point to out that 
Donald Trump has accused President Barack Obama of being born in Kenya, it 
was a Clinton employee who first suggested it. According to Joshua 
Muravchik in “Hillary Clinton’s Bad Old Days”, “Clinton-family retainer 
Sidney Blumenthal had furnished the material on Obama’s past” (34). Clinton 
is unreliable and has crooked ways, as she now claims to support Obama.


Hillary Clinton’s corruption as a politician is also demonstrated by the 
way that she can be “bought”. Many people believe that she is nothing more 
than a puppet for large corporations and rich people that donate to her 
foundation. As Sam Frizell points out in “The Benefits of Friendship with 
Hillary Clinton”, “half the private individuals whom Clinton met with… 
donated to the foundation. That’s 85 out of 154 people” (5). This 
contradicts a Clinton quote that Frizell also brings to attention, 
“‘Democracy can't just be for billionaires’” (6). Donald Trump is a 
billionaire who worked throughout his life to get to this point, and will 
not be easily bought, as he is not hungry for the money. The same can not 
be said for Hillary. 


I understand why so many people are reluctant to give Donald Trump a 
chance. He’s a loudmouth who lacks political experience, but compared to 
Hillary, he is safe. He has proven that he understands the economy with the 
fact that he has done so well, and he has policies that could help our 
country. Many people may be put off by what Trump has said about some 
things, such as illegal immigrants, and his idea of “building a wall” to 
keep them from coming into the United States. Those people just 
misunderstand though, as Trump claims in his book Crippled America: How to 
Make America Great Again, “I don’t want to stop legal immigration to this 
country. In fact, I would like to reform and increase immigration in some 
important ways” (29). I believe that many of his other policies may be 
misunderstood as well, but in time, if he becomes president, we will see 
that he has what is best for our country in mind. In regard to those voting 
for a third-party candidate, you are just wasting your vote. Your 
frustration with both major candidates is understandable, but please think 
about which of them will be better for our country, as you could be making 
a huge mistake by not voting for them. Donald Trump is not the only the 
most fit candidate for presidency, but perhaps the only fit candidate.﻿", - 
"""Third Presidential Debate""",smkyorC5qwc,z12gv13oinfgzhr3s23uhlnaprnegzktg.1479097174135340,2016-11-14T04:19:34.000Z,2016-11-14T04:19:34.000Z,http://www.youtube.com/channel/UCZheQsfLmhHqYJpOg794icg,Go Trump,3, - , - ,You got it! Trump will make America great again!
"""Third Presidential Debate""",smkyorC5qwc,z12gv13oinfgzhr3s23uhlnaprnegzktg.1479097085600325,2016-11-14T04:18:05.000Z,2016-11-14T04:18:05.000Z,http://www.youtube.com/channel/UCZheQsfLmhHqYJpOg794icg,Go Trump,0, - , - ,"If you're here legally then you shouldn't have anything to worry about. 
Maybe I am wrong, but we'll see I guess."
"""Third Presidential Debate""",smkyorC5qwc,z12gv13oinfgzhr3s23uhlnaprnegzktg.1479097059480155,2016-11-14T04:17:39.000Z,2016-11-14T04:17:39.000Z,http://www.youtube.com/channel/UCMpE3q1AYxKuYxnxq5isk3g,Jake Carpenter,0, - , - ,preech it brothr!
"""Third Presidential Debate""",smkyorC5qwc,z12gv13oinfgzhr3s23uhlnaprnegzktg.1479096999400711,2016-11-14T04:16:39.000Z,2016-11-14T04:16:39.000Z,http://www.youtube.com/channel/UCHYCO7l98-iZ5m3oCS1tZ-A,Travis Whatwhen,0, - , - ,"right, I'll remember that when he tries to send my ass back over the border 
when I'm here legally. I think you're just blinded by the facts and too 
stupid to admit when you're wrong."
"""Third Presidential Debate""",smkyorC5qwc,z12ntpnhss32tfzzh04ci30pelbfdbqg5p40k,2016-10-28T21:40:01.000Z,2016-10-28T21:40:01.000Z,http://www.youtube.com/channel/UCmFSH3eoMKHFzd9YqtrWweg,XxTrulyxX Juanx,8,16,"Can we all agree that we need someone who is a master businessman/woman to 
get the debt reduced massively..?﻿", - 
"""Third Presidential Debate""",smkyorC5qwc,z12ntpnhss32tfzzh04ci30pelbfdbqg5p40k.1478718859891897,2016-11-09T19:14:19.000Z,2016-11-09T19:14:19.000Z,http://www.youtube.com/channel/UCWQecO3Uc-i-TMj8o7g47-Q,Elemental_Phoenix,1, - , - ,well you got trump.
