,0,num_char,num_word,num_sent,TTR,FRE
0,"I'm sick and tired of those who say Hillary has no great accomplishments. I 
would say staying out of prison for the crimes she committed in the last 
four decades is a great accomplishment.",190,37,2,0.837837837838,76.0196621622
1,"This is almost terrifying to watch! how can any of these two rule a 
country! #Nobodyforpresident",97,19,3,0.947368421053,106.901403509
2,Who's watching this after the election.,39,8,1,1.0,82.39
3,"Yelling over your opponent is not how you win a debate, Donnie.",63,14,1,1.0,83.8535714286
4,"LOOOL Trump. Your temperament is terrible.You're a tyrant. Take several 
seats. and OML if Hilary smiles one more time, I swear I'm gonna jump off 
this roof.",158,35,4,0.885714285714,120.605178571
5,"You know what's weird? Trump says Mexicans should go back to Mexico,Muslims 
should go back to the west, But he doesn't like saying that americans are 
immigrants.",163,34,2,0.852941176471,90.0505882353
6,"I really don't care what happens because the president doesn't have all the 
power. The U.S.A's main governmental power is divided into three branches, 
as we all know: The Executive Branch, The Legislative Branch, and The 
Judicial Branch. If the president wants to sent out new laws, 2/3 of the 
Legislative Branch must agree on it, or else it would be overwrited.",366,74,3,0.716216216216,81.1929279279
7,THEY BOTH NEED TO STOP INTERRUPTING THAT POOR MAN !!!!!!!!!!,60,19,2,0.526315789474,143.760921053
8,why is trump always so triggered,32,6,1,1.0,87.945
9,"I don't live in the US, have never been there (I'd love to go though), but 
I still watch these. Your American politics are hilarious ;D",136,34,2,0.911764705882,100.003529412
10,Where's Hilary's shoulder shake? Lol,36,8,2,0.875,107.6
11,A small loan of a million dollars,33,7,1,1.0,90.9585714286
12,people ask me why i watch these and idk I find it so entertaining,65,14,1,1.0,89.8964285714
13,"W O W, AMERICA!!!!!!!...you are a country of 319 MILLION people and the 
best you can do for a potential president is one of these two!!!!?!?!?!!!!! 
Would you like to borrow a paddle?? LOL",189,60,4,0.55,122.52
14,"To me it feels like all the hosts are against Trump and thats not right, 
they should be neutral.",97,21,1,1.0,104.948571429
15,ANYBODY HERE NOW,16,3,1,1.0,34.59
16,How would you vote for this? It is just impossible😂,52,11,2,1.0,132.034318182
17,We are soooo going to miss President Obama! 😔😔😔,50,10,2,1.0,100.24
18,"If Hillary Clinton was a ship, she would be called the Titanic! And Donald 
Trump is the iceberg! And we all know what happened to the Titanic!",143,31,3,0.806451612903,95.3724731183
19,"even though I am a Muslim, even though I am not gonna vote, yet I would 
never vote for a fake person such as Clinton! her laughs, her smiles, her 
answers, even her her nodding are all fake.",191,46,2,0.630434782609,93.3726086957
20,Hilary is a criminal.,21,5,1,1.0,66.4
21,"THANK YOU LORD that I live in South Africa. I just have to choose between a 
bald ass penguin and a nincampoop!!!!",114,27,3,0.814814814815,119.366666667
22,"I feel like Trump and Hilary are two divorced parents fighting over custody 
of us, but we kinda just wana go live with grandma.",128,26,1,1.0,69.8142307692
23,"I love Donald Trump. I hate Hilary Cliton! Because she is such a liar and 
she didn't deserve to be president. Donald Trump won the election last 
week, and I'm happy because he and Mike Pence Vice President are going to 
make America great again!",247,52,4,0.807692307692,87.89
24,"Trump was right. Stop and Frisk did help a lot. According to wall street 
journal, Homicide, Rape and Robbery increased and has been since the new 
person came in",162,33,3,0.878787878788,98.2518181818
25,"This is literally two grown adults talking over each other like children. 
Seriously, no respect for each other nor for the guy trying to keep them on 
topic. This is a joke.",174,36,3,0.805555555556,84.205
26,"Trump always acting like a baby, in the next debates he must show up with a 
bottle.",84,19,1,0.947368421053,89.5921052632
27,"can they have the 4th debate? hehe. i am kinda addicted to the hilarious 
and dramatic debate. i am wondering what i a going to do after the 
presidential election. lol",168,35,5,0.742857142857,81.29
28,hate trump and I hate clinton but frankly trump is the one I would want,71,15,1,0.8,95.73
29,"Trump is just a charlatan, a big liar and a big fraud.",54,14,1,0.785714285714,101.982142857
30,Bye im moving to Dubai! ;),26,8,2,1.0,128.75
31,"They are both awful, Trump has business sense but it also racist and 
sexist. Hillary is corrupt but has experience in government, though she 
shouldn't become US President just because she is a woman. Bernie Sanders 
was the only good choice now America is screwed",265,50,3,0.86,71.4783333333
32,Trump just needs to shut up.,28,7,1,1.0,127.215714286
33,"if trump wins, im movin to japan",32,8,1,1.0,124.69
34,I hate Donald Trump he is sick,30,7,1,1.0,103.044285714
35,Trump is perfect for president,30,5,1,1.0,66.4
36,"Donald Trump needs to stop talking over Hillary. She is trying to make a 
point, and it isn't helping his debate in any way",123,27,2,0.925925925926,89.7325
37,trump as prseident = world war 3,32,7,1,1.0,151.387142857
38,Hillary is all talk and absolutely no action whatsoever.,56,10,1,1.0,44.405
39,"Bye guys , I'm moving to Canada :)",34,10,1,1.0,112.085
40,me and my family are libertarions (is that how i spell it?) and im pround,73,18,2,0.944444444444,127.2
41,"Choosing between Trump or Hillary, is like choosing between aids or cancer.",75,14,1,0.857142857143,77.8107142857
42,"all I can do is pray that this country will not go into world war 3 because 
of him.",84,20,1,1.0,97.705
43,"""Small loan"" my ass. A Million dollars is NOT a small loan.",59,16,2,0.875,124.69
44,Really out of 10 billion people u pick these two ????,53,14,2,0.785714285714,127.215714286
45,look behind Hillary. u see the word Rig,39,9,2,1.0,98.8675
46,I'm so hyped for Fallout Go,27,7,1,1.0,103.044285714
47,What's so bad about Trump?,26,7,1,1.0,115.13
48,"You know the best thing going for Hillary Clinton???

Read More",63,14,2,0.857142857143,109.087142857
49,"Trump states what needs done.. Hillary just says things about trump and 
brings up the past... let's hear some policies from you Hillary my god",143,27,1,0.962962962963,79.1633333333
50,"ok guys I'm gonna get a little emotional here. excuse my ""yelling"". GUYS 
YOU HEAR THE WORD ON THE STREET THAT TRUMP IS RACIST AND THAT HILLARY IS 
DOING BAD THINGS. OK BUT NOT ALL OF IT IS TRUE. YES IN PREVIOUS COMMENTS I 
TEASED THE CANDIDATES. YES THATS ALL FUN AND GAMES. BUT NOW WHEN IT GETS 
SERIOUS. WHEN YOU HAVE TO FREAKING GROW UP. SURE IM NOT OLD ENOUGH TO VOTE 
YET. BUT WHEN YOU DO TAKE MY WORDS. THE MEMES, THE LIES, THE JOKES. WHEN 
YOU VOTE. DONT YOU DARE THINK OF ONE OF THOSE. EVER. LOOK AT THEIR 
BACKGROUND. LOOK AT WHAT THEY DO FOR A LIVING. LOOK AT WHAT THEY ARE SAYING 
WHAT THEY WANT TO DO. OK SURE DONALD TRUMP INNTERUPTS HILLARY A WHOLE LOT. 
BUT THATS WHAT THEY DO IN DEBATES. THEY FIGHT AND ARGUE. JUST LIKE 
SIBLINGS. SO WHEN YOU VOTE. THINK OF THE REAL THINGS. THATS HOW YOU TRULY 
FIND THE BEST CANDIDATE FOR PRESIDENT. SURE IF THEY LIE ON WHAT THEY SAY 
YOU KNOW WHAT AMERICA NEEDS THEN. EVERYBODY IS HATING ON OBAMA. BUT YOU 
GUYS VOTED ON HIM FOR EIGHT YEARS. SO IF YOU HAVE A PROBLEM WITH WHAT IM 
SAYING RIGHT NOW TELL ME. I BELIEVE WHAT I BELIEVE I HAVE PASSED A TEST ON 
POLITICS. I LEARNED HOW TO EVALUATE A CANDIDATE. YOU CAN NOW PICK AND 
CHOOSE. AND LIKE I SAID IF YOU HAVE A PROBLEM WITH THIS TELL ME BECAUSE I 
NEVER SAID WHO I THINK IS BETTER. NOW AMERICA I LEAVE THIS IN YOUR HANDS. 
Thank you and have a nice day.😉",1362,307,34,0.491856677524,107.283176375
51,"Sure, trump is sexual predator, a racist, a charlatan, and a big idiot, 
but, who cares? He is just going to be president of united states, and 
nobody should worry?",165,39,2,0.717948717949,85.0886538462
52,"im so sick of listening to hillary bs. with her fake smile and her lies. 
makes me sick.",88,21,3,0.809523809524,115.13
53,"CHINA,CHINA,CHINA,CHINA...WHAT THE HELL DO WE OWE YOU DONALD TRUMP???",69,20,2,0.65,120.545
54,Let's see... rich guy or woman that lies I go with rich guy,59,15,1,0.866666666667,107.01
55,"I wanted to go out today, but this is even more entertaining. Good luck 
America! So happy I don't live there",109,25,3,0.96,93.4726666667
56,People please vote for HILLARY!!!!,34,9,2,0.666666666667,127.0675
57,"She is worthless, and a THEIF !! Thank God she lost, congrats to PRESIDENT 
ELECT TRUMP !",89,20,2,0.85,124.775
58,"Do you really want that person to be the next president, maybe he has good 
points, but is a terrible human being, he is the most horrific person after 
Hitler",159,33,1,0.818181818182,60.54
59,"I'm really scared. I don't like any of them but it's been my life long 
dream to live in America. I'm turkish and of course a muslim, if Donald 
Trump wins i won't be able to move to USA. I'm feeling so stressed and I've 
already planned my future in USA with my cousin/best friend, it all will 
crash down if he wins. I'm not saying Hillary is better or smarter but 
seriously he has a lot of dumb ideas, he wants to remove muslims from the 
country and build a wall. Many families will be separated! I understand 
that he mostly thinks about ISIS but that doesn't mean all of the muslims 
are dangerous. 95% muslims are really peaceful. I wouldn't even hurt a fly.",666,149,9,0.637583892617,89.5331245339
60,do not vote for Donltromp or Hilerycliton!‼‼!😧,47,11,1,0.909090909091,157.215454545
61,trump goes off topic alot if you havent notice,46,9,1,1.0,94.3
62,"This is why I'm for Johnson! Let him debate! Before you come at me with 
Aleppo, remember the missing e-mails on Hillary's side and Trump's 'locker 
room' talk. Before you say how he blanked and couldn't name a foreign 
leader, remember Trump's missing tax returns and Hillary defending a child 
who was raped. Every candidate has flaws. Obviously Johnson will not win, 
but that's not why I'm voting for him. I'm voting for him to send a 
message! I want actual candidates to vote for!

Hillary's ideas of a higher minimum wage and a debt free college are 
unrealistic. Higher minimum wage will only cause inflation and cause the 
value of the US dollar to go down. Minimum wage is just that! Minimum wage, 
it's for entry level positions such as fast food. You will see higher pay 
if you actually applied yourself. So sit your whining asses down! You're 
not looking or applying yourself hard enough! Quit trying to get everything 
handed to you! Debt free college is unrealistic. I don't want my tax money 
to go help a student go to college and flunk out of remedial classes 
because they messed up back in high school or where ever they were 
educated. That's unrealistic, which removes Jill Stein from the equation.

Trump's idea on abortion and gay marriage are too old fashioned for the 
America we have today. Maybe work on the adoption programs and foster care 
we have in place before worrying about being against abortion. He sounds 
like a complete idiot. He'll run America like a business and not like a 
country. 

That's my opinion (as a current college student working a part-time job 
which technically is on minimum wage but + tips).",1653,335,24,0.573134328358,81.8034110697
63,"I just need to ask the Trump supporters, is Trump a racist? I want to 
suport him over the witch but not if hes a racist.",121,29,2,0.793103448276,107.5175
64,"Hilary and Trump are both racists and hate gay people and immigrants so why 
make Hilary look better.",101,19,1,0.842105263158,67.3289473684
65,IM COUNTING DOWN THE HOURs UNTIL AMERICA PERISHES.,50,9,1,1.0,75.5
66,"Donald Trump sounds like he's literally just playing the blame game and his 
plans sound like they rely a lot on 'if we can do this' or on other people 
- when that doesn't work what's his plans then?
A third world country? This man is truly despicable, how about you go and 
live in a third world country then come back and tell me your sob story 
about airports in the US.
As soon as he starts talking about Nuclear and not taking it off the table 
that should have shut his campaign down instantly.",501,105,4,0.780952380952,80.2826785714
67,"As a Brit can someone explain to me how Hillary Clinton won the most votes 
in election but Donald Trump is President Elect?",124,24,1,1.0,62.625
68,"My god she is a smug pos. Anyone voting for this liar/murderer is as 
corrupt and evil as she is",96,21,2,0.809523809524,91.4346428571
69,That sexual predator trump is disgusting. No woman shold vote for him.,70,14,2,0.928571428571,90.9585714286
70,"This lying bitch got what she deserved. She can now go with her satanic 
friends and eat the blood, sperm and breast milk food they love to gorge 
on. Disgusting freaks.",169,35,3,0.914285714286,105.559047619
71,"Trump is misleading citizens and humanity, and he is a bad influence for 
anybody in a very tragic way. All he promotes is hate, racism, and bigotry. 
And he is lying to everybody.",180,39,3,0.692307692308,72.1630769231
72,"Only idiots, racist, and bigots support that sexual predator trump. Some 
people just love bullshit.",100,19,2,0.894736842105,76.9714473684
73,"I love how Trump in all of the debates, he always wore the American flag. 
True American. He will make America great again. :)",126,29,4,0.862068965517,97.3728017241
74,"Trump is the worst person for president any nation could even have. This 
has to be some kind of joke or a nightmare.",117,25,2,0.96,92.6275
75,"""The gun epidemic is the leading cause of death of young African American 
men""!? What an oversimplified view of a much deeper social problem. Typical 
leftist taking every opportunity to disarm the public.",206,39,3,0.897435897436,61.3169230769
76,"A sexual predator and the foreinger gold diger in the white house are like 
an abomination. What the hell is going on?",118,24,2,0.916666666667,92.43
77,"You know guys it is getting down to the wire.  In two days you have to vote 
for president.  Try to put your total feelings aside, I know that neither 
one are great, but what you have to do is look at the one who is most 
worthy..  Clinton who has stole from the country, is on the hit list of the 
FBI,  who is a liar... A women who wants to keep Health Care Reform going 
which is falling in the tanks but the even more disturbing problem is that 
she wants to make it a Single Payer System, Government controlled if you 
don't know what that means.   Meaning that the Government is going to say 
what you can and cannot do in regard to your Healthcare.  That is sad..  Is 
that what you want or the Man who yes may be a little troubled when it 
comes to talking about Women ( which I do not believe all of the omen that 
have SUDDENLEY come about their story) a man who yes took advantage of the 
loop holes in taxes but wants to do something about it,  Who does have good 
ideas on keeping the illegals out while keeping those who work legally in. 
It's on your shoulders now.  Try to make the best decision you can clearly 
thinking who has the best in mind for us.  Do not vote for a Women because 
she is a Women that is ridiculous and if you do you should feel ashamed.",1278,270,8,0.537037037037,74.1920833333
78,"TRUMP IS S LOW CLASS, CON ARTIST, BIG LIAR AND THIEF!!! HE'S A SELFISH EVIL 
DEMON!! I CAN NOT BELIEVE YOU STUPID, IGNORANT, LOW SELF ESTEEM WHITE MEN 
VOTED FOR TRUMP!! NOW WE GOT THIS UNEDUCATED CLOWN FACE FOOL, TRYING TO RUN 
A COUNTRY..CAN'T EVEN PAY HIS WORKERS!! ALL TRUMP DOES IS POINT HIS FINGER 
AND BLAME OTHER PEOPLE FOR THIS COUNTRY'S PROBLEMS..LIKE HILARY AND 
DEMOCRATS..AND EVEN HAVE ENOUGH NERVE TO TALK AGAINST PRESIDENT OBAMA.. WHO 
HAS DONE A TREMENDOUS JOB ON THIS COUNTRY'S PROBLEMS... FOR MORE BETTER 
THAN THE REPUBLICAN PARTY COULD HAVE...AND TRUMP NEVER SAYS WHAT HE'S GOING 
TO DO OR FIGURE OUT A SOLUTION TO HELP THIS COUNTRY...ALL HE DOES IS RUN 
HIS BIG MOUTH ALL DAY!!!! HE KNOWS HE'S WRONG AND RACIST.. AND DON'T 
CARE...HILARY IS WAY FAR MORE EDUCATED AND FIT TO BE A PRESIDENT!! THAN 
THAT RED NECK...WHAT A DIRTY SHAME..CRAZY SICK WHITE MEN.. THEY WILL SUFFER 
THE MOST FOR VOTING FOR THIS PSYCHOTIC DEMON!!",941,199,9,0.582914572864,90.8645840313
79,Omg stop interrupting Hillary Clinton Donald trump!!!!!,55,12,2,0.666666666667,109.095
80,"1:03:58 ""terrible disrespect"" 2 negatives is a positive...",58,11,1,1.0,87.9972727273
81,"God, I felt bad for Lester Holt",31,8,1,1.0,114.115
82,"Trump is a disgrace for united states and a national embarrasment. The 
entire world is laughing now. And who wouldn?",117,23,3,0.869565217391,103.418550725
83,"Trump hired a ton of immagrants and refused to pay them. He is such a 
hippocrit",80,17,2,0.941176470588,118.583970588
84,36:20 😇,8,2,1,1.0,204.805
85,Nobody should vote for that racist and sexual predator trump.,61,11,1,1.0,64.9245454545
86,"I see why Trump beat the crap out of her in these debates. Trump is the man 
for the job of U.S Presidency, I'm so glad I voted for and will support 
him.",154,37,2,0.783783783784,96.5980405405
87,Hillary will make a good president,34,6,1,1.0,59.745
88,"That sexual predator Trump is a promoter of hate, racism, and bullshit. He 
is a danger for democracy, for justice, and for equality.",133,29,2,0.689655172414,75.4278448276
89,trump need to get kicked😠😠😠😠😠😠,36,5,1,1.0,134.08
90,"If both Hilary and Trump fall into a river, which one do you wanna save 
firstly ???",84,21,2,0.904761904762,107.548928571
91,"That charlatan trump is always making up false storys and lieng about 
everything. He is just a hateful man, a deceiver, and a big fraud. He is a 
racist and a sexual predator.",176,38,3,0.684210526316,98.246754386
92,"How to know when Clinton is lying? She opens her mouth. Also, she had a 
'tell', as a professional card player would say. Every time she sort of 
'scratched' her face it was to say to Lester Holt, 'throw it to me', and he 
did. Such corruption.",244,59,5,0.728813559322,113.12579661
93,"HEY TRUMP SUPPORTERS! Yes, you! I want you to give me some reasons to vote 
for Trump. Valid reasons, not just ""Hillary deleted some emails! She is so 
evil!"". I'm a complete democrat, but let's see you try. Don't worry, I 
won't change my views, I just like a good argument that involves Trump. 
Come on, let's hear why Hillary isn't as good as Trump!",352,88,8,0.636363636364,111.07
94,I vote for Hilary Clinton 🇺🇸,30,6,1,1.0,87.945
95,"Americans if President Clinton, it will be a war in the world, she was sick 
in the head, in Ukraine now there is a war, thanks to America its power in 
Ukraine war gave Obama, Russia is not the aggressor, it is not not attack 
anyone, it's all Obama does that the circle is a war, make the right 
choice, only Trump will be peace in the world",343,78,1,0.564102564103,26.7957692308
96,Trump looks really sad,22,4,1,1.0,97.025
97,"Dont panic! Everything will be just fine. I mean, its not like we are 
puting a sexual predator, a racist, an idiot or charlatan as president. 
Now, that would be a big mistake!",177,41,4,0.80487804878,101.514176829
98,"Of course women don't deserve equal pay unless they do as good a job as 
men. Equal pay for equal work.",103,24,2,0.791666666667,99.48
99,lol from Dubai,14,3,1,1.0,119.19
100,"Q: Mrs. Hillary what is 2+2?
Hillary: four.
Trump: WRONG!!!",59,18,4,0.722222222222,136.4675
101,"I really wish they'd turn the other canidates microphone off while it's 
ones turn to speak.",92,19,1,0.947368421053,98.4973684211
102,A racist or a robot... that's a tough choice!,45,12,1,0.916666666667,110.055
103,I love how Donald Trump is wearing blue and Hillary Clinton is wearing red,74,14,1,0.857142857143,71.7678571429
104,Trump looks like he's contemplating a murder.,45,9,1,1.0,84.9
105,Idiocracy was a documentary.,28,5,1,1.0,83.32
106,"I waited 18 years to vote and when I do, these are my choices? 😑",65,17,2,0.941176470588,123.560441176
107,"Hillary Clinton sexually abused female minors supplied to her by the 
pentagon through their monarch MKultra mind control programme. google      
' Hilary Clinton MKultra'        Hillary PEDOPHILE",196,28,2,0.857142857143,59.6821428571
108,"Damn, you americans surely are very interesting.",48,9,1,1.0,56.7
109,"Honestly I hope US will just improve as a nation in the future. Just saying 
as a bystander and a foreigner.",108,23,2,0.826086956522,77.4581521739
110,"Why am I watching this? Oh, I remember I am forced to for school. Oh, 
Joy!!!!",78,24,4,0.666666666667,126.72
111,"the year is 2016 and the presidential debate has turned into a fight 
between 2 five-year olds",94,17,1,0.941176470588,90.0505882353
112,this dude is clearly racist lol man i feel bad,46,10,1,1.0,103.625
113,"There really just should be a button to silence their microfones. This is 
just uuuugh, let each other speak for god's sake!!!!!!!!! How is this even 
called a proper debate???!!",178,47,4,0.68085106383,130.10875
114,"i dont care who wins because i live in Britain, im British :)",61,15,1,0.933333333333,112.65
115,Donald Trump makes more sense for me..,38,7,1,1.0,115.13
116,why does he talk over her all the time it's really annoying me😂😂,66,14,1,1.0,89.8964285714
117,"statistics say that 27% of the time she lies. that is 1/4 times
trump lies 70% of the time. that is 7/10 times he lies. that is a lot at 
east that is what the statistics say on NBC",181,44,4,0.568181818182,122.606363636
118,"It's really sad to see that 90% of america's population don't know anything 
about their policy or policy in general, please let the foreigners vote, we 
know better about your country more than you do lmao.",207,43,1,0.860465116279,51.0458139535
119,I wonder if even democrates believe what she's saying,53,10,1,1.0,86.705
120,Shut up y vote for hillary Clinton,34,7,1,1.0,78.8728571429
121,"remove the sentence "" I'm very proud of it. "" and Trump's speeches will be 
halved",82,18,2,0.944444444444,108.4
122,"Lay off the coke, Trump!!! *Snort! Snort!* X0D",46,15,4,0.733333333333,169.18875
123,"I hate Hillary Clinton so much. I hated her smile. I would SO love to turn 
that smile upside down.",99,23,3,0.782608695652,107.096811594
124,"What has this world came to on Donald Trump can't stop being in the news . 
He confess about him sexual assault women and there now accusers coming 
out. When Bill Cosby has accusers there was a investigation. Hillary 
Clinton had FBI investigation about her email. Donald Trump refused to 
allow his Taxes release or investigation By The I.R.S that's some B.S. 
Howard Stern had Donald trump on the he show he say in confession that he 
goes in the women dress room uninvited cause he own it. WTF is wrong with 
Donald trump supporters there been my individual analysis Trump and Hillary 
Clinton taxes reforms. These independent analysis say donald trump would 
put 4 trillions on the nation debt and hillary clinton would be a slow 1 
percent growth in economy.",764,141,8,0.687943262411,67.145625
125,"trump has the alter ego of an annoying, bratty, self-righteous 12 yr old 
toddler whose only defense mechanism is to drown others in noise.",139,27,1,0.962962962963,82.2966666667
126,trump is the one who deserves to be President.,46,10,1,1.0,95.165
127,"ANYONE WHO IS OF DRAFTING AGE PLEASE BE REMINDED!- - - - - - War with 
Russia is IMMINENT - And, Clinton has stated uncategorically ""nuclear war 
is on the table"" which means she is in favor of it. - - - - VOTE TRUMP if 
you want to live.",238,57,2,0.771929824561,99.2443421053
128,I'm lucky that I don't live in the USA. Sweden for the win,58,16,2,0.875,103.54
129,"I feel like Donald and Hilary are a couple who have been together for 
decades and just decide to divorce and are fighting over the country a.k.a 
us but we would rather live with auntie sue😁✌🏻️",196,36,1,0.916666666667,55.145
130,"I'm 15 years old and I don't understand economics can someone explain it to 
me",79,17,1,0.941176470588,80.0976470588
131,"the donald was like the no huddle bills offense of the 90's. JUST KEPT 
ATTACKING!!!!",85,21,3,0.761904761905,119.158571429
132,#TeamHillary,12,2,1,1.0,204.805
133,"Donald Trump--is future President of US for next 10 years------------US 
needs him , to stop exodus of US companies to other countries and scrap of 
NAFTA",154,35,1,0.685714285714,74.6242857143
134,trump is a rasist son of a bitch.,33,9,1,0.888888888889,131.9
135,"Economics says.. Trump will wreck the economy... He does not know what he 
is talking, seriously.",97,19,2,1.0,85.8767105263
136,"This has been interesting to re-watch. Hillary actually started slinging 
dirt first and was the first to mention a ""special prosecutor"". So glad 
Trump won!",157,30,3,0.9,86.705
