,0,num_char,num_word,num_sent,TTR,FRE
2634,"Republican voters don't want Hillary because they don't think she's a good 
politician. If it's a good politician they want, then why in the primaries 
did they vote for Donald Trump, guy who is not a politician and has no 
political experience to say the least? Marco Rubio was a lot more qualified 
to be president than Trump, so was Ted Cruz. Hell, even Jeb Bush was more 
qualified. What honestly made people believe that Trump was more qualified 
than the other Republican nominees?
Voters have said that Trump talks just the way they do. That's because 
Trump's not a politician just like most of the voters aren't. They don't 
know things work in office. And if Trump becomes president, he's going to 
find out the hard way how things work and is going to realize, very 
quickly, that he's in over his head and that running for president was a 
huge mistake. If Trump realizes that he's in over his head, he's not going 
to resign even if he's advised to because he'll tell his advisors, ""No, if 
I resign then everyone is going to know that I couldn't do this job and if 
that happens, my image will be ruined."" To people like Trump, their image 
is more important than the well-being of the country.",1208,257,11,0.47859922179,79.0991192076
2635,Let's protect the American Dream!!! Trump!!!,44,13,3,0.615384615385,130.852051282
2636,im not from america but i hate Clinton +i hate america,54,11,1,0.818181818182,64.9245454545
2637,He speaks on a 7th grade level.,31,8,1,1.0,124.69
2638,go Hillary go go,16,4,1,0.5,75.875
2639,"just love it ehen she laughs and smirks like a fckin delusioned little 
schoolgirl,not laughing now hahahahaha trump trump trump",128,22,1,0.909090909091,115.286818182
2640,1:28:40 savage... I died laughing,33,6,2,1.0,119.19
2641,"Leader Trump

When the word, “leader”, goes through your mind, do you think of a man or 
woman? Obviously, a woman can be just as or even more manly than a man can 
be. But image is very important to our enemies way of thinking which leads 
to their decisions. Trump is only going to do good things to our military 
and create a GREATLY, assertive image upon our threats. Security is a 
beautiful thing and will keep so much stress away from our minds.

With being president comes great power and with great power, Trump knows 
good and well about great responsibility. Donald Trump seems to have a good 
perspective of responsibility. He has already proven how responsible he is 
with his decision making as a business man. Just from impressions, it might 
seem that he makes risky decisions but within the past decades he hasn’t 
showed us anything but success and extreme productivity. Trump may be 
drastically different, but that also means that he is an ,outside of the 
box, thinker, for example, “He tends to buy properties that have less of an 
upside if they also are a safer choice (i.e., less downside).”.

America’s debt simply and literally needs conservation because of all of 
our investments being made in the last 2 terms. Trump is only bringing 
notice to the most effective problems that don't try to focus on as many 
people’s feelings as possible. He will not make ignorant decisions because 
he has gained more than he has lost from bankruptcy and gained an unlimited 
amount of resources to make him all around successful. Donald Trump has 
proven that he is active and willing to put in work because of his rapid 
amount of trial and error.

Every penny counts as Donald Trump just wants to save/make money along with 
growing our economy more efficiently than ever before. He has a plan to 
reduce most taxes. Trump is tremendously serious about calculations to set 
his goals higher than most people are ready for. Because of most people 
thinking that taxes are inevitable, they just assume that we will lose so 
much money if we cut them but if Trump becomes president I strongly believe 
that money will be one of the least of our worries.

Currently, among our peers and media, we see how Trump supporters just do 
not “fit in”. All the youngins these days just won’t open their mind up a 
little because they never imagined him and his different ideologies 
proceeding in politics. Our fairly new generations don’t understand how 
Trump is the actual republican candidate. Our media has convinced so many 
people that Trump is the most unsophisticated choice, therefore, they also 
want to convince more people to not vote for Trump. This, of course, leads 
to making many republicans feel that Trump just can’t be an option because 
of the pressure other peers have put on them.",2811,533,23,0.497185741088,67.7622587487
2642,free college is stupid if your smart enough then you get a full scholarship,75,14,1,1.0,77.8107142857
2643,"oh well....I am a American citizen for 58 years and well I will NOT BE 
VOTING.....",83,20,1,0.9,93.475
2644,"We are in debt why don't we just print more money are we out of ink are we 
out of paper what a big joke",104,26,1,0.769230769231,92.5911538462
2645,"Trump is totally correct.... Heroin is rampant in Richmond VA and we must 
stop this! We have to stop this epidemic. Please!",124,27,3,0.814814814815,100.566666667
2646,"A vote for trump is a vote for racism, for Putins dictatorship, and for 
sexual predators.",90,19,1,0.736842105263,80.6868421053
2647,"Notice how she looks down when talking about ""Haiti""..and how much she 
contributed she's so full of lies can't even looks straight on the cameras 
or in the audience or host's eyes..Pathetic!",192,39,1,0.820512820513,67.4653846154
2648,good,4,1,1,1.0,121.22
2649,TRUMP#2016,10,3,1,1.0,175.59
2650,"Am I the only one who is annoyed by the fact that Trump's mic is uneven 
when Hillary's is perfect placed in the center?",120,27,1,0.814814814815,69.7633333333
2651,"congratulations madam,your a winner....",39,8,1,1.0,82.39
2652,Hillary Clinton makes more sense than Trump.,44,8,1,1.0,92.965
2653,"Please take the time to read this, like to show that you still care




If you have any emotions as a human left, don't vote for trump. I am 
Hispanic and my parents came from Mexico because they had to look for a 
job. They were separated from their grand parents and parents for many 
years, and now their grandparents can't even come and visit us, not even my 
uncle! My parents will end up being deported leaving me, my sister and my 
pet helpless with no food, water, or money. I may very likely be spending 
my time living in my school. That's not all, over 5,000,000 kids will be 
left alone with no one to help them. Even if we do get help, we will still 
be separated from our loving parents. And over 300 people have said that 
they will commit suicide if trump wins. Not to mention the other deaths 
caused by homeless children and innocent immigrants who have lost 
everything they have worked for. My mom has worked for Allstate for 13 
years and has recently opened up her own agency with Allstate after 4 years 
of school, traveling, and work. My dad has helped many Americans with work 
and projects as well not criticize anyone even if they are racist, 
American, or African American. My mom tries to save lives and supports many 
organizations and has donated thousands of dollars to programs trying to 
save lives.Also think about it, Abraham Lincoln tried his best to keep this 
country together but got killed for his efforts.Martin Luther King Jr. not 
only helped fight for equal rights for African Americans, but Mexicans, 
Hispanics, Muslims, women, and other immigrants who were struggling getting 
a better life.Do you really want a president who is a racist jerk who only 
cares about his own personal gain? I do agree that there are some bad 
people that do some bad crimes, but you don't see trump putting all the 
American criminals and serial killers in jail! Choose what is right. The 
fate of America and millions of lives rests in your hands. You can be a 
hero or a villain. You hold the power. Choose what's right.



#DumpTrump #HillaryForPresident",2086,414,19,0.545893719807,78.8665102975
2654,I hate trump he is rude just hear what he says,46,11,1,0.909090909091,111.07
2655,great,5,1,1,1.0,121.22
2656,"Donald and his people are wrong about everything, cause they are lieng 
about everything. They are just hypocrites, racist, bigots and idiots.",142,27,2,0.703703703704,83.4658333333
2657,"That sexual predator trump is just a russian agent who has corrupted even 
the FBI.",83,16,1,1.0,68.9825
2658,"Trump literally treated Hillary in this debate as both a bitch... and a 
punching bag...",88,17,1,0.882352941176,75.1211764706
2659,LOVE IT! HATE that lying bitch.,31,8,2,1.0,128.75
2660,TRUMP IS A RAPIST! - AND HE'S NO GOOD FOR THE ECONOMY!,54,15,2,0.933333333333,108.9825
2661,"Hillary said and leaked classified information that there ""4 minutes to 
launch Nukes"" IDIOT!",93,17,1,1.0,75.1211764706
2662,"Trump is an idiot with no wisdom. He even brags about being a sexual 
predator.",79,17,2,0.941176470588,73.7957352941
2663,"That trump and his supporters are just idiots supporting charlatans, a 
women abusers, and a sexual preadators.",111,20,1,0.85,63.865
2664,"It's kind of hilarious how almost exactly 20 minutes in Trump starts to 
lose the grownup act and reverts back to acting like a jittery 5 year old. 
He can't even sit still for half an hour. It's awesome that he's going to 
be sitting in a room for hours negotiating with world leaders, making deals 
and defending our country. Thanks America.",343,71,4,0.830985915493,75.6215669014
2665,"sort out your nation institutionalizing racism, and stop allowing African 
AMERICANS to be gunned down in ghettos or in high streets by cops!",141,25,1,0.96,46.1
2666,"when i was little my mother showed me how many countries in the world were 
painte d pink in our atlas, the colour of countries that were part of the 
British empire where represented as pink and an awfull lot of countries 
were pink. I am sixty two years old, so that was more or less fifty five 
years ago, since then it has definately been North America who kept peace 
in the world, that is NOrht America has been great since the Kennedy's, a 
bit before, till now, still is the main power in the world, that is when 
America has been greatn much as for many americans other parts of their 
history seems to tbe the great ones. Greatness brings with it actions 
people question, such as Guantalamo,however who can doubt it, America is 
still great, jgreatly good or greatly less good but great. It is the 
country who holds the balance of power of the world, so it is just stupid 
people who talk of when it has been great , it is still great now as great 
as ancient Rome.",977,203,4,0.532019704433,59.4715332512
2667,"Greetings Youtube. My name is Yaav Benjamin Polus and I hail from Fort 
Worth, Texas. My occupation is producing squash. Simply put, I am a squash 
baron. I am the biggest producer of sqaush in the U.S and I have business 
deals with Mexico, Canada, Russia, France, England, and other various 
foreign countries. Due to my job and my wealth, I am a target for other 
rival squash barons around Texas and even from other states. I would like 
to propose an offer to the gun-toting folks on Youtube. The offer includes 
protecting my crops and defending my mansion from critters, thieves, and 
other types of beings that would wish to commit harm on my crops, which 
would also effect my business. I pay $75 per hour and I've established my 
own barracks on my land, and also food and beverages are provided. I do not 
provide guns though; you will have to have have your own firearm and that 
is why I'm asking you guys. Consider this offer because it is a very good 
one. Thank you and have a nice day.",1002,211,12,0.568720379147,88.750949842
2668,"We elected Donald Trump as president.........I can't believe it! We have 
officially screwed ourselves!",103,21,2,0.809523809524,87.4060714286
2669,"Donald trump = Hitler 2.0 



If donald wins the world doesn't makes sence anymore",82,15,1,1.0,101.37
2670,"trump is a terrorist. all Africans hate him. Even Paul Biya and Robert 
Mugabe are much more intelligent than Clinton and trump put together",140,26,3,0.884615384615,77.646025641
2671,*SUBSCRIBE to my channel Runningbear Sf*,40,6,1,1.0,144.345
2672,Guys! You could vote for the independent parties! Just FYI,58,12,3,0.916666666667,111.125
2673,TRUMP start worldwar3,21,3,1,1.0,147.39
2674,"""WRONG""- DONALD J TRUMP",23,7,1,1.0,139.301428571
2675,"The wall is coming, the bad hombres are going bye bye.",54,13,1,0.923076923077,115.547692308
2676,hillary FOR PRISON!!!,21,6,2,0.666666666667,119.19
2677,I guess we now know who won all the debates. And it WASN'T Hillary!,67,17,2,1.0,113.6075
2678,"Trump tells it like it is without the political bs . Hillary is just 
sitting there laughing , soullessly going thru lines her corrupt DMC has 
fed her . She is merely a puppet that's owned and paid , has done nothing , 
using her women card to win this election clearly didn't work out .",288,58,3,0.827586206897,90.9427011494
2679,THE PURGE HAS JUST BEGINS,25,5,1,1.0,100.24
2680,"11 million ILLEGALS in this country and this bitch and sympathizers are 
blaise about it...
that wall will be built and the ILLEGALS will be deported!",150,28,1,0.785714285714,66.6221428571
2681,"It feels great knowing Trump has won. When he won it was one of the 
greatest moments in US history.",100,22,2,0.909090909091,95.6881818182
2682,"Sometimes, I can't tell the difference from SNL and reality.",60,13,1,1.0,89.5169230769
2683,"27:55 Gotta love the hypocrisy in the liberal democrats. Using Russia as 
the reason to vote against Trump even though Clinton accepts millions from 
Arab countries that FUND RADICAL ISLAM. ........",198,36,3,0.888888888889,77.155
2684,damn I'm glad she didn't win...,31,9,1,1.0,131.9
2685,1:07:56 she has an earpiece it's so obvious glad she lost,57,12,1,0.916666666667,95.955
2686,"Drumpf has a face like a baboon's ass and a hair piece that looks like a 
dead hamster on top of his head! It's just absurd this buffoon is elected 
as president not that Hitlery is any better! Lol",197,43,3,0.813953488372,97.8494573643
2687,"Justice to all the Arab peoples vote in American elections because the 
American president will control 21 weakling Jaen Arabic
painful truth",141,22,1,0.909090909091,34.5322727273
2688,"She's worried about Toddlers getting to guns..BUT supports Abortion even in 
third term abortions? what a bunch of junk!",120,22,2,1.0,84.1518181818
2689,"""You encourage espionage against our people"" hmm..... so following laws was 
in her agenda? When did she chime in where Obama on video said there will 
not be any consequences for illegals that illegally vote for this election?",227,44,2,0.931818181818,61.4504545455
2690,thank god a criminal didn't win,31,7,1,1.0,103.044285714
2691,"Trump is nothing but a big liar leading a bunch of racist, bigots, and 
ignorants. He is like a leader of an evil and dangerous cult of idiots.",143,32,2,0.75,90.1325
2692,"God Trump is your new President now ! ♥
*Go look at the video on my channel where Ann Coulter was laughed at when 
she said Trump will win (If you want to of course)*",166,38,2,0.947368421053,102.95
2693,"Never would have guessed ASSANGE, PUTIN, TRUMP, and the FBI in bed 
together.",77,17,1,0.882352941176,124.885882353
2694,Lmao I've never laughed so hard.,32,8,1,1.0,135.265
2695,Clinton doesn't understand when Trump is trying to explain,58,10,1,1.0,78.245
2696,"Why should we allow heroine into our country. There are all sorts of hard 
drugs in rio down in brazil and look what has happened to that country.",146,30,2,0.9,84.45
2697,What is that hand thing Hillary does at the end? 😂,51,12,2,1.0,116.145
2698,"I'd like to punch Nicole Wallace in the face....and I'm a Republican. 
PRESIDENT TRUMP 2016-2024.",97,21,2,0.904761904762,107.548928571
2699,"Hillary would have made a terrible president. Would have been scandal after 
scandal, as it has ALWAYS been with the Clintons. And she is just so phony. 
I never believed anything she said. How can anyone?",205,42,5,0.833333333333,89.5375714286
2700,"obama was a total failure. trump really hit the nail on the head when he 
said clinton would be another 4 years of obama. and obama was another 8 
years of bush. obama was basically just a black democrat version of bush. I 
am glad trump won",241,51,5,0.686274509804,85.3408235294
2701,i glad im not the only person w still watching this.,52,12,1,1.0,81.855
2702,"I don't understand why people come here illegally? Like, why not just take 
the necessary steps you need to be a legal immigrant? It either must be a 
super complicated process to get in, or so bad on the other side of the 
border that people are driven by desperation. Why even risk being separated 
from your family though? Because if Trump's plan to deport all illegals 
immigrants follows through, then that's probably what's going to happen, 
and they'll have no one to blame but themselves for coming here illegally 
in the first place. How are they getting through anyway? Don't we have 
people patrolling the borders? Are they being bribed, or is the border too 
extensive for them that they can't monitor every inch of it?....I just 
don't understand how it all works.",777,158,8,0.677215189873,78.0938132911
2703,"The Wikileaks hacking revealed that Hillary Clinton was informed of what 
the questions were going to be by MSNBC for all the debates. She should 
have hit them all out of the park for that reason, but she didn't.",213,43,2,0.837209302326,92.5427325581
2704,"Who thinks that Trump will judge America to make her state Edmi have sinned 
but will be governed to destroy it and make it a desolation, and after the 
infection spreads to all major countries, including the land begins 
imbalances",232,42,1,0.809523809524,47.3764285714
2705,"Don't forget to watch the exclusive clip of Hillary and Donald singing 
''Breaking Free'' on my channel!",104,20,1,1.0,85.015
2706,"Maybe it's not such a bad thing Trump got elected, it could serve as a much 
needed wake-up call to the Democrats and Liberal elites to get their heads 
out of empty liberal rhetoric and actually pursue some centre-left 
democratic socialist policies that benefit the working class.",282,50,1,0.9,30.877
2707,"Would Pres. Elect Trump act objectively towards a foreign country if his 
business were to suffer some great loss? Or even on a range of others 
issues at stake. That's why the conflict of interest question is a very 
valid one.",228,46,4,0.891304347826,84.814673913
2708,"Obama was disaster, Hillary would have been a catastrophe, Trump is an 
egoistic patriot and we can live with that.",115,23,1,0.95652173913,73.142173913
2709,"SPOILER:




TRUMP is the new president.",40,8,1,1.0,103.54
2710,"Noticed she never answered the question about her and her husband's 
treatment of women.",88,16,1,0.9375,68.9825
2711,"""Keep eye on ISIS""?????? (what about ""destroying"" ISIS),,,,,she sold 
weapon, guns to ISIS,,,,,,,(google wiki leaks),,,,,,,,,Trump said he will 
let everyone know about acceptance if H. Clinton wins,,,,news reporter is 
assuming he said he would not accept results if she wins............",288,87,2,0.48275862069,104.337672414
2712,I support Trump!Trump for 2016!he can make America great again!!,64,16,2,0.75,114.115
2713,"If that animal, Hillary Clinton became president, Monica Lewinsky would be 
Bill Clinton's private secretary! Paula Jones, and Jennifer Flowers would 
run the State Department!",176,31,2,0.838709677419,57.3799193548
2714,"CNN said obviously Hillary won all the debates. Then Trump won the 
election.",77,15,2,0.8,69.5025
2715,24:55 Biggest Lie Ever!,23,5,1,1.0,117.16
2716,Victory !,9,2,1,1.0,77.905
2717,GO TRUMP,8,2,1,1.0,120.205
2718,trump on,8,2,1,1.0,120.205
2719,We love America we love the American but we are afraid of American future,73,14,1,0.785714285714,41.5535714286
2720,Trump is the best,17,4,1,1.0,118.175
2721,Team Hillary,12,2,1,1.0,35.605
2722,halla trumpets,14,2,1,1.0,35.605
2723,TRUMP 2016,10,2,1,1.0,162.505
2724,"Hillary Clinton says "" We have accepted the result of the election over the 
past 240 years"" Someone tell me are Americans today accepting the result in 
2016?",159,30,1,0.866666666667,57.945
2725,of course those killer toddlers with there guns... give me a break,66,13,1,1.0,102.532307692
2726,"And Trump one. Literally ripped the corrupt DNC machine and kicked their 
ass!! Look at the huge boost to the stock market!!",124,27,4,0.814814814815,105.98375
2727,Perhaps not - but they were both nominated...,45,9,1,1.0,94.3
2728,"uffffffffffffffffffff 47:10 ,hillary *goat, damn real slap on the face to 
mr.donald trump",90,15,1,0.933333333333,129.57
2729,is it just me or does Chris Wallace look like a ventriloquist doll?,67,14,1,1.0,114.067857143
2730,"that dirty bitch is so shook up now Trump won.lmaooo!! that silly ass fake 
sneaky bitch is gonna get locked up watch",117,25,2,0.8,112.9315
2731,"Kinda funny how Hillary talks about ""accepting when you've lost"" when she 
then proceeds to tell everyone not to take the win of donald trump as ""the 
end"" ??????",162,39,2,0.74358974359,102.4425
2732,"when they talked about fitness, i thought they were gonna talk about their 
workout routine",91,17,1,0.882352941176,90.0505882353
2733,"#unfollowfriday 
On the list. ",30,6,1,1.0,158.445
2734,"we vote for Trump man Hillary Clinton just wanna make the city as heck as 
horrible as Obama",92,19,1,0.894736842105,67.3289473684
2735,"A verry , verry small LOAN OF A MILLION DOLLAS",46,10,1,0.8,103.625
2736,his voice is horrible,21,4,1,1.0,75.875
2737,"27:47.From everything I see has no respect for this ""Bitch, Oh no"" 
Person~!LOL",79,18,1,0.944444444444,122.765
2738,I'm from upstate new York :D,28,8,1,1.0,114.115
2739,"Arguably the answer at 1:18:00 was the worst moment for Hillary. She gets 
asked a question about her No-Fly-Zone policy, doesn't seem to answer it, 
and does nothing to quell any fears that her presidency could lead to war 
with Russia. Instead, she talks about the refugee crisis which has nothing 
to do with anything",320,61,3,0.770491803279,76.6327322404
2740,Sucks for all the hillary supporters because trump won! Ha😂,60,11,2,1.0,93.5797727273
2741,I want my American privileges. I was born here.,47,11,2,0.818181818182,85.8888636364
2742,This could be watched just to laugh at and make your mood good.,63,14,1,1.0,114.067857143
2743,"Oh, smile for the camera, Hillary smile! :-)",44,13,2,0.846153846154,128.652884615
2744,"she miscalculated one interesting point - american men, white in 
particular, are fed up with american women. and she talks and acts like 
one...",145,28,2,0.821428571429,71.7678571429
2745,lol I hate how she blames Russia for making her lose,52,11,1,1.0,103.379090909
2746,I'm so glad Trump won...,24,7,1,1.0,127.215714286
2747,1:03:10 how true about the media,32,6,1,1.0,87.945
2748,"*** Tulsi 2020 ***
Tulsi Gabbard for US President backed up by Nina Turner & Bernie Sanders",91,17,1,0.882352941176,95.0270588235
2749,She must have the same clothing designer as Ernst Stavro Blofeld.  LOL!!!,73,16,3,0.875,137.971666667
2750,why must she look like she is going to fall,43,10,1,0.9,103.625
2751,"Haha people calling Trump predator have you check Clinton history?Bill 
Clinton ?He is he has rape woman Monica Lewinsky ring any bell? Any proof 
on Trump ? Don't believe the media brainwashing fool",199,38,3,0.868421052632,78.2099122807
2752,if you saw Hillarys Ameicas doumentary you would not be thinking that way,73,13,1,0.923076923077,122.055384615
2753,"It looks like Hilary is on the verge of bursting into tears throughout this 
entire debate.",91,17,1,1.0,70.1447058824
2754,"Hillary Clinton and the whole family in general is one big crap stain in 
American history, and I hope they all just go away until they become dust!",148,30,1,0.9,55.125
2755,"She should have been immediately arrested after she revealed US nuclear 
response time in this debate which is a highly classified piece of 
information.",153,25,1,1.0,35.948
2756,"donald trump""s aggressive on debate and run it well,
i love it",62,15,1,0.933333333333,95.73
2757,fascinating to watch this again AFTER the election...,53,9,1,1.0,56.7
2758,Trump totally won. u can tell by Hillary face & eyes the lies,61,14,2,1.0,103.044285714
2759,"""fight climate change""...... We are actually talking about trying to change 
the climate, sit back and think how god dam ridiculous this is. In 100 
years this climate change thing will be seen as the most stupid concept 
that the world has ever heard of. It hasn't been warming in any notable way 
in the last 18 or so years. There is no way that we can prove that any 
previous warming wouldn't have happened anyway. No way at all.",433,92,5,0.739130434783,92.5242173913
2760,"So glad she didn't won hahahaha omg I dont care about Trump I just know she 
is so angry and so poison for her being the loser that she will die as what 
if hahaha",163,36,1,0.888888888889,85.695
2761,Saturday night live brought me here,35,6,1,1.0,87.945
2762,"I'm so thankful the country finally pulled together against Clinton and 
Obama! These people have really done this country so wrong! I'm glad they 
finally got there's. All that going around congress and doing what they 
want instead. Not calling people killing Americans for what they are, 
Islamic terrorists. Going to other countries speaking against there own 
country and people. Turning there backs on the God this country was built 
apon. So proud we all see it!",469,89,8,0.719101123596,83.3768328652
2763,"HILLARY KEEPS TALKING EQUAL RIGHTS FOR WOMEN......I WANNA SEE THEM PLAY IN 
THE NFL!!! LMFAO",92,22,2,0.863636363636,118.760909091
2764,stupid laugh HA HA HA,21,5,1,0.6,49.48
2765,So glad she lost the election,29,6,1,1.0,87.945
