,text,z1,z2
815,"It's funny to watch such kind of debate, are you kidding me that one of the 
two is gonna ruling the country?",-0.14855373973,-0.0915924543227
816,"I am totally amazed on how many people actually think Hillary would be a 
good President. I see it a lot. People have blinders on! How could someone 
watch this (town hall) and think for 1 second she is or would be a good 
candidate for President!! Makes me sick!!",-0.161077849361,0.0227882815959
817,"Trump offends and insult races, women, religions, cultures, and even entire 
nations. The entire world hates him allready. He is too stupid to be 
president.",0.112194663024,-0.103454379486
818,PPL OF AMERICA! THIS IS NOT REAL THE GAME IS RIGGED . STOP WATCHING TV .,-0.147886903322,-0.103525292764
819,"If you look Trump, his face matches with the Sheppard dogs",0.157145822277,-0.0818784416393
820,https://soundcloud.com/cirnesongsascap/whose-idea-was-this,-0.10898611662,-0.0758347263119
821,This is 😂😂😂😂😂😂😂,-0.10898611662,-0.0758347263119
822,get to 24.33 you'll notice the old man sleeping,-0.112849859134,-0.0933578068758
823,"nope. this presidental not an important thing for this edge. yea, we 
already at the edge.",-0.119510226146,-0.0806381994406
824,Fugazi rules,-0.10898611662,-0.0758347263119
825,Is this a roast session? Is this serious?,-0.10898611662,-0.0758347263119
826,Lolllll my video messed up and it shows Hillary talking with Donald's voice,-0.0548755864928,0.317237501024
827,"20:15 that double chin wtf obesity should be a major issue which must be 
discussed",-0.136310411063,-0.0981228665039
828,Isn't the U.S.A. about having equal rights ?,-0.10898611662,-0.0758347263119
829,Fly lands on Hillary's face at 14:45,-0.17086936461,0.212409609325
830,this wasn't fair they said hold the aplose to trump but not hilary,0.173781343202,-0.109079406119
831,"can they be age appropriate please??? I'm 13, doing a school project?!?",-0.10898611662,-0.0758347263119
832,So the fat chick with the pink hair is a Muslim huh?,-0.10898611662,-0.0758347263119
833,Why does that ugly ass skeleton looking bitch Interrupt?,-0.119128592927,-0.0803540604302
834,"The current political landscape is cause for me once again to coin the 
general consensus of the american voter and their frustration...
we are fighting a campaign that concedes the reality of, ""[a]s a nation we 
are stronger together in order to adjust and resurrect a robust economy 
nationally"". The republican party has it's agenda based on, ""[w]e gotta 
save the country from those (""Stronger Together"") voters""; because they are 
causing a massive degree of harm to themselves...
Think about it folks and get out and vote for Hillary...then turn to your 
Republican advocate and give them the finger ""index of coarse"" right to the 
face and say...""get a grip"" we're gonna survive this G.W.Bush Holocaust if 
you'd just stop panicking!!!",-0.15782036449,0.0794608501798
835,"Glad that I'm Australian, these debates are like schoolyard arguments.",-0.129279842983,-0.130456347068
836,"Mr. Trump, I feel very not Ameicano to vote for you, find you a provider 
able to mount a country, we like the Lord set up the American dream, 
working, generates value to others, including us in Brazil, the American 
people have the judgment of minimum, I think even the Hilari should vote 
for you and not her own as every American self-respecting, a big hug from 
your fan Adam from Brazil",-0.0389785630285,-0.113634286513
837,"Can you americans just get togheter and go 'yeah the meme has gone stale, 
let's stop this whole trump thing'?

Thanks, the rest of the world.",0.0476130993271,-0.0994965859896
838,"23:08 - Thank you, Trump for speaking about Congress' terrible decision to 
let Hillary to get away with blue murder tbh.",0.2155106883,0.356182175955
839,"RepubliCunts suffer from cognitive dissonance. You don't get to claim 
you're these wonderful Christians yet have such contradictory views about 
everyone different from you. It's hard explaining this to you all when 
you're probably the offspring of an incestuous relationship. I can judge 
I'm atheist and proud",-0.12526252699,-0.0932277547616
840,"Y'all in different countries watching our debates are wasting your time 
tbh. hop off.",-0.129830299584,-0.0934879090143
841,"Hi NBC, 
While I thought it was great the entirety of the presidential election was 
here on YouTube, I have to say that when my closed captions were on, I was 
at a loss. Though I am hearing, there are 360 million people globally who 
rely on the usage of closed captioning. This debate's captioning didn't 
even begin until almost a half hour into the video's beginning (28 minutes, 
38 seconds to be exact) but started with statements that were not made at 
the start of the video. It would be wonderful if something so widely 
watched amongst hearing people could also be viewed by the millions who 
cannot hear but still are voters in our country.
Please fix this, thank you, Megan",-0.170394552715,-0.100873892346
842,"Ken bone is a god not Pepe not dat boi not the blunt god snoop no no KEN 
BONE IS THE SAVIOR OF THIS WORLD",-0.168003052674,-0.138683479072
843,isn't there a 3rd party to choose? please?,-0.10898611662,-0.0758347263119
844,1:29:38 I respect this guy,-0.128119273739,-0.0997509218826
845,"I believe that the people have stereotyped elections based on this 
""squabble ""of these canidates. There are office holders and potential 
office holders who do hold solid policies that look out for the general 
public. For those that see this don't give up on this Democrarcy build our 
foundation again by electing true officeholders that do their duty, and we 
as a people should cooperate together solve issues as a whole.",-0.15472037507,-0.114511143994
846,trump un loco demente,0.84790265652,-0.0568756352702
847,Donald Trumps will emerge victorious. good luck.,-0.0468447539437,-0.0898986379005
848,Did they even answer what they were asked ??,-0.119106687575,-0.0802724646627
849,Trump is another level of bad. Go. Hillary. Clinton.,0.120793915482,0.387151666629
850,"trump never answers the questions properly. He always changes the topic to 
ISIS, Walls and so on. What is going ON!",0.181909594263,-0.072967238538
851,"This video shows proof that MOST of America are complete retards to vote 
for this guy. If you actually listen to what he is saying...he sounds like 
a complete retard! He doesn't know what he is doing. If he gets elected, he 
will be the WORST president in history.",-0.151096855122,-0.121122803577
852,Hillary caused all of this with her illegal server.,-0.144659137062,0.88503483267
853,"#waterislife
#NoDAPL
#standwithstandingrock",-0.10898611662,-0.0758347263119
854,"TRUMP DO NOT REALLY ANSWER TO THE QUESTIONS. Wondering why? Bc he has 
nothing to say or to do for real for the country.",0.0538010813341,-0.0798280924797
855,"Wow after all that during the last question, hillary still goes on to talk 
about herself at the end... - couldn't even make an authentic and genuine 
compliment about Trump?",0.0961918160809,0.210593586823
856,Which part does the Bone come in?,-0.140014180993,-0.102317816925
857,"Wow, this is one of those rare cases where the sequel is better than the 
original!",-0.122400490851,-0.0706589676668
858,I vote to Donald trump because Clinton sell USA,0.229050260045,-0.0107602237437
859,"then they force people to buy insurance that can't afford it or they get 
fined at tax time. 
now they have insurance, can't afford to use it and also can't afford 
groceries or many other things",-0.136522589988,-0.1103689922
860,I hate donold trump #killHem,0.28483348384,-0.0680769129456
861,What a huge man behind Trump 28:18,0.300204964972,-0.08346797484
862,"Well if Clinton comes to the throne I will see the second part of 
""Operation Merciful Angel"", or maybe the reboot, so shelter here I come, 
again, maybe now more than 78 days.",-0.119924880196,-0.00534092713116
863,"I'm confused. Was Martha Raddatz a part of this debate, or was she a 
moderator? Start at 1:00:00, and you will see her bias opinion coming out 
more than ever. It's as though she thinks shes a contender in this debate 
rather than a moderator. Not to mention how hypocritical she was; She 
starts out by asking the audience not to interrupt, yet you see her 
interrupting threw out the debate, and even laughing at one point. What a 
mistake it was to cast her as a moderator! After watching her, it seems 
unfair that Megan Kelly got the repercussions she did after the first 
republican primary. Martha Raddatz is a joke!",-0.149712938195,-0.0764626039359
864,"Soooo it's either a sick woman or a man who just wants power....good 
choice's.",-0.132802125477,-0.117215411018
865,"""make America great"" WITH ALL THE PEOPLE IN IT...",-0.17310543608,-0.129876154644
866,"Dumbass moderators biased towards Clinton. Applause for Trump gets shut 
down, but applause for Clinton isn't. This was a 1v3. 

Libtards.",0.174010840817,0.0612278306021
867,put thumps up for me and donold trump gonna die when he lost the debate,0.159456577417,-0.0724786452469
868,"Hillary Clinton might be the first f-
Sorry I tried to wright female but the emale got deleted.....",-0.14278070561,0.401750388537
869,"Plus, women were recently accepted for the draft and ground infantry.So, 
you're going to war too if Hillary's elected.",-0.127634556042,0.209825475798
870,"Do you want to teach your students about all types of talk fallacies, just 
let them watch this.",-0.116339308508,-0.083871763091
871,"Funny that during the times I was watching when the audience cheered 
Hillary the hosts said nothing.. smh.",-0.14024895356,0.250904685539
872,"she smiles like an idio, perhaps because she thinks he is a moron who is 
not at her same level, I'm not saying this because I'm biased somehow, is 
just I can fell the arrogance when she smiles",-0.123039417998,-0.118624648826
873,"Would a Russian sniper just blow Killary's brains (or whatever you call the 
inside of her head) out already? Yeesh",-0.110409994541,-0.112184009999
874,Their answers don't even relate to the questions oh god!,-0.146737308916,-0.0945354737206
875,"She's just like Francois Hollande, the France's Bigger Jokes Ever !",-0.124138357437,-0.139957213944
876,"I am voting for Hilary because she will be the first f president. 

Notice anything? The emale was deleted.",-0.123539817905,-0.139639440205
877,VOTE FOR PEDRO,-0.137114868615,-0.0756850907662
878,WAIT ONE OF THESE TWO IS THE NEW PRESIDENT IN AMERICA?!,-0.151021361592,-0.128375206751
879,"If i get 1 dollar everytime they lied, i would be rich",-0.10898611662,-0.0758347263119
880,"I still think Bernie might win, like if you agree. I subscribed, this was a 
good piece of content. Thank you @CBS",-0.139240264732,-0.115881545346
881,the first questions such a plant,-0.147005220723,-0.078121975079
882,"Irony. We are the most powerful nation in the world but when it comes to 
the happiest, we don't even make it in the top 10. Countries like Denmark 
and Finland are. But not us. We are the richest and yet we have the highest 
rates of hunger and childhood poverty. We have Senior citizens that are on 
SS and still can't make it. We could have been the happiest country in the 
world if we chose Bernie. But no. INSTEAD WE ARE STUCK WITH THESE TWO!!! 
GOOD JOB AMERICA.",-0.161936468376,-0.134932955055
883,"this is the funniest presidential debate ever 
I laughed so hard omg",-0.147584098356,-0.0689328428744
884,"By the people, for the people, under one God, one nation, saluting one 
America flag! Donald J Trump for President! America first!",0.0780581664526,-0.121963359276
885,"If someone were to assassinate Hillary Clinton, we'd be stuck with Tim 
Kaine. Can we just overthrow the government if she wins?",-0.128116659348,0.339851773952
886,"they are both horrible and defined almost exclusively by what they think of 
the other candidate so please please please go vote for jill stein you 
beautiful americans",-0.1478087307,-0.0981648779049
887,"23:00 look on how much she is blinking,and that fake evil smile,my good she 
has a evil smile",-0.14513435387,-0.110235496091
888,"Trump is the real deal, he's self funding with public donations, Hillary 
received $400,000,000 from globalists, and foreign powers
the bankers hate Trump, the entire criminal establishment is against Trump.",0.60940631905,0.232404950489
889,"I have a great youtube channel, my subscriber count is going to be 
huuggeeee, go subscribe to me, my channel is the best, you won't believe 
how great it is.",-0.129852545248,-0.0930799632163
890,What a puppet show.,-0.10898611662,-0.0758347263119
891,How can I flag this for stupidity....,-0.10898611662,-0.0758347263119
892,the worst media....so discriminant,-0.109186545516,-0.079377337102
893,Obama was not born in this country.,-0.143074671607,-0.0949120475697
894,"FOCUS ON THE BIGGEST ISSUE --- Voting machines... Why is it always 
Republican votes changed to Democratic votes? --- or Bernie votes to 
Hillary votes?

List of numbers to reporting any cases of voter fraud and intimidation in 
each state.
Alabama 334-242-7210
Alaska 907-465-4611
Arizona 602-542-8683
Arkansas 501-682-5070
California 916 657-2166
Colorado 303-894-2200
Connecticut 860-509-6100
Delaware 302-739-4277
Florida 877-868-3737
Georgia 877-725-9797
Hawaii 808-453-8683
Idaho 208-334-2852
Illinois 217-782-4141
Indiana 317-232-6531
Iowa 888-767-8683
Kansas 785-296-4561
Kentucky 502-564-3490
Louisiana 225-922-0900
Maine 207-624-7736
Maryland 410-269-2840
Massachusetts 617-727-7030
Michigan 888-767-6424
Minnesota 877-600-8683
Mississippi 601-576-2550
Missouri 573-751-2301
Montana 406-444-3976
Nebraska 402-471-2555
Nevada 775-684-5705
New Hampshire 603-271-3242
New Jersey 609-292-3760
New Mexico 505-827-3600
New York 518-473-5086
North Carolina 919-733-7173
North Dakota 701-328-4146
Ohio 614-466-2585
Oklahoma 405-521-6457
Oregon 503-986-1518
Pennsylvania 717-787-5280
Rhode Island 401-222-2345
South Carolina 803-734-9060
South Dakota 605-773-3537
Tennessee 615-741-7956
Texas 512-463-5650
Utah 801-538-1041
Vermont 800-439-8683
Virginia 804-864-8901
Washington 360-902-4151
Washington DC 202-727-2525
West Virginia 304-558-6000
Wisconsin 608-261-2028
Wyoming 307-777-5860",-0.144659137062,0.88503483267
895,20:11 a direct hit to hillary,-0.14988372434,0.356702334236
896,9:07 i think it is the most famous fly in the world,-0.15304179588,-0.0949446623228
897,Killary = 3. WW,-0.10898611662,-0.0758347263119
898,"Never in the history of this country has there been a political race 
like this. It is a dark day in America when the media and our own 
government help to cover up all the lies, corruption and major 
disregard for the laws that Hillary Clinton has been shoving in our face 
doing anything she can to win this election. No matter how low it is or
how many laws she has to break do so. Hillary will stop at nothing 
including murder to get what she wants. I hope the Americans are smart 
enough to give her what she deserves, which is 30+ years in maximum 
security a Federal Penitentiary. Obama and Hillary are trying to destroy 
this country and its time the American people stand up and take it back.",-0.180383922904,0.287907020801
899,"If you want the US to go to nuclear war with Russia, vote for Hillary. If 
you want peace, vote for Trump.",0.0063819055127,0.0911260054482
900,hillary clinton is a bitch and trump is our next president,0.091536261343,0.332031123343
901,"This is the first time I have watched any presidential debate. Hillary, 
Donald, come over here for a moment. Donald I am not sure about you, you 
are bit rough on the edges but you seem like an honest person. Hillary, 
your husband said it all before you even became important. The fact that 
whole world listens to this instead of focusing on real issues proves a 
point. We have to get rid of dumbs somehow. So I would vote Hillary. JFK 
world does not deserve you so you had to go. Donald if people where honest 
and moral I'd vote you over other candidates but I think so would they 
then. But I am not even U.S. citizen so who cares.",-0.101393264548,0.246611187038
902,*Trump Won.*,0.322302269869,-0.0549137089018
903,"https://soundcloud.com/user-593104302/dread-head check me out lol this is 
more relevant than whatever is going on in this video.",-0.130601535145,-0.093454198622
904,"When you vote, ASK FOR A PAPER BALLOT!!!!! They LEGALLY have to give you 
one if you ask. TRUMP 2016!!!!! Drain the swamp of CORRUPTION",0.342210037178,-0.066281607067
905,"I really don't agree with Donald Trump because he hates black people so I 
don't agree with his political methods",0.151019264132,-0.0915957985293
906,Jill Stein is killing 2 birds with 1 debate;),-0.147584098356,-0.0689328428744
907,I think I puked at least once or twice in my mouth during this video,-0.127911330136,-0.0875062894334
908,Why does Martha look like a frog under a brick?,-0.135314949804,-0.11482169986
909,"The votes this election for Trump will come from TRUMPUBLICANS. This group 
of people are evil or stupid or both. The republican party needs to get 
better or get voted out of any seat in public office. It is a very corrupt 
party. TRUMPUBLICANS is what voters in this election and every election in 
the future need to be reminded of. If any body reading this has access to 
the Democratic party and can make sure voters get this message especially 
in future election to help get back the house and secure the 
senate.TRUMPUBLICANS control the Republican party. Until all the 
republicans that supported trump to the end are no longer in this party 
they do not deserve a vote. I hope this can be a turning point in American 
politics. Where attack ads lose votes of the attackers. TRUPUBLICANS. Can 
some body get this to the Democrats? Reply if you can.",0.0323299693691,-0.078280334762
910,Trump's last hope is to take Hillary furniture shopping:),0.209635069889,0.34706229707
911,"With these 2 dummies running for president, we're all doomed😒",-0.115786442996,-0.10253640195
912,"A prosperous nation is only possible with honorable ministers and 
courageous generals",-0.10898611662,-0.0758347263119
913,America is going down,-0.144516899562,-0.108680589267
914,"Islam does not qualify as a religion. Only fanatics and idiots still 
believe it is.",-0.124594279347,-0.0815264920859
915,Is it a fiction with actors and everything ? This can't be reality.,-0.10898611662,-0.0758347263119
916,These two are soo immature to be a president. :/ good luck America!,-0.164761919315,-0.136264191605
917,"""We're great because we're good."" Wait, what?",-0.153947191604,-0.116783239801
918,I think Hilary and Donald are both a disaster. I miss Bernie,-0.0592533907765,-0.11354081909
919,"Two of the most bland people i've ever seen.. lost interest in politics 
after watching them go on about nothing",-0.142921801345,-0.110132344511
920,This guy will cause ww3 if he gets elected,-0.128119273739,-0.0997509218826
921,"Most of the time, Donald Trump has been making personal attacks a Hillary 
and diverting from the topic rather than actually providing relevant 
answers to the questions asked, during the debate. He's playing with the 
psychology of people (by playing the ""blame game"").",0.11596703531,0.144276348507
922,"His idea of running the country, is making himself look like he matters, 
making himself look like he is wanting to help the little people.or other 
races. He may help other races as long as they are wealthy. He is more 
unfit to run this country then the person we just had in office. We need 
someone who is going to genuinely care about every aspect of our security, 
our liberty, our posterity, our education. Not someone who just wants to be 
in the White house and take vacations, or let the house run the country. WE 
NEED SOMEONE WHO IS GOING TO BE THERE FOR ALL OF US> NOT JUST THE WEALTHY.",-0.147066250315,-0.126458855791
923,"the only way the election is rigged is that the media does the work infavor 
od hillary no doubt.",-0.137815467731,0.170635561703
924,"""When I go out and speak, the people of this country are furious!"" - Yeah, 
they're either furious with your inappropriate, shameless behavior or 
they're racist, just like you...",-0.137168265477,-0.151751058876
925,Alshammri city hail. Saudi I vote for trump. Goooooooood trump,0.421108346045,-0.0697488909686
926,"Let's redo the whole election and get different candidates. They are both 
bad Trump will bring us to another recession and Clinton will take us to 
war with Russia not a great idea.",0.0149076576345,-0.0598606464837
927,"Trump may not be presidential material, but he would be infinitely less 
damaging to the U.S than Hillary...",0.468553455481,0.680456254079
928,"I wish erik harris and dylan klebold were still alive so i could vote for 
them real heroes.",-0.137114868615,-0.0756850907662
929,We are great because we are good??,-0.153947191604,-0.116783239801
930,"I should not have watched the SNL sketches first, this is so painful to 
watch",-0.10898611662,-0.0758347263119
931,"How did we go from being admired by the world to this....,time is up for 
US!",-0.122530393483,-0.093600511481
932,At the time of the war on Iraq didn't trump say hell yeah to it?,0.128617297214,-0.0677071677785
933,"I see how everyone complains that they are both awful and I will agree 100%
If I was american I would just vote for a third party if you don't vote you 
make it worst",-0.146152196674,-0.10266665998
934,"TRUMP IS HILARIOUS, HILLARY IS TRIUMPH",0.468553455481,0.680456254079
935,"(Not a US citizen, just sharing my views after reading a lot about both of 
them) she is toooooo much of a politician! I don't support Donald trump. 
But Hillary is not a good person for the job, US is going to lose a lot of 
money in the coming years if she comes to the office. On the other hand, 
donald trumps hatred and need to earn money might just help. He seems to be 
out spoken which the US needs. US needs someone who will say that 'no i 
dont want to give you money' or 'no i am not going to let you buy my 
companies' (you know what i mean) 
Very very strange that I'm saying this but US needs a business man not a 
politician for the coming 8 years or even 4. 

One suggestion for the people who thinks donald trump is an idiot.
Read about him, watch his old videos and you will be surprised to see that 
he makes sense when he talks. He is not going to spend any money outside 
the US, forget about the nuclear weapons they cost way too much in 
comparison to what he thinks is expensive.

Rethink, who ever is supporting Hillary. This is all marketing, very easy 
manipulation. Dig more before you vote.",0.0906406138575,0.0892364597467
936,"I'm British and the whole thing is like two children arguing over the same 
toy in the playground why don't they stop sniping their opponent and 
actually tell the people of America what THEM THEMSELVES will do if they 
are gave the opportunity to change their country for the greater good . 
What kind of things will Americans be looking for if they choose which ever 
candidate",-0.174734217286,-0.145151470595
937,WHEN THEY GO LOW YOU GO HIGH,-0.10898611662,-0.0758347263119
938,"Can someone please explain to me why they are just concentrating on putting 
each other down instead of presenting their own SOLUTIONS for problems of 
the country. Is it because the American people will choose the one who 
gives worse burns in a debate instead of the one who actually has better 
solutions for the USA's future?",-0.158978883559,-0.110237350872
939,"Trump started the campaign because he saw foolish things happen to America? 
Smh",0.175794389308,-0.110086394046
940,"Really... where is your evidence that Donald Trump is buying the steel 
being dumped by the Chinese to build his houses, Clinton?!",0.29404087074,-0.00668174419302
941,"Mather Rusia loves Mister Trump. Big peace гцссэф no klinton she woman 
woman cooks cleans not president no smart baby yes married yes ok 
ppresjdent no. Pilot no. It's normal trump peace Klinton wuman",0.2189871355,-0.0810160657812
942,Do a paper ballot!!!!!!,-0.10898611662,-0.0758347263119
943,"'Our country is great because it's good'.........
RIP America",-0.179627437196,-0.140159832549
944,Two kids fighting over who gets the last cookie...,-0.10898611662,-0.0758347263119
945,When Hillary Clinton smiles she looks like a clown with gas,-0.152696501443,0.437348990195
946,I think there both stupid,-0.117140741078,-0.0863422724208
947,both are gonna be puppets,-0.116133294338,-0.0844081189468
948,tremendous!,-0.10898611662,-0.0758347263119
949,"Trump actually came out looking pretty good here.. Don't know what all the 
fuss is about.",0.0813841628374,-0.0958788091701
950,Who votes for Trump??,0.84790265652,-0.0568756352702
951,put her in jail,-0.126804864731,-0.0895341304719
952,"Blondie Moderator is so annoying. I feel like a good smack across the face 
would fix that speech impediment.",-0.15392044439,-0.119011357121
953,"This was the strongest debate of Trump, I remember it well, it was a 
landslide, what a statement he made here.",0.309798203144,-0.060783228373
954,"1:58 ""our country really is great because it's good"" - Hillary Clinton 2016",-0.170135392647,0.237543806072
955,Welp. Looks like im moving to Canada.,-0.126037009504,-0.104310040241
956,This is literally people roasting each other in a polite matter wtaf.,-0.150558327289,-0.109561924095
957,This is a joke. NBC is trash.,-0.10898611662,-0.0758347263119
958,Thank goodness I don't live in America now,-0.15621906233,-0.120725708813
959,"Biggest difference between Hillary and Bernie? Bernie would have raised 
taxes to pay for healthcare (lowering premiums/deductibles) education 
(opening the possibilities to a better life) and infrastructure (roads, 
waterways, bridges, hospitals, schools). Hillary will raise taxes to 
continue foreign interventionist and imperialist wars.",-0.144749799732,0.65464357045
