,text,z1,z2
1809,"Both of you need to take a drink of water! It gets old listening to your 
dry mouth stickiness",-0.118906747462,-0.100183736158
1810,That last question tho :'D,-0.117595915008,-0.0940097679795
1811,Trump,0.861805335004,0.0130842666838
1812,and I thought we had dumbest politicians in India. lol,-0.133471211886,-0.115673616683
1813,"Hillary wants to talk about misogyny p, but her bill is worse than Cosby!",-0.156795655619,0.256437945849
1814,"All Hillary does is tell people what they want to hear, not what they need 
to hear lmao.",-0.164969584264,0.172979981514
1815,i hate Tyrone,-0.0953170011754,-0.0960223540879
1816,"Is Russia messing with our election in an effort to get Donald Trump into 
the White House?

The answer is yes.

Trump has repeatedly dismissed the possibility. ""She has no idea whether
it's Russia, China or anybody else,"" the Republican nominee said during
the final presidential debate when Hillary Clinton stated that Russian 
President Vladimir Putin was behind the hacking of Democratic National 
Committee emails. He added: ""Hillary, you have no idea.""
Clinton did have an idea -- the Democratic nominee was correct to point 
the finger at Russia. And Trump, who had received a 
classified briefing on the subject, knew it.
""The U.S. Intelligence Community is confident that the Russian 
Government directed the recent compromises of e-mails from U.S. persons 
and institutions, including from U.S. political organizations,"" the 
Department of Homeland Security and the National Intelligence director's
office said in a statement the first week of October. They added:
""These thefts and disclosures are intended to interfere with the U.S. 
election process.""
Now, less than a week before Election Day, it's becoming 
clear that Russia isn't satisfied with stealing and disseminating email 
from Democratic Party groups. It looks likely our former Cold War 
adversary is also creating counterfeit documents to support Trump's 
baseless claim that the election system is ""rigged"" against him.
""The FBI and U.S. intelligence agencies are examining faked 
documents aimed at discrediting the Hillary Clinton campaign as part of a
broader investigation into what U.S. officials believe has been an 
attempt by Russia to disrupt the presidential election,"" Reuters 
reported on Thursday.
Among the documents that are being examined, the news 
service wrote, is a fake letter from Delaware Sen. Tom Carper, a key 
member of the Senate's Homeland Security Committee. In the letter, he 
tells Clinton he will secure the election for her. Reuters added:
In addition to the Carper letter, the FBI has also 
reviewed a seven-page electronic document that carries the logos of 
Democratic pollster Joel Benenson's firm, the Benenson Strategy Group, 
and the Clinton Foundation, a person with knowledge of the matter said.
The document, identified as a fake by the Clinton 
campaign, claims poll ratings had plunged for Clinton and called for 
""severe strategy changes for November"" that could include ""staged civil 
unrest"" and ""radiological attack"" with dirty bombs to disrupt the vote.
Some fringe right websites have already heralded the fake 
documents, presenting them as legitimate. The possibility of a Russian 
disinformation campaign, with fraudulent documents mixed in with real 
ones, is one reason the Clinton campaign has not authenticated any of 
the DNC emails that the transparency site WikiLeaks has been releasing day 
by day.",0.0159032386423,0.162979171186
1817,If Trump was only a woman....,0.257048042493,-0.0556022252404
1818,I have to go take a Hillary!,-0.221750916177,0.879297328256
1819,i agree,-0.109563040526,-0.0862031851658
1820,Trump seems like the nicest one of them,0.386991460516,-0.0495886304707
1821,Very Good Debate!,-0.147115156535,-0.11564583929
1822,trump win,0.297778896425,-0.0379939223334
1823,"#MakeAmericaGreatAgain

#HillaryForPresident",-0.109563040526,-0.0862031851658
1824,Vote Hillary,-0.194486802809,0.500999480084
1825,"20:10 is what you are here for

thank me later",-0.109563040526,-0.0862031851658
1826,"I really hate Donald Trump, sexual assault is not OKAY. Its not just Locker 
Room talk, YOU PERVERT",0.132662481599,-0.0863075633664
1827,"I can't stand this bitch. blaming Russia for the 4 year old kid when she is 
part of those who created the war and Isis.",-0.120065091042,-0.0867112025686
1828,"well I don't know Trump if make America great again but I'm pretty sure 
Hillary will make world worse.because Hillary is a lying selfish bitch",-0.036633955572,0.264897641664
1829,"Okay: who's gonna win next week? 

I think Hillary will.

Annnnnd go.",-0.158073393729,0.215901960087
1830,"im only 6 minutes into this and how he responds to sexual assault is locker 
room talk and avoids the question saying i will fight isis. what u say and 
do is who u are. im gonna start crying because im screwed for 4 years and 
im either not gonna be allowed to have a scholarship because im 
black/female or im gonna be robbed.",-0.128181054085,-0.0953894260524
1831,"This country  was founded on the word of God. What about Christian 
Americans and Americans? I saw a picture on Facebook of a beautiful white 
Anglo boy with blue eyes so badly beaten by a Muslim. This is an English 
Christian speaking home first, Hispanic, African American and native 
(Navajo land) to much recognition is given to Muslims",-0.144211515821,-0.130641650054
1832,"You know it would be really nice if either side actually just answered the 
questions asked, instead of just spewing a bunch of irrelevant garbage. I 
should've bought that property on the moon next to John Travolta 
damnit..........",-0.139368727271,-0.120910034998
1833,"Hope trump wins. Highly respect for successful business owner. The other 
one can't hold up a peace-loving-family. And.. she's an unprofessional 
politician doesn't even give a sh**t about basic work routine..she won't 
respect anything in this whole world it's clearly proved. It's positive 
Trump got the motivation and determination taking constructive idea into 
real action. That's it.",0.173879541503,-0.0660941243915
1834,"they are FRIENDS folks, stop lying to yourself. Trump IS LIBERAL",0.261392272431,-0.0463720577489
1835,who's voting for hillary clinton,-0.165701092883,0.360426983682
1836,The sad truth is neither of these two people are fit to be president.,-0.120312632622,-0.132051497711
1837,vote Hillary please she is nice and polite let her win please god please,-0.160705848939,0.18488990371
1838,If Clinton wins pack up your things boys America is gone.,-0.124233590732,-0.0679396167423
1839,Haha 3:36 wow trump i thought u hated clinton :l?,0.397872130315,0.0671025404614
1840,Donald Trump makes more sense. hillary is a liar and a hypocrite,0.313901925538,0.393531282858
1841,if Donald Trump is president im gonna wear a saftey pin,0.174893093658,-0.0662326665127
1842,"Hillary was not once interrupted, how come Donald J Trump was many times..?",0.210492248799,0.274811699753
1843,BURN🔥🔥🔥@ 20:14,-0.109563040526,-0.0862031851658
1844,"Being openly investigated by the FBI and clearly a closet racist, how does 
mainstream media keep defending Hillary?

http://www.snopes.com/clinton-byrd-photo-klan/",-0.145115317263,0.217984346721
1845,"Look at Ken Bone in the background, what a lad.",-0.120762328108,-0.0934081486103
1846,This is the best Cringe compilation I've ever seen.,-0.117848852729,-0.100867078178
1847,1:24:50 NOW ENTERING THE BONE ZONE,-0.109563040526,-0.0862031851658
1848,"love how the moderators were trying to keep the audience quiet, everytime 
they were booing hillary.",-0.159143908418,0.36339656137
1849,"20:10

because you would be in jail",-0.109563040526,-0.0862031851658
1850,you can tell Anderson doesn't like trump.,0.206714863189,-0.0681716380418
1851,Trump kicked azz,0.861805335004,0.0130842666838
1852,0:50 Who`s that bitch on the left of President Trump ?,0.402177519051,-0.0611515069945
1853,"judging from these comments i'd deduct trump is going to win... but let's 
be real... even though trump propably gets the majority of the votes, 
crooked hillary will still win the election.

Also her permanent unjustified, stupid grins annoy the hell out of me... 
she does not have the upper hand in the argument and her grinning is not 
changing that.",0.132099387585,0.112868731602
1854,"When they told Trump ""let hillary finish, she didn't interrupt you."" That's 
something I'd say to my kids.....what the hell is this toddler show...(and 
no I'm not supporting hillary, I just found this hilarious).",0.0318714622876,0.465611728291
1855,I'm scared.,-0.109563040526,-0.0862031851658
1856,trump doesn't believe in climate change. that's a big no no,0.119211150021,-0.0717819680936
1857,I freakin love Donald Trump's expression on his face all the time.,0.172349044982,-0.0581664360062
1858,1:24:01 - fly-spy sat on Clinton!,-0.119649404323,0.0324924866253
1859,"At 1:32:03 He tells it like it is. And he does, without the bullshit.",-0.127927913649,-0.100531786447
1860,its true bill clinton abused women,-0.116511257696,-0.0279900397992
1861,I hate that creepy smile :(,-0.0953170011754,-0.0960223540879
1862,"""she doesn't quit, she doesn't give up"" 1:32:01Trump are you paid or dumb ? 
When she was seeing so weak, a zombie with brain injury, now you just tell 
people she is strong and clever and you insist: 'I respect that'. F- king 
rigged election.",-0.122716453811,-0.118637466275
1863,"Hillary is typical politician. Nice words, talking what Donald did, again 
talking what could be better... she is getting boring",-0.114489100047,0.11983262871
1864,Shay Carl for president 2016!,-0.100067301728,-0.103283582419
1865,"I know its to late to say this but the people how pick the present it 
should of been Hillary because she's not disrespectful and she is more 
nicer",-0.171899372753,0.235696969319
1866,"why is donald trump keep interupting hillary?. she never inturuped trump. 
-_-",0.541001250659,0.355472175862
1867,I won't vote for Hillary.,-0.146587612083,0.33336069059
1868,terorrist state? what state??,-0.109563040526,-0.0862031851658
1869,"I think their only problem is,trump was being too harsh sometimes while 
clinton is being too soft,being involved in politics can't be too soft,cuz 
it'll only lead them to chaos,being nice is ok,but on some cases she needed 
to man up a little bit ya know,i respect trump's big ambitions on making 
america great again,i also think his way talking is more convincing than 
clinton because he had that confidence,and again,there's also some 
unnecessary things that he shouldn't have said,because it can made some 
people really angry and that's also not a good thing,people might come up 
to him,who knows? anyway,no hate,it's just my little opinion,we all already 
know who wins so....i like pizza",0.0186783570814,-0.0885447084927
1870,"The left wing media though they could win by crying rape, but middle 
America is more interested in the jobs her, BJ Bill, Bush, and Obama are 
hell bent on sending overseas. Maybe in New York and San Francisco sob 
stories about trannies not being called the right pronoun get traction, but 
the rest of America who hasn't been infected with big city liberal values 
doesn't care one bit.",-0.138229067661,-0.122130568789
1871,I don't like trump but he is a savage,0.230421942285,-0.0744751678819
1872,"Trump has to be the dumbest person to ever get this far in the US political 
system... except maybe George Bush",0.261368604565,-0.0539116732979
1873,"If Donald Trump becomes president, his gonna be assassinated.",0.235764088394,-0.0618880758451
1874,"his whole campaign was collapsing because of the tape about his lewd 
comments and he still showed up and still he pulled victory, this man has 
the heart of a lion.",-0.112695683337,-0.101510020821
1875,"I can't believe that these two are the only choices we have to vote for to 
run this country in such turbulent times.
God is our only hope more now than ever.",-0.139471776419,-0.105189852355
1876,"Someone please use their brain and put Hillary in prison already. Anyone 
that did a fraction of the crimes she committed is in jail for life, but 
she gets to run for president?? Many of her supporters know what she did, 
but all they care about is one semi-bad word Trump used many years ago.",-0.00809729989797,0.0882272968185
1877,"send clinton to prison and end this soap opera, this is so typical of 
america, just throw that killary bitch in prison for eternity so we don't 
ever have to hear her lie to us anymore!!!!!!!!!!!!!!!!!!!!!!!!!!!!!!!",-0.151526184611,-0.094124907752
1878,"Democrats always smile, what a lie, in and of itself. What they do in 
government is anything but a smile! Democrats what nothing but POWER, they 
are democrats BEFORE patriots!",-0.114333539659,-0.0955814569498
1879,Karl Becker!,-0.109563040526,-0.0862031851658
1880,TRUMP 2016,0.271693719494,-0.0475105584911
1881,"Let the guy talk jeez 
Like I know there is a time limit but still",-0.13782090202,-0.107804050353
1882,mother in law from hell vote for that not,-0.131423183112,-0.0778643131316
1883,"they both point out each other's Mistakes and Problems !
So we have to select one which is more worse ?",-0.109563040526,-0.0862031851658
1884,Make America great again,-0.136196174672,-0.138479789164
1885,"1:07:30 unintentional pun ""That would be a Syria-s mistake.""",-0.109563040526,-0.0862031851658
1886,KEVIN BONE!!!!,-0.109563040526,-0.0862031851658
1887,"They are both pathetic, it causes me pain only to watch it. All they can do 
is spitting dirt on each other and insulting each other in a very low way. 
Disgusting, disgraceful, sad. Whoever wins, the US lose.",-0.11066608256,-0.0888749371663
1888,"both would be a catastrophy for the US and the world. hillary doesNt mean 
Anything she says, trump im afraid Does mean Everything he says...this 
whole election is a sad joke and the world is laughing at You america :S",-0.0330396224621,0.0593037975131
1889,"this is so cringy, they keep pushing away the subject and hate on each 
other instead of showing their strengths, we're screwd guys",-0.0953170011754,-0.0960223540879
1890,"I'm Russian and I live in Siberia. Here is snow everywhere. I write to you 
via a soviet calculator ""Искра 122"". I was able to connect it to the world 
lines of the proletarism and the Orthodoxy. And now I can write to you 
tovarischi. And that's why I received threats from commies. They want to 
send me to the Gulag ""Архипелаг"". They want that me to mine uranium in 
siberian mines for bombs fo fight against the Yankees. But I don't. I wish 
that I was a bird and can to fly to America to freedom and my dreams. Help 
me, pozhaluysta. If you see it send it to Obama and all american medias. 
Spasibo....",-0.153367313871,-0.129175695173
1891,"pretend for 10 seconds a demon is wearing hilary clintons skin and donald 
trumps skin, pretend they are a fallen angel deceiving america, look into 
their eyes ,pretend their satanic and bringing about a nwo think about how 
they look. pretend their a cocky demon that knows no one will believe a 
demon can be a president . look into donald trumps soul and hilarys soul 
and you will see how evil it is just look at them long enough seriously 
demon in human skin wolf in sheeps clothing. LET GO OF YOUR DOUBTS JUST FOR 
15 SECONDS AND LOOK AT THESE PRESIDENTS AS PUPPETS AND DEMONIC BEINGS. look 
into their souls theirs no real human soul there..................i can see 
it can you?",-0.108946356786,-0.119339281294
1892,there answer are so irrelevant to the questions asked by ths audience.,-0.129058745155,-0.0860516115852
1893,i vote for hilary clinton !!!!!!!!!!!!!!!!!!!!!!!!,-0.134853212622,-0.0578291072343
1894,if this women becomes president prepare for global war,-0.114335327933,-0.106828360685
1895,low level presidential debate,-0.15087148249,-0.105640811752
1896,"hello homosapiens i am from your distant future i am here to tell you none 
of this matters",-0.109563040526,-0.0862031851658
1897,Google Hillary Clinton Palestine,-0.178731600341,0.506199143482
1898,"both of them sound like a couple of spoiled winy brats fighting over the 
last cookie (cookie being the presidency) if ether one gets elected this 
country will go down the tubes. Might as will pack for Canada.",-0.139436645075,-0.121170999155
1899,;/,-0.109563040526,-0.0862031851658
1900,"I have Obama care and let me tell you it is the best care anyone can have 
who can't afford anything and I do mean. I am 26 years old and for 12 years 
after my mom lost her job I was not able to get health care because they 
either said she made too much, she made too little and/or I was too young. 
Obamacare makes it possible for people like myself 2 get health insurance 
for your list of what the status is of my income. I work 2 and 3 jobs I get 
minimum wage or lower and I still cannot afford health care if it wasn't 
for Obamacare. if you Republicans think that we Lower Class People are 
going to let you take away something like this you're out of your freaking 
minds. it is simple Republicans you want the White House make Healthcare 
affordable for lower-class Americans find ways to improve our security fund 
our schools and our colleges and will give you the White House on a silver 
platter",-0.140109036031,-0.118255066364
1901,I'm not the puppet your the puppet,-0.109563040526,-0.0862031851658
1902,"""Only ones that have seen them"" Apparently not 
https://twitter.com/wikileaks/status/793101331707858945",-0.109563040526,-0.0862031851658
1903,"""I love deprecation"" 😂😂",-0.105914763741,-0.0916446595231
1904,"MUST WATCH NOW!!! ---- :""NO POLITICAL ASHES"" ----- The most unique Trump 
video on You Tube! BAR NONE",0.861805335004,0.0130842666838
1905,he is,-0.109563040526,-0.0862031851658
1906,Hillary,-0.221750916177,0.879297328256
1907,Hillary Clinton I choose you to help my land reach its goal thank you..,-0.178731600341,0.506199143482
1908,Hopefully Bernie is still kickin in 2020,-0.109563040526,-0.0862031851658
1909,im nt an american but trump makes sense afterall....,0.153977830361,-0.0735648481513
1910,i voted hillary,-0.221750916177,0.879297328256
1911,"HELLO,my FRENCH ( BRETONS) good election et good présidential .....?",-0.127184713601,-0.109206187222
1912,"Trump is just gathering nothing but lunatics and racist around him. Those 
idiots would support all kinds of crimes and bullshit from that sexual 
predator trump.",0.298430915755,-0.0764876433557
1913,This isn't pr0n hub. We've never seen Trump rape women xD,0.273574977321,-0.0569683402461
1914,trump won legaly?,0.331158365586,-0.036510007553
1915,Michelle should've ran for Democratic nominee,-0.109563040526,-0.0862031851658
1916,Trump's winning bitch!,0.861805335004,0.0130842666838
1917,"His offspring should be embarrassed and ashamed to be a part of trump the 
babbling idiot!!",0.861805335004,0.0130842666838
1918,Hillary clinton is more perfect,-0.178731600341,0.506199143482
1919,"Hey,America!She said ""boy and girl""!Extreme not-pc-rudness,she's to be 
banned!",-0.139595186662,-0.119786255094
1920,Go trump,0.861805335004,0.0130842666838
1921,https://twitter.com/bebop8188/status/796114639276961792,-0.109563040526,-0.0862031851658
1922,FEELS LIKE WATCHING A REMAKE OF ALIEN VS PREDATOR,-0.130536161625,-0.113739948502
1923,Hilary is BAE,-0.122091973219,-0.139444047752
1924,Hillary Go!,-0.221750916177,0.879297328256
1925,nan,-0.109563040526,-0.0862031851658
1926,"https://www.change.org/p/electoral-college-electors-electoral-college-make-hillary-clinton-president-on-december-19
",-0.16408131159,0.337871198883
1927,Daddy Trump for the win!,0.297778896425,-0.0379939223334
1928,Go Donald trump,0.41599115366,-0.0225654244227
1929,#FuckDonaldTrump,-0.109563040526,-0.0862031851658
1930,usg,-0.109563040526,-0.0862031851658
1931,ITS GAMEOVER MAN ITS GAMEOVER WHAT THE F ARE WE GONNA DO!?!!?!!?!!,-0.117573478372,-0.102340863426
1932,if hillary and donald trump both die who'll be the president? (not a joke),0.261077186303,0.317848167216
1933,TRUMP PENCE 👍,0.861805335004,0.0130842666838
1934,Cmon Hilary. Hilary deserves to win ! :-),-0.120224803339,-0.130341634262
1935,"I write through the Google translator from Russia
You need to choose Donald trump!
If you choose Hillary Clinton that have to fight with Russia. Clinton will 
lead you to war, and then in Your city will drop a nuclear bomb. Want it? 
Russia does not want to fight. Trump is a good man who will bring us 
prosperity and peace in the world",0.0635080317434,0.098119763939
1936,"Hillary's campaign was for everyone except average Americans. That's why 
Trump won. At least a lying, crooked politician did not win. God bless 
Donald Trump in his effort to Make America Great Again.",0.195466793709,0.0963290895202
1937,16:51 her face when shes caught in a lie lol,-0.1305040106,-0.0995113257643
1938,"20:16 is where the bombshell drops...
What a co-incidence.",-0.109563040526,-0.0862031851658
1939,man what a clownshow....,-0.112695683337,-0.101510020821
1940,"Vote Trump? America we need to take our country back from these corrupt 
politicians. Hillary Clinton is the most corrupt candidate of all time. 
Don't listen to the media they are all liars.",-0.0309098237341,0.128115540596
1941,Trump trump,0.861805335004,0.0130842666838
1942,"Please vote for trump. He is Americas only hope to a stronger, safer 
country.",0.102115905143,-0.0742397927256
1943,"White hair dude "" Have u Sexually assaulted women ?"" ,,, Trump "" Im going 
to defeat Isis im going to make america great again"" .....",-0.00855637187124,-0.103459486406
1944,"""Cause you'd be in jail"" mic drop",-0.109563040526,-0.0862031851658
1945,"20:16 ""Because you would be in jail"". Boom! he won....",-0.0774563909767,-0.0777928855793
1946,Donald trump Donald trump,0.41599115366,-0.0225654244227
1947,"two cheeks of the same backside....either way Americans will get screwed 
hard without lubrication",-0.125744387818,-0.108077100489
1948,"this is what America is facing now, folks America is trying to decide which 
of these turds dressed up in business suits is more capable of running the 
damn country? the people of america is trying to see which part of (💩 <--- 
this) is more bare able to swallow, is it the side thats facing up that's 
baking under the sun or the side that is facing down that sticks to the 
ground which stay nice and moist? wow when it comes to thier candidates 
they're really full of shit!!!",-0.152549172385,-0.149204067077
1949,9:20 Roasted!!,-0.109563040526,-0.0862031851658
1950,Hillary destroyed trump stupid ass,0.166040737907,0.360159121597
1951,"I'm in England so I don't really care but this sounds like two old angry 
people trying to model America in there weird world war two racest way's",-0.149392000399,-0.136546037284
1952,Yeah. She needs to be vetted. A long time ago.,-0.120500009205,-0.106237479021
1953,"I have to laugh he is stating at hisi rally that Hillary was exhausted 
after the debate, he is the one that looks ragged.",-0.205829740152,0.429325660934
1954,20:16 will go down in history,-0.109563040526,-0.0862031851658
1955,october 29... almost november D: almost elections,-0.109563040526,-0.0862031851658
1956,why do they do this to us? Savages!!!!,-0.109563040526,-0.0862031851658
1957,"Honestly, I'm only 16 minutes in, and i don't want to watch the rest of 
this. They're not answering the questions!!! This is like childish banter. 
Oh i did this? Well look what you did! What I did? Well you said this! 
Hillary is ""chattin"", she's not getting to the point, Donald gets off topic 
purposely; you tell me what ISIS gotta do with you touching women. JUST 
ANSWER THE QUESTION!! Trump and Hillary aren't suppose to be speaking to 
""each other"", ya know? yet Trump just can't shut his mouth so they can get 
to the next question!!!! Just shut up!! omg xD I'm pissing my pants; I'm 
scared smh",0.0115777060365,0.106192681405
1958,"If i could vote, then i would vote for


Read More",-0.131423183112,-0.0778643131316
1959,BANANA FOR PRESIDENT!!!!,-0.108969724908,-0.118196529524
1960,"Im French and trust me, the medias here, are as much as disgusting and non 
neutral as in your country sadly.. 

Medias are insanely discusting all over the world.",-0.141184409133,-0.11218403659
1961,"Of the two evils, the lesser evil is Trump...
This pathetic, arrogant biatch if becomes the president, we're definitely 
screwed...",0.402177519051,-0.0611515069945
1962,"Credit to that last guy for asking a question that makes the debate 
slightly less toxic.",-0.141349126856,-0.109078568106
1963,KEN BONE FOR PRESIDENT 2016,-0.100067301728,-0.103283582419
1964,"cnn=crap news net, abc=another bullshit channel",-0.109563040526,-0.0862031851658
1965,"For the coming US election, it's quite simple the choice you have to make. 
If you want to see real change with a better economical environment you 
vote for Trump, if you are very conservative and don't want to see big 
changes and want the same elite at the top, you vote for Clinton. And most 
importantly, don't make your choice based on the media, because the media 
is also controlled by this elite. The media has taken one side in this 
election, since the very beginning. And whatever they can do to hurt the 
Trump campaign, they have done it.",0.0154583116405,-0.0729760997645
1966,I'm great because I'm good.,-0.12509720767,-0.118113841491
1967,Donald trump is the next musolini and hittler mixter,0.41599115366,-0.0225654244227
1968,"just a simply question from an italian seeing all this tomfoorely: where 
are the other candidates? is this that ""democracy"" America pretend to teach 
to others? how media work in Usa????",-0.137981125698,-0.125462525459
1969,I can't stand Hilary's dumbass smile,-0.122091973219,-0.139444047752
1970,Trump is just a charlatan and a women abuser.,0.205788203765,-0.0882481382456
