,text,z1,z2
2609,"Only stupid americans believe this democracy nonsense- voting for two 
puppets of wall street. Did I say americans are stupid?",-0.129811083493,-0.107306315756
2610,"Never mind Donald is vagina maniac who loves touching dog vagina, cat 
vagina, rat vagina then loves licking his hand.",-0.000602792177416,-0.0686120215218
2611,"I was sent an email that contained replys to a Sarah Trachtenburg comment 
titled...Trump is disgusting. I don't know why anyone...I tried to reply 
but my email was not delivered and was sent back to me. And since it had a 
You Tube address I am sending it from here. This was my return 
comment...........With everyone inside the Beltway not giving a damned 
about the everyday 
persons outside the Beltway, and with Secretary of Crime...err I mean 
State being more corrupt than any person to ever run for the Office of 
President Of The United States, it is and was inevitable that someone 
other than established politicians would run. It was also inevitable 
that they would win. Why you may ask? Or not. Because more and more 
citizens of this country have become disgusted with the way The United 
States is going. Progressives, eie the party of Woodrow Wilson, FDR, 
Truman ect did not and do not believe in the Constitution and Bill of 
Rights as a living and just as important document as it was in the 
founding of our country. Little by little, because we do not pay 
attention, we are having our freedoms taken from us. Our short attention
spans will be the destruction of our country as we have known it in the
past. Progressive thought is that the government not only should but 
has the right to involve itself in our live by taking responsibility for
things the Constitution and the Bill of Rights did not give it 
permission and in some cases out right forbid it to do or take. What we 
saw happen in this election is a direct response to a government out of 
control. Americans are waking up. It had to happen sooner or later and 
sooner is best. It is people like Sarah Trachtenburg that think that 
electing a 
person like Clinton is ok even if she is corrupt, a traitor, a betrayer 
of employees of her own department, Benghazi, even if she furthers her 
and Bill's own fortunes off of the relief funds headed to victims of 
terrible events in this world. Even if she has no care for slain 
Americans and can go before Congress and say, and I quote, ""What 
difference does it make."" And even if she can lie through her teeth and 
everyone knows she is lying through her teeth. Have you ever wondered 
why many people who have crossed her are no longer heard from or around?
Yes it is those like Sarah who will be the death of freedom in this 
country. I may not see it. I am 63. But my 20 grandchildren will pay for
our folly and this is Truth.",-0.108388708341,-0.132295523496
2612,"if you see hillary do her joker smile you know she is about to LIE. what a 
warped twisted woman, God damn she is evil",-0.169687267218,0.198773076192
2613,"All I have seen from these debates is that Jesus is coming soon!!! Let 
Christ be our hope and not who is going to be the president. ""For God so 
loved the world that He gave His only begotten son, that whosoever believes 
in Him should not perish, but have everlasting life"" John3:16.",-0.127897046751,-0.114590582891
2614,"a lady leader signifies the downfall of an empire/country. history has 
proven this.",-0.139150537037,-0.117104391622
2615,"How come people have assassinated great presidents (Lincoln, JFK) BUT no 
one has even thought of getting rid of him.",-0.126027343206,-0.120647187461
2616,"Donald Trump =WW3, better get back into training. 💪🏽🇬🇧",0.292618101786,-0.0349780469234
2617,"Trump is gathering the worse of human kind for himself. He wants all the 
lunatics by his side. Just the most evil and the most hypocrite people 
would support his stupidity, his racism, his narcissm, and his bigotry.",0.105732963979,-0.0858963933077
2618,"Nobody should vote for a racist and a bigot like trump, and no woman should 
vote for a sexual predator and a woman abuser like him.",0.00625044986385,-0.0941649845905
2619,"THE COUNTRY IS ""21 TRILLION DOLLARS IN DEBT WHICH WILL TAKE OVER 140 YEARS 
TO REPAY.., HILARIOUS WILL ADD ANOTHER 21 TRILLION WITH NO END IN SIGHT, 
SHE WILL CONTINUE TO RUN THIS COUNTRY FURTHER INTO THE GROUND.., THE 
CLINTON ADMINISTRATION IS RESPONSIBLE FOR N.A.F.T.A. WHICH IS AT TOP OF THE 
LIST OF REASONS FOR OUR LOSS OF AMERICAN JOBS AND THE SLOWEST ECONOMIC 
GROWTH OF ONLY 1%.., WHICH COMPARES LESS THAN THAT OF MANY THIRD WORLD 
COUNTRIES!!! (""SAD FACT CAUSED BY TGE CLINTONS)""",-0.147119905435,-0.091788732563
2620,I still cringe thinking how close this country came to electing this witch.,-0.139150537037,-0.117104391622
2621,Hillary's last stand and hopefully she will just dissappear.,-0.190361138962,0.474019908052
2622,"Everybody says to vote Donald trump because of Hillary and the emails and 
the campaign and funding ,well please excuse me but if you didn't know 
Hillary has had experience in being a Secretary of State ,and Donald only 
has had experience in having a tv show .Do you want to live in a country 
where someone who entertained you has control over nuclear weapons and has 
a mouth that spits anything it can?which can have consequences . :D",0.0461381486635,0.285887381538
2623,"Glad Trump won, can't stand Hillary, I hope she gets breast cancer.",0.135018940366,0.284443189882
2624,"Hilllary looks like she is listening to someone, the way she talks, and she 
is quite good at it, So happy she lost",-0.128109957212,-0.113130611683
2625,i hope this man donald trump will NOT BECOME PRESIDENT,0.192324859067,-0.067403005403
2626,So who won this debate?,-0.113452258025,-0.0930010984425
2627,"Hey Chis Hansen, please bring back your show ""To Catch A Predator"". We have 
one more clown to catch and put away",-0.109563040526,-0.0862031851658
2628,See ya bitch. hahahahahaha!,-0.109563040526,-0.0862031851658
2629,"I'm from Britain and I'm gona be honest these are not the best presidential 
candidates but there is one that is a lot better than the other, Hilary 
Clinton she is the better option she will probably not make massive impact 
but she will definitely not make negative impact like the likely chance of 
Donald trump is having.",0.0465569247669,-0.0698834220485
2630,thanx john podesta ;) hah ha ha,-0.109563040526,-0.0862031851658
2631,"If I could vote, this time I would not even go and vote.",-0.133918567881,-0.089538987747
2632,"Believe me , all the Democrats and Republicans have made a great 
contribution to make up their country of United States , Go ahead Donald 
Trump like the previous leaders of this great country, Although I have 
never been to America but I love its language , culture and history. In 
comparison with our country of Morocco, there is AHUGE DIFFERENCE IN MANY 
DIFFEs
RENT ANGLES econmically and in many different ways, people are still 
suffering more and more. Please do not compare America with other different 
of the world. United States of America is always great and will be great 
for ever. lONG LIVE American",-0.0610417499362,-0.141435874461
2633,This is all I wanna say...enjoy having Trump as president😂😂😂,0.227023277475,-0.0709311425997
2634,"Republican voters don't want Hillary because they don't think she's a good 
politician. If it's a good politician they want, then why in the primaries 
did they vote for Donald Trump, guy who is not a politician and has no 
political experience to say the least? Marco Rubio was a lot more qualified 
to be president than Trump, so was Ted Cruz. Hell, even Jeb Bush was more 
qualified. What honestly made people believe that Trump was more qualified 
than the other Republican nominees?
Voters have said that Trump talks just the way they do. That's because 
Trump's not a politician just like most of the voters aren't. They don't 
know things work in office. And if Trump becomes president, he's going to 
find out the hard way how things work and is going to realize, very 
quickly, that he's in over his head and that running for president was a 
huge mistake. If Trump realizes that he's in over his head, he's not going 
to resign even if he's advised to because he'll tell his advisors, ""No, if 
I resign then everyone is going to know that I couldn't do this job and if 
that happens, my image will be ruined."" To people like Trump, their image 
is more important than the well-being of the country.",0.261540466648,-0.0296708447253
2635,Let's protect the American Dream!!! Trump!!!,0.169528247655,-0.0759063411059
2636,im not from america but i hate Clinton +i hate america,-0.125304310685,-0.0944890144872
2637,He speaks on a 7th grade level.,-0.109563040526,-0.0862031851658
2638,go Hillary go go,-0.221750916177,0.879297328256
2639,"just love it ehen she laughs and smirks like a fckin delusioned little 
schoolgirl,not laughing now hahahahaha trump trump trump",0.534788060257,-0.0468798569567
2640,1:28:40 savage... I died laughing,-0.109563040526,-0.0862031851658
2641,"Leader Trump

When the word, “leader”, goes through your mind, do you think of a man or 
woman? Obviously, a woman can be just as or even more manly than a man can 
be. But image is very important to our enemies way of thinking which leads 
to their decisions. Trump is only going to do good things to our military 
and create a GREATLY, assertive image upon our threats. Security is a 
beautiful thing and will keep so much stress away from our minds.

With being president comes great power and with great power, Trump knows 
good and well about great responsibility. Donald Trump seems to have a good 
perspective of responsibility. He has already proven how responsible he is 
with his decision making as a business man. Just from impressions, it might 
seem that he makes risky decisions but within the past decades he hasn’t 
showed us anything but success and extreme productivity. Trump may be 
drastically different, but that also means that he is an ,outside of the 
box, thinker, for example, “He tends to buy properties that have less of an 
upside if they also are a safer choice (i.e., less downside).”.

America’s debt simply and literally needs conservation because of all of 
our investments being made in the last 2 terms. Trump is only bringing 
notice to the most effective problems that don't try to focus on as many 
people’s feelings as possible. He will not make ignorant decisions because 
he has gained more than he has lost from bankruptcy and gained an unlimited 
amount of resources to make him all around successful. Donald Trump has 
proven that he is active and willing to put in work because of his rapid 
amount of trial and error.

Every penny counts as Donald Trump just wants to save/make money along with 
growing our economy more efficiently than ever before. He has a plan to 
reduce most taxes. Trump is tremendously serious about calculations to set 
his goals higher than most people are ready for. Because of most people 
thinking that taxes are inevitable, they just assume that we will lose so 
much money if we cut them but if Trump becomes president I strongly believe 
that money will be one of the least of our worries.

Currently, among our peers and media, we see how Trump supporters just do 
not “fit in”. All the youngins these days just won’t open their mind up a 
little because they never imagined him and his different ideologies 
proceeding in politics. Our fairly new generations don’t understand how 
Trump is the actual republican candidate. Our media has convinced so many 
people that Trump is the most unsophisticated choice, therefore, they also 
want to convince more people to not vote for Trump. This, of course, leads 
to making many republicans feel that Trump just can’t be an option because 
of the pressure other peers have put on them.",0.398360895214,-0.0893385230609
2642,free college is stupid if your smart enough then you get a full scholarship,-0.116491198369,-0.0929408638705
2643,"oh well....I am a American citizen for 58 years and well I will NOT BE 
VOTING.....",-0.126643290568,-0.10659881462
2644,"We are in debt why don't we just print more money are we out of ink are we 
out of paper what a big joke",-0.126009587411,-0.115535080439
2645,"Trump is totally correct.... Heroin is rampant in Richmond VA and we must 
stop this! We have to stop this epidemic. Please!",0.0869209105464,-0.0640912499876
2646,"A vote for trump is a vote for racism, for Putins dictatorship, and for 
sexual predators.",0.0891615728396,-0.0706243073489
2647,"Notice how she looks down when talking about ""Haiti""..and how much she 
contributed she's so full of lies can't even looks straight on the cameras 
or in the audience or host's eyes..Pathetic!",-0.114677521747,-0.0831607182904
2648,good,-0.122067174444,-0.108350752491
2649,TRUMP#2016,0.271693719494,-0.0475105584911
2650,"Am I the only one who is annoyed by the fact that Trump's mic is uneven 
when Hillary's is perfect placed in the center?",0.401568860426,0.734817510083
2651,"congratulations madam,your a winner....",-0.109563040526,-0.0862031851658
2652,Hillary Clinton makes more sense than Trump.,0.141536176488,0.506222440074
2653,"Please take the time to read this, like to show that you still care




If you have any emotions as a human left, don't vote for trump. I am 
Hispanic and my parents came from Mexico because they had to look for a 
job. They were separated from their grand parents and parents for many 
years, and now their grandparents can't even come and visit us, not even my 
uncle! My parents will end up being deported leaving me, my sister and my 
pet helpless with no food, water, or money. I may very likely be spending 
my time living in my school. That's not all, over 5,000,000 kids will be 
left alone with no one to help them. Even if we do get help, we will still 
be separated from our loving parents. And over 300 people have said that 
they will commit suicide if trump wins. Not to mention the other deaths 
caused by homeless children and innocent immigrants who have lost 
everything they have worked for. My mom has worked for Allstate for 13 
years and has recently opened up her own agency with Allstate after 4 years 
of school, traveling, and work. My dad has helped many Americans with work 
and projects as well not criticize anyone even if they are racist, 
American, or African American. My mom tries to save lives and supports many 
organizations and has donated thousands of dollars to programs trying to 
save lives.Also think about it, Abraham Lincoln tried his best to keep this 
country together but got killed for his efforts.Martin Luther King Jr. not 
only helped fight for equal rights for African Americans, but Mexicans, 
Hispanics, Muslims, women, and other immigrants who were struggling getting 
a better life.Do you really want a president who is a racist jerk who only 
cares about his own personal gain? I do agree that there are some bad 
people that do some bad crimes, but you don't see trump putting all the 
American criminals and serial killers in jail! Choose what is right. The 
fate of America and millions of lives rests in your hands. You can be a 
hero or a villain. You hold the power. Choose what's right.



#DumpTrump #HillaryForPresident",0.00524863593834,-0.135535735617
2654,I hate trump he is rude just hear what he says,0.140347774266,-0.0874633824724
2655,great,-0.119084696349,-0.109176547069
2656,"Donald and his people are wrong about everything, cause they are lieng 
about everything. They are just hypocrites, racist, bigots and idiots.",-0.071210130096,-0.121261245714
2657,"That sexual predator trump is just a russian agent who has corrupted even 
the FBI.",0.20440200398,-0.0942592489424
2658,"Trump literally treated Hillary in this debate as both a bitch... and a 
punching bag...",0.18720486065,0.426438094862
2659,LOVE IT! HATE that lying bitch.,-0.0969938006126,-0.0969590679723
2660,TRUMP IS A RAPIST! - AND HE'S NO GOOD FOR THE ECONOMY!,0.308897142475,-0.0621474307677
2661,"Hillary said and leaked classified information that there ""4 minutes to 
launch Nukes"" IDIOT!",-0.175593688419,0.396019017575
2662,"Trump is an idiot with no wisdom. He even brags about being a sexual 
predator.",0.266434431248,-0.065482356924
2663,"That trump and his supporters are just idiots supporting charlatans, a 
women abusers, and a sexual preadators.",0.141031713611,-0.0992193125428
2664,"It's kind of hilarious how almost exactly 20 minutes in Trump starts to 
lose the grownup act and reverts back to acting like a jittery 5 year old. 
He can't even sit still for half an hour. It's awesome that he's going to 
be sitting in a room for hours negotiating with world leaders, making deals 
and defending our country. Thanks America.",0.0479964910993,-0.116178416613
2665,"sort out your nation institutionalizing racism, and stop allowing African 
AMERICANS to be gunned down in ghettos or in high streets by cops!",-0.119244482822,-0.100049709983
2666,"when i was little my mother showed me how many countries in the world were 
painte d pink in our atlas, the colour of countries that were part of the 
British empire where represented as pink and an awfull lot of countries 
were pink. I am sixty two years old, so that was more or less fifty five 
years ago, since then it has definately been North America who kept peace 
in the world, that is NOrht America has been great since the Kennedy's, a 
bit before, till now, still is the main power in the world, that is when 
America has been greatn much as for many americans other parts of their 
history seems to tbe the great ones. Greatness brings with it actions 
people question, such as Guantalamo,however who can doubt it, America is 
still great, jgreatly good or greatly less good but great. It is the 
country who holds the balance of power of the world, so it is just stupid 
people who talk of when it has been great , it is still great now as great 
as ancient Rome.",-0.14810859164,-0.151794479522
2667,"Greetings Youtube. My name is Yaav Benjamin Polus and I hail from Fort 
Worth, Texas. My occupation is producing squash. Simply put, I am a squash 
baron. I am the biggest producer of sqaush in the U.S and I have business 
deals with Mexico, Canada, Russia, France, England, and other various 
foreign countries. Due to my job and my wealth, I am a target for other 
rival squash barons around Texas and even from other states. I would like 
to propose an offer to the gun-toting folks on Youtube. The offer includes 
protecting my crops and defending my mansion from critters, thieves, and 
other types of beings that would wish to commit harm on my crops, which 
would also effect my business. I pay $75 per hour and I've established my 
own barracks on my land, and also food and beverages are provided. I do not 
provide guns though; you will have to have have your own firearm and that 
is why I'm asking you guys. Consider this offer because it is a very good 
one. Thank you and have a nice day.",-0.120323271089,-0.102204902219
2668,"We elected Donald Trump as president.........I can't believe it! We have 
officially screwed ourselves!",0.23983094757,-0.0593418186516
2669,"Donald trump = Hitler 2.0 



If donald wins the world doesn't makes sence anymore",0.1726189269,-0.0580406359885
2670,"trump is a terrorist. all Africans hate him. Even Paul Biya and Robert 
Mugabe are much more intelligent than Clinton and trump put together",0.455965240215,0.0190959693251
2671,*SUBSCRIBE to my channel Runningbear Sf*,-0.109563040526,-0.0862031851658
2672,Guys! You could vote for the independent parties! Just FYI,-0.135228594662,-0.114363288203
2673,TRUMP start worldwar3,0.861805335004,0.0130842666838
2674,"""WRONG""- DONALD J TRUMP",0.275288068427,-0.0398675496621
2675,"The wall is coming, the bad hombres are going bye bye.",-0.123773648382,-0.107003871622
2676,hillary FOR PRISON!!!,-0.221750916177,0.879297328256
2677,I guess we now know who won all the debates. And it WASN'T Hillary!,-0.145694866018,0.300840074653
2678,"Trump tells it like it is without the political bs . Hillary is just 
sitting there laughing , soullessly going thru lines her corrupt DMC has 
fed her . She is merely a puppet that's owned and paid , has done nothing , 
using her women card to win this election clearly didn't work out .",0.0164223826685,0.118166773991
2679,THE PURGE HAS JUST BEGINS,-0.123819648201,-0.135837724197
2680,"11 million ILLEGALS in this country and this bitch and sympathizers are 
blaise about it...
that wall will be built and the ILLEGALS will be deported!",-0.139150537037,-0.117104391622
2681,"It feels great knowing Trump has won. When he won it was one of the 
greatest moments in US history.",0.114092044221,-0.0683380496876
2682,"Sometimes, I can't tell the difference from SNL and reality.",-0.109563040526,-0.0862031851658
2683,"27:55 Gotta love the hypocrisy in the liberal democrats. Using Russia as 
the reason to vote against Trump even though Clinton accepts millions from 
Arab countries that FUND RADICAL ISLAM. ........",0.0889389545281,-0.0253528438508
2684,damn I'm glad she didn't win...,-0.108439941255,-0.0788516364193
2685,1:07:56 she has an earpiece it's so obvious glad she lost,-0.109563040526,-0.0862031851658
2686,"Drumpf has a face like a baboon's ass and a hair piece that looks like a 
dead hamster on top of his head! It's just absurd this buffoon is elected 
as president not that Hitlery is any better! Lol",-0.13501450306,-0.126637626903
2687,"Justice to all the Arab peoples vote in American elections because the 
American president will control 21 weakling Jaen Arabic
painful truth",-0.136227289593,-0.116782473369
2688,"She's worried about Toddlers getting to guns..BUT supports Abortion even in 
third term abortions? what a bunch of junk!",-0.109563040526,-0.0862031851658
2689,"""You encourage espionage against our people"" hmm..... so following laws was 
in her agenda? When did she chime in where Obama on video said there will 
not be any consequences for illegals that illegally vote for this election?",-0.147901086495,-0.10190348961
2690,thank god a criminal didn't win,-0.119769300852,-0.0943980441538
2691,"Trump is nothing but a big liar leading a bunch of racist, bigots, and 
ignorants. He is like a leader of an evil and dangerous cult of idiots.",0.15564499478,-0.0826050340539
2692,"God Trump is your new President now ! ♥
*Go look at the video on my channel where Ann Coulter was laughed at when 
she said Trump will win (If you want to of course)*",0.223578825823,-0.0684232100569
2693,"Never would have guessed ASSANGE, PUTIN, TRUMP, and the FBI in bed 
together.",0.861805335004,0.0130842666838
2694,Lmao I've never laughed so hard.,-0.109563040526,-0.0862031851658
2695,Clinton doesn't understand when Trump is trying to explain,0.210006211377,0.00482556563164
2696,"Why should we allow heroine into our country. There are all sorts of hard 
drugs in rio down in brazil and look what has happened to that country.",-0.140740271076,-0.116484853884
2697,What is that hand thing Hillary does at the end? 😂,-0.167044809531,0.263248995469
2698,"I'd like to punch Nicole Wallace in the face....and I'm a Republican. 
PRESIDENT TRUMP 2016-2024.",0.11705941628,-0.0762589977236
2699,"Hillary would have made a terrible president. Would have been scandal after 
scandal, as it has ALWAYS been with the Clintons. And she is just so phony. 
I never believed anything she said. How can anyone?",-0.165261238527,0.235250247744
2700,"obama was a total failure. trump really hit the nail on the head when he 
said clinton would be another 4 years of obama. and obama was another 8 
years of bush. obama was basically just a black democrat version of bush. I 
am glad trump won",0.0418445321093,-0.0677454506427
2701,i glad im not the only person w still watching this.,-0.133313010137,-0.10320225848
2702,"I don't understand why people come here illegally? Like, why not just take 
the necessary steps you need to be a legal immigrant? It either must be a 
super complicated process to get in, or so bad on the other side of the 
border that people are driven by desperation. Why even risk being separated 
from your family though? Because if Trump's plan to deport all illegals 
immigrants follows through, then that's probably what's going to happen, 
and they'll have no one to blame but themselves for coming here illegally 
in the first place. How are they getting through anyway? Don't we have 
people patrolling the borders? Are they being bribed, or is the border too 
extensive for them that they can't monitor every inch of it?....I just 
don't understand how it all works.",-0.04518419516,-0.137364305351
2703,"The Wikileaks hacking revealed that Hillary Clinton was informed of what 
the questions were going to be by MSNBC for all the debates. She should 
have hit them all out of the park for that reason, but she didn't.",-0.171365862427,0.313391878615
2704,"Who thinks that Trump will judge America to make her state Edmi have sinned 
but will be governed to destroy it and make it a desolation, and after the 
infection spreads to all major countries, including the land begins 
imbalances",0.0918804263226,-0.099626985521
2705,"Don't forget to watch the exclusive clip of Hillary and Donald singing 
''Breaking Free'' on my channel!",-0.113743648243,0.353812087602
2706,"Maybe it's not such a bad thing Trump got elected, it could serve as a much 
needed wake-up call to the Democrats and Liberal elites to get their heads 
out of empty liberal rhetoric and actually pursue some centre-left 
democratic socialist policies that benefit the working class.",0.0782268706641,-0.0817356124164
