,text,z1,z2
862,"“What steps will your energy policy take to meet our energy needs, while at 
the same time remaining environmentally friendly and minimizing job loss 
for fossil power plant workers?”",-0.120104904023,-0.106014353954
863,im so sad that trump is presidebr and hillary is not,0.157950284374,0.361733210879
864,"i hate you trump you are the rudest person no the you will never be a good 
president",0.111873283509,-0.0947186442801
865,#BBKFORPRESIDENT,-0.109563040526,-0.0862031851658
866,Trump is the sound I make when I fart,0.325985621887,-0.0550581164122
867,"I swear does trump really not how to debate because in a debate you say 
what you have to say and your opponent waits their turn to say what they 
want/need to say, because guess what interrupting your opponent that many 
times while their trying to get their point across without getting so mad 
to the point where you just want to punch him in the face is amazing idk 
how someone can keep their calm for such an asshole excuse for a human 
being. Next time if your gonna debate wait your turn keep your words to 
yourself UNTIL ITS YOUR TURN TO SPEAK okay lord your rattle me so much 😡",-0.0713354461993,-0.105119277197
868,"Hillary, I thought they banned the clown face costume?",-0.167271907776,0.368642075602
869,Is it legal to nominate a whale fetus?,-0.109563040526,-0.0862031851658
870,Trump so crazy...........................,0.861805335004,0.0130842666838
871,Who is stealing your jobs? China's? Totally untrue and hearsay,-0.109563040526,-0.0862031851658
872,"everybody is talking about the shimmy, but if you listen to what she says 
after her little dance move, you must See that she is the better candidate. 
I mean he was yelling, not respecting any rules of the debate but says he 
has a great Temperament!? com on, you can't Turn yelling and interrupting 
others Into something good. she is totally right with the Radio active 
weapon Argument.",-0.138440701493,-0.105653836767
873,Both are cunts so there's no point in voting.,-0.115061952755,-0.091677922401
874,I think she's more prepared.,-0.127437053741,-0.0923096201149
875,Donald's inherent racism is just.... 1:05:06,-0.0423328861768,-0.108716654481
876,#imwithher go hillary!!!,-0.221750916177,0.879297328256
877,"If one of them becomes the next president, the US will be doomed I can 
assure you that!",-0.108969724908,-0.118196529524
878,I am moving to Canada,-0.109563040526,-0.0862031851658
879,"""I know you live in your own reality"" YAS HILLARY GET THAT BISH",-0.170096506969,0.26460895573
880,Jillary stienton,-0.109563040526,-0.0862031851658
881,"""over the last ...little while"" 😂",-0.109563040526,-0.0862031851658
882,Triggered...,-0.109563040526,-0.0862031851658
883,"Even JILL STEIN says in a recent interview ""HILLARY WILL START NUCLEAR WAR 
WITH RUSSIA BECAUSE OF HER POLICIES."" All other candidates in this election 
are far less dangerous than Hillary. This is not main stream news so 
research the facts and spread the news.",-0.17562290316,0.336705294363
884,I feel sorry for Americans,-0.123720869762,-0.10888122097
885,im so distracted by trumps sniffles,-0.123814229024,-0.0873163743488
886,"I hate both of their stupid faces they're both a bunch of lying pieces of 
Sh*t this country is doomed no matter who wins.",-0.11470738568,-0.105416615898
887,"I'll vote whoever makes a campaing to support Syrian children's and 
innocent people, why dont they have that kind of plans, people like them 
need you",-0.132614159827,-0.112344376844
888,"So the fema camps, the election fraud, the marcial law, and the antichrist 
obama and his muslims brothers taking over united states are not happening 
anymore, as many allready said it? Saad! Its everything over then? Can i 
get out of my hole now? is it safe to come outside now?",-0.130999421138,-0.104484650836
889,Doesn't Vladimir Putin hate Clinton?,-0.104189506358,-0.0451458956085
890,"Hillary is a PROVEN EMPTY HEADED PUPPET OF THE JEW, loyal only to her bank 
account and the 'clinton foundation for money laundering' of the MONEY THE 
JEWS give her to continue to commit TREASON, when her and the rest of the 
JEW KLUTZ KLAN gang, betray the American PEOPLE and the USA CONSTITUTION, 
by them defending and obeying the JEWS, born anywhere, loyal only to israel 
and THEMSELVES,
Donald Trump is a successful BUSINESSMAN, very rich, that understands 
BUSINESS and the JEWS he does 'business' with. There is certain financial 
LAW of survival, when dealing with JEWS, that MUST be obeyed if one is to 
survive. That LAW has UNIVERSALLY PROVEN TO BE TRUE, that the LESSON 
HISTORY TEACHES, has PROVEN TO BE TRUE...
NEVER TRUST THE JEW.
Joe Magnets",0.00865786770947,0.0735210984105
891,vote for hillary because trump is a raises,0.227901088674,0.487262526648
892,The only reason America is not is because of Donald Trump,0.30797259636,-0.0642575650706
893,"im not sure but i think trump is a going to be a very good for america 
cause of his business management skills",0.038726788232,-0.101505445869
894,"Honestly, I like Bernie Sanders better that these two candidates. Bernie 
didn't have any scandals and is just..very fit for president! Unlike Donald 
Trump! Well, Donald Trump just drags on about the same thing and only 
criticizes Hillary. Also, his dumb idea to ""build a wall"" is terrible! How 
can this man become president. Anyway, i find Hillary slightly better 
because she has experience from Bill Clinton. That's not only why, but 
Hillary can make the democracy a better place and totally doesn't make fun 
if people with disabilities. Hillary is a fighter! This is my opinion about 
these candidates. As you can see, I would be satisfied if Bernie Sanders 
didn't lose the democratic nomination and can become president of the 
United States.",0.0230107594094,0.249413673311
895,"Well, looks like Obama was not that antichrist who many self called 
prophets and religious people said was going to bring down america to its 
knees. So, who is going to be that so waited antichrist now? Is it going to 
be trump now?",-0.0105445396935,-0.103829407816
896,"Bill and Hillary as husband and wife are two halves of the same rotten 
apple !",-0.221750916177,0.879297328256
897,"Trump how many countries can you name?

Trump: Well there's America, then Mexico can't forget about those people, 
and China. Then there's you know the bigger Mexico, then the countries next 
to China and did I already mention Mexico? Ooh and China, did I mention 
China? And Mexico of course",0.195992512301,-0.0824300554626
898,Hillary Clinton is gonna win,-0.159347776858,0.305973054064
899,"Why either one of these petty bickering people would make a great 
president.",-0.12461493791,-0.136396578714
900,"But electoral college just ruins democracy and we're not even voting, the 
representatives in the white house vote for us",-0.131165696762,-0.109498906177
901,"why did he keep snorting? has he sniffed something that's irritating his 
nostrils. what an ugly boorish bully of a man.",-0.119733443481,-0.0997761674659
902,"Donald and his party of lunatics are wrong about everything. Trump is just 
fearmongering and lieng about everything, and many racist, supremacist, and 
bigot republicans are loving it.",0.172912956192,-0.0855419752838
903,"I live in Orange County California, I work for my fathers company and every 
person that wants to discuss this election has told me that they are voting 
for Trump, even women are telling me this. They all say how much they can't 
stand Clinton. In fact I have yet to have one person admit they are voting 
for Clinton or even say something positive about Clinton. Is the media 
trying to cover up a Trump landslide victory?",0.0430648127919,-0.0295796958723
904,election with result combined for to elect hillary,-0.179378189167,0.404308311072
905,"I can´t undesrstand all the stuff going around about hillary and Trump. I´m 
from Austria( NO NOT AUSTRALIA, AUSTRIA) and there is no question about 
""who to vote for"". It´s simple: Everything about trump got leaked(playboy 
etc) but was that really that bad? I mean, what´s so bad about someone who 
has some stuff going on, that shouldn´t even interest anybody outside his 
family. Ever heard about privacy? But Hillary is just evil. And to all the 
people that say"" I hate trump he said some pervert stuff""´: SHUT THE 
FU**UP. You don´t even wanna know how the austrian people are laughing 
about the hillary voters. Even in school we learn how hillary is going to 
destroy the world if she wins. It´s simple: Hillary just wants the power, 
she doesn´t care for the normal people LIKE YOU, she will just help the 
rich ones-trust me. If i see trump I see someone who did some mistakes, if 
i see hillary i see someone who will do mistakes. And even if I ignore 
everything I already siad: I can´t look at Hillary without seeing someone 
who WILL start a war. 
My mother always says to me that there is no election-because hillary got 
the right people on her side and that your vote doesn´t count because she 
already won.

IF THAT HAPPENS: ARM YOURSELF AND PROTECT YOURSELF AGAINST HER. If voters 
can´t stop her, bullets can.
I´m sorry for my Englisch, I know its not the best.",-0.00913059953824,0.368760379722
906,"""BAIT AND SWITCH"" she's crazy also Lester the feels are strong i would have 
bought a gun with me",-0.109563040526,-0.0862031851658
907,"why are people Muslim, or Christian, or Jewish, in this day and age? it 
doesn't make sense, but Islam is the rising religion. it makes sense as a 
cultural thing - I'm a cultural christian, a cultural Lutheran, i share the 
cluster of values associated with Norwegian Protestantism, but not the 
modern liberalism pathological altruism of it. but to take it seriously? 
they are either not the brightest or else they are cultural Muslims, and 
I'm not sure our two cultures are assimilable",-0.123559289989,-0.113319524588
908,My birth is November 8th!,-0.109563040526,-0.0862031851658
909,"1:06:55 What the hell Trump's saying? :) ""Wrong"" ? sounds like the sound of 
a wine bottle being opened in an empty room.",0.130334672956,-0.0716096747255
910,"Yesterday : A Republican Today : A rapist Tomorrow : A president democrate 
Magical, Poor America
For a good opinion
See: WikiLeaks Clinton",-0.137905176545,-0.0875530950373
911,"How did we end up with these two as the major presidential candidates!? The 
world is laughing at America. I hope, by some miracle, neither one becomes 
President. Come on, America! We have the power to elect someone else!",-0.141255202279,-0.134539725194
912,and donald trump htes mexico,0.41599115366,-0.0225654244227
913,"'America is GREAT, because America is GOOD"" - Hillary Clinton 2016. Trump 
gets rekt by Clinton. I know you live in your own reality",-0.0343056166246,0.144394500677
914,Люблю Америку,-0.109563040526,-0.0862031851658
915,IT'S TIME TO AMERICA TO FAIL,-0.139663771934,-0.137328406607
916,Mac Demarco for President,-0.108969724908,-0.118196529524
917,I like Gary Johnson,-0.121048239845,-0.103946755657
918,inshallah hillary will win!,-0.165405941257,0.409060459399
919,INFOWARS.com,-0.109563040526,-0.0862031851658
920,ZOOBOO,-0.109563040526,-0.0862031851658
921,"i hate trump he wants the worldfight!!! why choosed u tramp he is sooo bad 
!!☝",0.128046581955,-0.0747916206985
922,-and,-0.109563040526,-0.0862031851658
923,"Not that I support Hillary I just think she is the lesser of two evils. I 
just can't justify putting a racist person who promotes violence as the 
figure head of America, the most Diverse country in the world. Not all of 
his ideas are awful, some are are actually good but I just can't take them 
seriously coming from his mouth.",-0.158659813661,-0.000177574951784
924,"Hillary Clinton is a globalist bitch that needs to be going to prison, not 
the White House!!!",-0.171014194965,0.396484530613
925,WRONG!,-0.109019360346,-0.0865257799637
926,"if trump win I'm gonna need to read rules and regulations and sign up for 
slavery",0.114982306758,-0.0707815357174
927,"Trumps an idiot.
Hillary also sucks.
But trump sucks even more.",0.401568860426,0.734817510083
928,"WE LOVE YOU TRUMP!!!!
🇺🇸🇺🇸🇺🇸🇺🇸🇺🇸🇺🇸🇺🇸🇺🇸",0.268646628535,-0.0529088790508
929,Vote Trump! Vote Putin!,0.113677497902,-0.0578247225389
930,look in her eyes it has no soul it gives me chills,-0.120762328108,-0.0934081486103
931,id rather Kanye.,-0.109563040526,-0.0862031851658
932,Kanye West 2020,-0.109563040526,-0.0862031851658
933,"Either way...i think America will suckl...I'm moving to freak'en 
Canada....or russia",-0.14080924463,-0.113719276083
934,hillary your plan is management Trump is a vision of success,0.401568860426,0.734817510083
935,"The last good president we had was George Bush. We really need another 
Ronald Reagan. Who agrees with me?",-0.126315609202,-0.124319592494
936,Obama :(,-0.130982889184,-0.093100143807
937,"Wake up undecided voters please look at the new Wiki leaks emails. In the 
emails, it reveals how Hillary wants OPEN BORDERS and will not go after 
WALL STREET but will help WALL STREET! In addition, emails show that 
Chelsea does not trust her own parent’s foundation and had it internally 
investigated, you can’t be making this up folks! Also, emails expose how 
HILLARY hates the CATHOLICS and everyday people, unbelievable! And Bernie 
supporters Hillary called you lazy and not motivated when she said you live 
in your parents basements, she does not think highly of you, wake the hell 
up! Also, Hillary helped a man avoid jail time for RAPING a 12 yr old girl 
40 yrs ago! LOOK IT UP! Hillary lied about the emails and Benghazi, hell 
she sold out your nation by selling classified information to enemies of 
the U.S. LOOK UP PAY TO PLAY ABOUT HILLARY SELLING OUT THE USA! Finally, 
under HILLARY AND OBAMA there has been more racial riots then w the 
previous 5 presidents! And u r still voting for her? WHAT THE HELL IS WRONG 
W U! You want to sell out your nation like Hillary has?",-0.211146586881,0.535681462685
938,I wish i was not american. I dont want to deal with this type of crap,-0.13182899378,-0.107931554482
939,"It doesn't matter who wins. In the end, we all lose.",-0.104091673071,-0.0879857019057
940,Best comedy so far. Can't wait for the next parts to come out!,-0.119362601642,-0.102675358505
941,Trump2016 because leading from behind like Obama got is no where,-0.128851756902,-0.102768265528
942,I'm German and that's exactly how Hitler started. The same arguments...,-0.109563040526,-0.0862031851658
943,Can i vote for the 12year old kid down the street insteed,-0.125399622038,-0.0870240020717
944,"MSNBC SUCKS!! I don't watch the MSM BECAUSE THEIR ALL CORRUPT! Lies, lies, 
cheats.",-0.13391626147,-0.10718897031
945,"team mystic vs team valor, while team instinct (bernie) is just the 
underdog",-0.123819648201,-0.135837724197
946,This is the best Jerry Springer episode yet.,-0.117848852729,-0.100867078178
947,"So greedy.. That doesn't make you ""smart"". When you want to take ffrom the 
people and expect yourself to give nothing... Sick your words are as 
sickening as your ambiance...",-0.122825059543,-0.113736884022
948,"Is Trump really crying about Hillary's campaign ads being ""not nice""? Lmao",0.192806074786,0.403023128912
949,"Omg hadn't seen this yet. This guy completely destroyed her, the media, and 
exposed them all. Just wow.",-0.124141649979,-0.118316073135
950,"Clinton brings up the fact that Trump said he hoped the housing market 
collapsed back in 2006 so he could buy some.
Trump interrupted and said ""that's called business by the way""

It is called everything that is wrong with our society. The super rich are 
crushing the working class by paying slave wages all while they pile money 
up to the moon at the greatest rate in history.
F you Donald peoples life savings evaporated and you take advantage to make 
more money that you do not even need. There are real issues with Clinton 
being cozy with big business etc. But Trumps statement shows he does not 
give a damn about the working class in this country.",0.0594268064752,-0.0471671364941
951,"You are basically voting for Kang and Kodos (Yep, remember that episode).",-0.115061952755,-0.091677922401
952,"At first i thought it was pretty hilarious that Donald Trump was actually 
running for president, because obviously he would never succeed. Now its 
not so funny anymore, and all stereotypes about american logic has been 
confirmed. WHO would vote for this idiot. Americans are officially dumber 
than dumb. Im so happy that i dont live there, and this whole presidential 
race is a JOKE. America is such a big economy in this world, and someone 
with Trumps sense is gonna ruin everything build over the last decade. 
America is gonna go down with the flag and the rest of the world will 
follow. The dollar is too important a currency to risk someone like this 
being in charge.",-0.0121139021971,-0.120400651324
953,"Donald Trump may be an idiot, but Hillary Clinton is downright dangerous to 
our democracy. Thanks to her, we no longer have a Department of Justice; 
rather, we have a Department of Obstructing and Corrupting Justice to 
protect the power elite of the chosen side.",0.138183512006,0.309983134187
954,"""My husband did a great job in the '90's."" No, he didn't. With the Clinton 
firearm laws from the '90's, he screwed over plenty of American business 
men and women, infringed on our 2nd Amendment, which are already heavily 
debated.

How is a law going to affect a criminal? Criminals don't obey the laws; if 
a criminal wants something, they get it. No amount of legislation or laws 
will change that.

The firearm laws are all I really know about Bill Clinton, but I do know 
that his bill put people out of business. That being said, I'm not voting 
for either of these ass clowns.",-0.145896830522,-0.0783860121265
955,For the longest time I forgot that Lester was even there. Poor guy,-0.125014766953,-0.109552845572
956,"Don't vote for humpety Trumpety or killary Hillary. Write in 
""Constitutional Convention"" in the presidential slot on the ballot November 
8th 2016!",-0.163044958208,0.239166327556
957,What a cat fight....so when's the debate gonna start? 🤔,-0.1414023722,-0.104460299382
958,Tom Brokaw is turning into George Burns,-0.109563040526,-0.0862031851658
959,"I vote for Hillary, in Mexican and Trump is making a wall.",0.227901088674,0.487262526648
960,Any guava juice or wtf Brahs here,-0.109563040526,-0.0862031851658
961,I think Donald should marry Putin...,-0.0539628561022,-0.0797101608393
962,16:52 I can't stop laughing,-0.109687574798,-0.0841445184309
963,I am not American. But boy this is entertaining.,-0.131476558152,-0.112260708659
964,"I would say that it is good to have someone in the White House that is of 
the Left Hand Path and practices witchcraft. However she clearly does not 
have peoples individual freedom in mind and plans to enslave as many as 
possible. She is supported by some powerful demonic spirits.",-0.129095230996,-0.102362566803
965,"I'm so glad I'm not American after watching this but I feel like it vaguely 
mimics UK politics in the way that Trump is like the Conservative party, 
favouring only the rich and Hillary is like the Labour Party, wanting to 
improve the lives of people already struggling instead of making the rich 
even richer and disregarding those who need support from the government",-0.027073718154,0.0528864493179
966,"Why so many sniffing stuffs and interfering? Where the hell did thing 
called respect go -_-",-0.124868500981,-0.0926848933012
967,"Where are the other parties?! There aren't just two.. show America all the 
parties. Stop being biased on converge.",-0.133825391445,-0.136961480942
968,فيه سعودين هنا 😂,-0.109563040526,-0.0862031851658
969,"If Trump stop keep interrupring the other's talk，then i believe he is a 
gentleman...while he 's definitely not a gentleman，through his “locker room 
talk”i think he's creepy，i've been in gym for years but i never heard that 
kind of “locker room talk”.dude，if you were wrong，just look straight to 
it、just apologize ,stop finding excuses for your fault.And i just wonder 
why he's so angry like a drunk daddy…I know little about Hillary，but 
damn、that lady is powerful，at least she doesnt avoid her mistake，and she's 
polite during the debate，so guess i will support her",-0.0716651944504,-0.00328667759876
970,"Honestly, this debate was drawn to a standstill by both Hillary and Trump 
trying to discredit one another. Hillary should be in prison for what how 
she handled federal documents and state secrets. Honestly, I'll take Trump 
and his ego any day over Hillary's suspected breach in National security.",0.193568828611,0.728781033697
971,"To be honest I think Mike Pence should run for president, because even 
though Trump kind of knows what he's doing Mike Pence would be a better 
option.",0.15602116683,-0.0739821765303
972,"""When the debate is lost, slander becomes the tool of the loser"" -Socrates",-0.15087148249,-0.105640811752
973,Trump has no idea what he's talking about.,0.249764720201,-0.0461695036302
974,"Dude...I'm in Italy and I'm not American! But if in two years I have to 
move there I don't know what I'm gonna do! These people are ridiculously 
stupid and evil! I'm anxious just thinking I have to pass my half of life 
in America! I really hope this will not gonna happen!they couldn't choose 
Barney omg!",-0.150393385002,-0.138356475082
975,Pedro Fadul Presidente!,-0.109563040526,-0.0862031851658
976,Beyoncé should be president right?,-0.118097093755,-0.107955396364
977,"I'm voting for Donald Trump because he stands up for actual justice. Plus 
he's not a crooked politician. The media keeps sucking Hillary off. Yes 
Trump made some bad remarks, but he has been unapologetic that's why I'm 
voting for Trump. He doesn't switch up his views when challenged by the 
Media and politicians.

Say what you want. #DonaldTrump has ran a great campaign.",0.214182632098,0.0641298192588
978,"Trump is such a selfish businessman that he and only he would sell his soul 
to the devil for only 10 bucks but I don't want to vote for Clinton Either 
:/.",0.118769224901,-0.0180955934031
979,"Lmao I put this on for something in the background as I was doing homework 
but this got so interesting that I just ended up watching 38 minutes 
instead, ah, even though I hate politics and don't live in America. XD",-0.1383846092,-0.143896415156
980,"I honestly think that Americans don't want either of them in power, (both 
of them are terrible) it just seems that people (I) don't want Trump more.",-0.0108182398093,-0.116531169349
981,"1:17:00

""Iran,[...] a country who was ready to fall, [...]and now they will 
probably be a major power at some point pretty soon.""

I don't get it. Does that mean, that to ""make america great again"", others 
have to fall?",-0.15245021196,-0.142559415237
982,Donaldtrumpbillcosbydonaldtrumpbillcosbydonaldtrumpbillcosbydona.....................>,-0.109563040526,-0.0862031851658
983,"""most of them are trying to make up their minds"" 
Well yeah, they're trying to find the lesser of 2 evils.",-0.114986558874,-0.101762275994
984,tbh Mickey Mouse would have made a better president,-0.114387466356,-0.10286694446
985,Did he just imply that China should invade North Korea????!!??!??!???!!???,-0.127086186316,-0.118650695777
986,"they're both horrible candidates... and the sad thing is, it's only evil vs 
evil in this election and we're screwed either way...",-0.130593147664,-0.0973282685775
987,"i think hillary calling trump supporters deplorable is actually a 
compliment. if i had to think of something nice to say about those 
trumptards that live in a delusional world i think that would be the nicest 
thing i could think of. i dont see what the problem is",-0.0474620142981,0.0410330225055
988,Idc who wins but for god sake stop interrupting.,-0.11416684578,-0.0927631763376
989,They are both pretty bad tbh,-0.121325937421,-0.108992255172
990,do you wanna be my boyfriend,-0.109563040526,-0.0862031851658
991,Danny Williams,-0.109563040526,-0.0862031851658
992,Is time to invest property in US.,-0.120500009205,-0.106237479021
993,"Can you imagine if someone upset Trump? We all wouldn't survive the nuclear 
bomb! You all should protest and vote Obama to stayed president!!!!",0.15165543719,-0.07259132684
994,Hillary wants to hump Trump...bet her Tenna lady is full to bursting point,0.177972959341,0.385122793653
995,"Really, the shiniest of two turds? That's what we have to choose?",-0.120473029173,-0.0992704842573
996,"Unfortunately no one can be told what the matrix is, you have to see it for 
yourself. This is your last chance, after this there is no turning back. 
You take the blue pill, the story ends, you wake up in your bed and believe 
whatever you want to believe. You take the red pill, you stay in wonderland 
and I show you how deep the rabbit hole goes. And remember, all I'm 
offering you is the truth.",-0.118306566792,-0.0918306179258
997,THEY TOOK OUR JEWBZ,-0.109563040526,-0.0862031851658
998,Hrambe is the best of all people and trump,0.198491160886,-0.0827842500912
999,"Trump what about the Trump taj Mahal what about all those jobs you can't 
judge other companies if you do the same thing (hypocrite)",0.50679336512,-0.0264206592816
1000,"Trump: ""I have a much better temperament than she has""
Hillary + the world: ""WRONG""",0.0813146573642,0.228266912532
1001,I want Donald to win so that World war 3 happens sooner.,-0.0832226372218,-0.0855978985995
